wav_file,txt_file,groundtruth_text_raw,groundtruth_text_train,duration,AAVE
../data_processed/wav/DCB_se3_ag4_m_01_1_part_13.wav,../data_processed/txt/DCB_se3_ag4_m_01_1_part_13.txt,"What was it- like how was it back then? Was it- how was it back then? /?? amongst/ the people. Like as [far as] [It was-] [it was good.] [the interaction.] It was good. You know, but because we had- it wa- our neighborhood was unique from the standpoint that you know where Adams Morgan is, that was mostly just Hispanic. Mm. You know? There wasn't- and there- and there were",WHAT WAS IT LIKE HOW WAS IT BACK THEN WAS IT HOW WAS IT BACK THEN AMONGST THE PEOPLE LIKE AS FAR AS IT WAS IT WAS GOOD THE INTERACTION IT WAS GOOD YOU KNOW BUT BECAUSE WE HAD IT WA OUR NEIGHBORHOOD WAS UNIQUE FROM THE STANDPOINT THAT YOU KNOW WHERE ADAMS MORGAN IS THAT WAS MOSTLY JUST HISPANIC MM YOU KNOW THERE WASN'T AND THERE AND THERE WERE,20.135,1
../data_processed_voc/wav/voc_34_part_170.wav,../data_processed_voc/txt/voc_34_part_170.txt,"I wish, you know th- -- (( )) that house was gorgeous. I mean the tile roofs, the {BR} the whole nine yards, it they had their office in the house. {BR} So uh {BR} And For a while I think it was (( )) m- businesses in -- (( )) like continued on, but {BR} Yeah, that was {BR}",I WISH YOU KNOW TH THAT HOUSE WAS GORGEOUS I MEAN THE TILE ROOFS THE THE WHOLE NINE YARDS IT THEY HAD THEIR OFFICE IN THE HOUSE SO UH AND FOR A WHILE I THINK IT WAS M BUSINESSES IN LIKE CONTINUED ON BUT YEAH THAT WAS,22.026999999999997,0
../data_processed/wav/ATL_se0_ag1_m_04_1_part_30.wav,../data_processed/txt/ATL_se0_ag1_m_04_1_part_30.txt,"You evolve your mind, you'll understand what I'm saying. But if you can't, then you just ain't got that yet. It's levels to this life thing.",YOU EVOLVE YOUR MIND YOU'LL UNDERSTAND WHAT I'M SAYING BUT IF YOU CAN'T THEN YOU JUST AIN'T GOT THAT YET IT'S LEVELS TO THIS LIFE THING,6.032,1
../data_processed/wav/PRV_se0_ag2_f_02_2_part_50.wav,../data_processed/txt/PRV_se0_ag2_f_02_2_part_50.txt,"And I just saw a f- f- um, <ts> it's a few puddles of water in the road. And like I said, oh that gonna be gone, you know, after a while. So that Thursday night, I, uh, um, we all went to bed. I charged my phone up. (laughing) And I-",AND I JUST SAW A F F UM IT'S A FEW PUDDLES OF WATER IN THE ROAD AND LIKE I SAID OH THAT GONNA BE GONE YOU KNOW AFTER A WHILE SO THAT THURSDAY NIGHT I UH UM WE ALL WENT TO BED I CHARGED MY PHONE UP AND I,21.99,1
../data_processed/wav/ATL_se0_ag2_f_01_1_part_10.wav,../data_processed/txt/ATL_se0_ag2_f_01_1_part_10.txt,"Because I feel like a friend is somebody that you should be able to call on and rely on in like the toughest times of your life, and if it's only for me to just party with you, um, yeah not- that's not gonna happen. [Like I need you to]",BECAUSE I FEEL LIKE A FRIEND IS SOMEBODY THAT YOU SHOULD BE ABLE TO CALL ON AND RELY ON IN LIKE THE TOUGHEST TIMES OF YOUR LIFE AND IF IT'S ONLY FOR ME TO JUST PARTY WITH YOU UM YEAH NOT THAT'S NOT GONNA HAPPEN LIKE I NEED YOU TO,14.667,1
../data_processed_voc/wav/voc_18_part_569.wav,../data_processed_voc/txt/voc_18_part_569.txt,so I drove him down in my car I had a big uh Mercury Marquis Broome at the time and so anyway when he come out of s- ut- before he came out of recovery the nurse came out and asked me because when we were driving down we stopped in Williams to get some gas and he come walking out with one of these,SO I DROVE HIM DOWN IN MY CAR I HAD A BIG UH MERCURY MARQUIS BROOME AT THE TIME AND SO ANYWAY WHEN HE COME OUT OF S UT BEFORE HE CAME OUT OF RECOVERY THE NURSE CAME OUT AND ASKED ME BECAUSE WHEN WE WERE DRIVING DOWN WE STOPPED IN WILLIAMS TO GET SOME GAS AND HE COME WALKING OUT WITH ONE OF THESE,21.656,0
../data_processed/wav/DCB_se3_ag4_m_01_1_part_3.wav,../data_processed/txt/DCB_se3_ag4_m_01_1_part_3.txt,"up through nineteen- I left there about nineteen seventy seven. So um, the demographics have changed drastically. I mean it was primarily an African American neighborhood. S- some diversity uh, but now",UP THROUGH NINETEEN I LEFT THERE ABOUT NINETEEN SEVENTY SEVEN SO UM THE DEMOGRAPHICS HAVE CHANGED DRASTICALLY I MEAN IT WAS PRIMARILY AN AFRICAN AMERICAN NEIGHBORHOOD S SOME DIVERSITY UH BUT NOW,20.362,1
../data_processed/wav/DCB_se1_ag4_m_02_1_part_24.wav,../data_processed/txt/DCB_se1_ag4_m_02_1_part_24.txt,"We can pay that for- If we can pay that in rent for a apartment, shit that's a- that's a house note. And not- it's not now. Four hundred- four hundred- five hundred dollars, you lucky if you get a- if you get a decent room in a decent area. And, um, <ts> and they're not treating us any different. In fact, they treating us worse, but, uh, the teenagers are causing that.",WE CAN PAY THAT FOR IF WE CAN PAY THAT IN RENT FOR A APARTMENT SHIT THAT'S A THAT'S A HOUSE NOTE AND NOT IT'S NOT NOW FOUR OH FOUR OH FIVE HUNDRED DOLLARS YOU LUCKY IF YOU GET A IF YOU GET A DECENT ROOM IN A DECENT AREA AND UM AND THEY'RE NOT TREATING US ANY DIFFERENT IN FACT THEY TREATING US WORSE BUT UH THE TEENAGERS ARE CAUSING THAT,21.551,1
../data_processed/wav/DCB_se1_ag4_f_01_2_part_63.wav,../data_processed/txt/DCB_se1_ag4_f_01_2_part_63.txt,"You know, if you just listen. And you know and just stop with- with all this. Well you know this that and I go get my mother and you know my sister and you know all this and that, I- /no one have/ time for that. No. <ts> so my- my f- the best thing I could tell kids today is listen. Listen. You'd be surprised what you can learn just by listening.",YOU KNOW IF YOU JUST LISTEN AND YOU KNOW AND JUST STOP WITH WITH ALL THIS WELL YOU KNOW THIS THAT AND I GO GET MY MOTHER AND YOU KNOW MY SISTER AND YOU KNOW ALL THIS AND THAT I NO ONE HAVE TIME FOR THAT NO SO MY MY F THE BEST THING I COULD TELL KIDS TODAY IS LISTEN LISTEN YOU'D BE SURPRISED WHAT YOU CAN LEARN JUST BY LISTENING,22.06,1
../data_processed_voc/wav/voc_7_part_351.wav,../data_processed_voc/txt/voc_7_part_351.txt,{LG} I gotta over and see him. He lives in (())  at a home over there I think.,I GOTTA OVER AND SEE HIM HE LIVES IN AT A HOME OVER THERE I THINK,6.827000000000001,0
../data_processed_voc/wav/voc_30_part_154.wav,../data_processed_voc/txt/voc_30_part_154.txt,"twang a little bit um so yeah I think so, I mean I feel like there's like a southern accent, people have like southern accents or like boston accents-- so like yeah I think so but to us it's normal I think we're normal right, they just have the accents right {LG} but obviously maybe to them, we have a California accent, I don't know {LG}",TWANG A LITTLE BIT UM SO YEAH I THINK SO I MEAN I FEEL LIKE THERE'S LIKE A SOUTHERN ACCENT PEOPLE HAVE LIKE SOUTHERN ACCENTS OR LIKE BOSTON ACCENTS SO LIKE YEAH I THINK SO BUT TO US IT'S NORMAL I THINK WE'RE NORMAL RIGHT THEY JUST HAVE THE ACCENTS RIGHT BUT OBVIOUSLY MAYBE TO THEM WE HAVE A CALIFORNIA ACCENT I DON'T KNOW,24.809,0
../data_processed/wav/PRV_se0_ag2_m_01_1_part_87.wav,../data_processed/txt/PRV_se0_ag2_m_01_1_part_87.txt,"So you know, that's- that's something there, working with a computer that I'm learning how to- I'm learning how to do. You know, he gonna show me different things, how to-",SO YOU KNOW THAT'S THAT'S SOMETHING THERE WORKING WITH A COMPUTER THAT I'M LEARNING HOW TO I'M LEARNING HOW TO DO YOU KNOW HE GONNA SHOW ME DIFFERENT THINGS HOW TO,5.846,1
../data_processed/wav/DCB_se2_ag4_f_02_1_part_183.wav,../data_processed/txt/DCB_se2_ag4_f_02_1_part_183.txt,"now depending on what- which restaurant you go to it'll be orange, it'll be brown, it'll be purple, it'll be light, it'll be dark, it's not consistent anymore.",NOW DEPENDING ON WHAT WHICH RESTAURANT YOU GO TO IT'LL BE ORANGE IT'LL BE BROWN IT'LL BE PURPLE IT'LL BE LIGHT IT'LL BE DARK IT'S NOT CONSISTENT ANYMORE,9.789,1
../data_processed/wav/DCB_se2_ag4_f_02_1_part_48.wav,../data_processed/txt/DCB_se2_ag4_f_02_1_part_48.txt,"[You had] the girls who were uh, you know I'm not gonna say they were bullies but they were",YOU HAD THE GIRLS WHO WERE UH YOU KNOW I'M NOT GONNA SAY THEY WERE BULLIES BUT THEY WERE,6.555,1
../data_processed/wav/ROC_se0_ag2_m_01_4_part_20.wav,../data_processed/txt/ROC_se0_ag2_m_01_4_part_20.txt,"But, I know the story. So, I'm gonna tell it to you. And, I'll embellish it, so next time it's a little more entertaining. However I need it to be, but you know the basic story. Well that then says to a student, one, I don't need to have mastery of language. That's the mainstream mastery of it. I just need to have a mastery of concept.",BUT I KNOW THE STORY SO I'M GONNA TELL IT TO YOU AND I'LL EMBELLISH IT SO NEXT TIME IT'S A LITTLE MORE ENTERTAINING HOWEVER I NEED IT TO BE BUT YOU KNOW THE BASIC STORY WELL THAT THEN SAYS TO A STUDENT ONE I DON'T NEED TO HAVE MASTERY OF LANGUAGE THAT'S THE MAINSTREAM MASTERY OF IT I JUST NEED TO HAVE A MASTERY OF CONCEPT,22.081,1
../data_processed/wav/DCB_se1_ag3_f_03_1_part_152.wav,../data_processed/txt/DCB_se1_ag3_f_03_1_part_152.txt,"And she lived over there since she was young, since she was little. Her mom passed and everything, and she was still there. She said she was the last African American in her building. And them people- When I say my girlfriend lived there for a long time, everybody in the building was African American. And they lived there for a long time, they got pushed out.",AND SHE LIVED OVER THERE SINCE SHE WAS YOUNG SINCE SHE WAS LITTLE HER MOM PASSED AND EVERYTHING AND SHE WAS STILL THERE SHE SAID SHE WAS THE LAST AFRICAN AMERICAN IN HER BUILDING AND THEM PEOPLE WHEN I SAY MY GIRLFRIEND LIVED THERE FOR A LONG TIME EVERYBODY IN THE BUILDING WAS AFRICAN AMERICAN AND THEY LIVED THERE FOR A LONG TIME THEY GOT PUSHED OUT,20.415,1
../data_processed_voc/wav/voc_23_part_7.wav,../data_processed_voc/txt/voc_23_part_7.txt,the business eighty on one side to the othe reighty on there and it's just a big suburban area,THE BUSINESS EIGHTY ON ONE SIDE TO THE OTHE REIGHTY ON THERE AND IT'S JUST A BIG SUBURBAN AREA,6.402,0
../data_processed_voc/wav/voc_23_part_75.wav,../data_processed_voc/txt/voc_23_part_75.txt,feeling everyone's trying to be the same and (()) so it's not uh you know and then in the pocket -- and this is interesting there was actually an article about Kennedy High School where my daughter went where it was ranked as the most diverse high school in America,FEELING EVERYONE'S TRYING TO BE THE SAME AND SO IT'S NOT UH YOU KNOW AND THEN IN THE POCKET AND THIS IS INTERESTING THERE WAS ACTUALLY AN ARTICLE ABOUT KENNEDY HIGH SCHOOL WHERE MY DAUGHTER WENT WHERE IT WAS RANKED AS THE MOST DIVERSE HIGH SCHOOL IN AMERICA,16.032,0
../data_processed/wav/DCB_se2_ag2_m_01_1_part_108.wav,../data_processed/txt/DCB_se2_ag2_m_01_1_part_108.txt,"Arlington, Virginia. So I got tired of um, <ts> traveling across the bridge, so I just- just decided to live in Virginia.",ARLINGTON VIRGINIA SO I GOT TIRED OF UM TRAVELING ACROSS THE BRIDGE SO I JUST JUST DECIDED TO LIVE IN VIRGINIA,6.432,1
../data_processed/wav/PRV_se0_ag1_f_01_2_part_23.wav,../data_processed/txt/PRV_se0_ag1_f_01_2_part_23.txt,"look at television, and call it a day. I'm leaving school work to the side cause I don't have nothing due, so when I left Friday, I left school for a whole week.",LOOK AT TELEVISION AND CALL IT A DAY I'M LEAVING SCHOOL WORK TO THE SIDE CAUSE I DON'T HAVE NOTHING DUE SO WHEN I LEFT FRIDAY I LEFT SCHOOL FOR A WHOLE WEEK,9.455,1
../data_processed_voc/wav/voc_10_part_161.wav,../data_processed_voc/txt/voc_10_part_161.txt,now these little kids are born here ... and they've learned out language,NOW THESE LITTLE KIDS ARE BORN HERE AND THEY'VE LEARNED OUT LANGUAGE,5.142,0
../data_processed/wav/PRV_se0_ag1_f_01_1_part_65.wav,../data_processed/txt/PRV_se0_ag1_f_01_1_part_65.txt,"and a lot of people just- before they left- the- they knew when it- um, fire department came through, was like, telling 'em to evacuate, they let they dogs go.",AND A LOT OF PEOPLE JUST BEFORE THEY LEFT THE THEY KNEW WHEN IT UM FIRE DEPARTMENT CAME THROUGH WAS LIKE TELLING 'EM TO EVACUATE THEY LET THEY DOGS GO,6.691,1
../data_processed_voc/wav/voc_0_part_51.wav,../data_processed_voc/txt/voc_0_part_51.txt,But it's not a big cave. It's only three feet uh bout three feet wide six or eight feet deep. And we used to get I don't whether when you were young but we would get potatoes and throw them into the fire and wait until they just burn up.,BUT IT'S NOT A BIG CAVE IT'S ONLY THREE FEET UH BOUT THREE FEET WIDE SIX OR EIGHT FEET DEEP AND WE USED TO GET I DON'T WHETHER WHEN YOU WERE YOUNG BUT WE WOULD GET POTATOES AND THROW THEM INTO THE FIRE AND WAIT UNTIL THEY JUST BURN UP,17.729,0
../data_processed_voc/wav/voc_7_part_191.wav,../data_processed_voc/txt/voc_7_part_191.txt,but they -- they're very good at what they do.  Very good.,BUT THEY THEY'RE VERY GOOD AT WHAT THEY DO VERY GOOD,5.686,0
../data_processed_voc/wav/voc_18_part_243.wav,../data_processed_voc/txt/voc_18_part_243.txt,I'm not a still-water fisherman I'd I went up to Shasta lake one time catfishing at night last year and one time catfishing in the middle of the day and then one when I went fishing the middle of the day I caught about a four pounder I brought it home and I put it in that sink over there and it was alive,I'M NOT A STILL WATER FISHERMAN I'D I WENT UP TO SHASTA LAKE ONE TIME CATFISHING AT NIGHT LAST YEAR AND ONE TIME CATFISHING IN THE MIDDLE OF THE DAY AND THEN ONE WHEN I WENT FISHING THE MIDDLE OF THE DAY I CAUGHT ABOUT A FOUR POUNDER I BROUGHT IT HOME AND I PUT IT IN THAT SINK OVER THERE AND IT WAS ALIVE,23.12,0
../data_processed_voc/wav/voc_30_part_103.wav,../data_processed_voc/txt/voc_30_part_103.txt,"I used to hate going to Sna Fransisco, 'cause i lived on a ranch and then you go to like all the cities and all these people and I was like, culture shock, um so in that respect, as far as um the ammount of people and the mount of stuff uh I thought San Fransisco was the polar opposite of Salinas 'cause like I said I was on a ranch so that's-- there's no ranches in freakin San Francisco {LG}",I USED TO HATE GOING TO SNA FRANSISCO 'CAUSE I LIVED ON A RANCH AND THEN YOU GO TO LIKE ALL THE CITIES AND ALL THESE PEOPLE AND I WAS LIKE CULTURE SHOCK UM SO IN THAT RESPECT AS FAR AS UM THE AMMOUNT OF PEOPLE AND THE MOUNT OF STUFF UH I THOUGHT SAN FRANSISCO WAS THE POLAR OPPOSITE OF SALINAS 'CAUSE LIKE I SAID I WAS ON A RANCH SO THAT'S THERE'S NO RANCHES IN FREAKIN SAN FRANCISCO,23.767,0
../data_processed/wav/PRV_se0_ag2_m_02_1_part_94.wav,../data_processed/txt/PRV_se0_ag2_m_02_1_part_94.txt,"You know, I mean when you see houses sitting in the highway, you know, that water pushed in the highway [and everything], the houses just tore all to pieces, just",YOU KNOW I MEAN WHEN YOU SEE HOUSES SITTING IN THE HIGHWAY YOU KNOW THAT WATER PUSHED IN THE HIGHWAY AND EVERYTHING THE HOUSES JUST TORE ALL TO PIECES JUST,6.7570000000000014,1
../data_processed_voc/wav/voc_10_part_420.wav,../data_processed_voc/txt/voc_10_part_420.txt,cuz I could remember going to San Francisco and having to wear gloves and a hat and and ... now they don't,CAUSE I COULD REMEMBER GOING TO SAN FRANCISCO AND HAVING TO WEAR GLOVES AND A HAT AND AND NOW THEY DON'T,6.761,0
../data_processed_voc/wav/voc_17_part_49.wav,../data_processed_voc/txt/voc_17_part_49.txt,"high school-ish atmosphere, where everyone knows everyone you know, you're in the same social circer- circles, so, you know, one guy might've dated some girl, and now she's like off limits for ever- you know, stuff like that. So, it was kind of, you know, kind of high school-ish in that aspect.",HIGH SCHOOL ISH ATMOSPHERE WHERE EVERYONE KNOWS EVERYONE YOU KNOW YOU'RE IN THE SAME SOCIAL CIRCER CIRCLES SO YOU KNOW ONE GUY MIGHT'VE DATED SOME GIRL AND NOW SHE'S LIKE OFF LIMITS FOR EVER YOU KNOW STUFF LIKE THAT SO IT WAS KIND OF YOU KNOW KIND OF HIGH SCHOOL ISH IN THAT ASPECT,15.54,0
../data_processed/wav/DCB_se1_ag3_m_02_1_part_12.wav,../data_processed/txt/DCB_se1_ag3_m_02_1_part_12.txt,"<ts> What they say in Baltimore? I keep forgetting. Or- or in New York they'll say, hey man, you going on me or something like that? Or- <laugh> It just funny you know, joning is a thing in DC with what we do, it's fun, it's funny. You know it really don't take no personal feeling but sometimes people do get personal.",WHAT THEY SAY IN BALTIMORE I KEEP FORGETTING OR OR IN NEW YORK THEY'LL SAY HEY MAN YOU GOING ON ME OR SOMETHING LIKE THAT OR IT JUST FUNNY YOU KNOW JONING IS A THING IN DC WITH WHAT WE DO IT'S FUN IT'S FUNNY YOU KNOW IT REALLY DON'T TAKE NO PERSONAL FEELING BUT SOMETIMES PEOPLE DO GET PERSONAL,21.407,1
../data_processed/wav/ATL_se0_ag1_m_01_1_part_73.wav,../data_processed/txt/ATL_se0_ag1_m_01_1_part_73.txt,"and, uh, Serena is definitely, you know. Shit, I feel like it's me though. Cause I really feel like I don't know, bruh. This shit that I'm doing, I been staying down on it so long. I been doing this graphic design shit damn near my whole life. You know what I'm saying, like even back to when we had the old fat ass computer with the booty on the back of it.",AND UH SERENA IS DEFINITELY YOU KNOW SHIT I FEEL LIKE IT'S ME THOUGH CAUSE I REALLY FEEL LIKE I DON'T KNOW BRUH THIS SHIT THAT I'M DOING I BEEN STAYING DOWN ON IT SO LONG I BEEN DOING THIS GRAPHIC DESIGN SHIT DAMN NEAR MY WHOLE LIFE YOU KNOW WHAT I'M SAYING LIKE EVEN BACK TO WHEN WE HAD THE OLD FAT ASS COMPUTER WITH THE BOOTY ON THE BACK OF IT,20.266,1
../data_processed_voc/wav/voc_7_part_53.wav,../data_processed_voc/txt/voc_7_part_53.txt,is a retired teacher although she was actually a nurse and worked in the health occupations they called it at R O P which is in the middle of Car Lake. When I was a little kid we used to go out in there and make rafts and float around,IS A RETIRED TEACHER ALTHOUGH SHE WAS ACTUALLY A NURSE AND WORKED IN THE HEALTH OCCUPATIONS THEY CALLED IT AT R OH P WHICH IS IN THE MIDDLE OF CAR LAKE WHEN I WAS A LITTLE KID WE USED TO GO OUT IN THERE AND MAKE RAFTS AND FLOAT AROUND,16.212,0
../data_processed_voc/wav/voc_9_part_104.wav,../data_processed_voc/txt/voc_9_part_104.txt,you know we get the -- the heat as you know in the summertime but.,YOU KNOW WE GET THE THE HEAT AS YOU KNOW IN THE SUMMERTIME BUT,5.777,0
../data_processed_voc/wav/voc_1_part_120.wav,../data_processed_voc/txt/voc_1_part_120.txt,they will start dancing about my last five songs ... so they will come they will enjoy it they love listening to the goth music or the dark wave ... but they will start dancing toward the end and so I'm starting to get to a place where I will put goth and dark wave at the beginning and then I'll start getting into,THEY WILL START DANCING ABOUT MY LAST FIVE SONGS SO THEY WILL COME THEY WILL ENJOY IT THEY LOVE LISTENING TO THE GOTH MUSIC OR THE DARK WAVE BUT THEY WILL START DANCING TOWARD THE END AND SO I'M STARTING TO GET TO A PLACE WHERE I WILL PUT GOTH AND DARK WAVE AT THE BEGINNING AND THEN I'LL START GETTING INTO,20.965999999999998,0
../data_processed_voc/wav/voc_37_part_134.wav,../data_processed_voc/txt/voc_37_part_134.txt,"Um This is separate from the enforcement attorneys who bring like actions against violators, things like that.",UM THIS IS SEPARATE FROM THE ENFORCEMENT ATTORNEYS WHO BRING LIKE ACTIONS AGAINST VIOLATORS THINGS LIKE THAT,7.38,0
../data_processed_voc/wav/voc_10_part_181.wav,../data_processed_voc/txt/voc_10_part_181.txt,uhuh [yes] sure yeah I mean you wouldn't see me in a cowboy hat and boots,UHUH SURE YEAH I MEAN YOU WOULDN'T SEE ME IN A COWBOY HAT AND BOOTS,5.574,0
../data_processed_voc/wav/voc_36_part_55.wav,../data_processed_voc/txt/voc_36_part_55.txt,"So this college is very close to becoming a hundred years -- uh, a hundred years old, yeah. Two years, right? We're ninety-eight years old now. So, I -- I -- I watched the history of this place and watch it change a lot. Um, my -- my current partner is a man named Dick Schmidt. I was hoping to get him to be able to talk to you guys. Um. And he was born here in nineteen forty-three. {LS} In this central city part of the town.",SO THIS COLLEGE IS VERY CLOSE TO BECOMING A HUNDRED YEARS UH A HUNDRED YEARS OLD YEAH TWO YEARS RIGHT WE'RE NINETY EIGHT YEARS OLD NOW SO I I I WATCHED THE HISTORY OF THIS PLACE AND WATCH IT CHANGE A LOT UM MY MY CURRENT PARTNER IS A MAN NAMED DICK SCHMIDT I WAS HOPING TO GET HIM TO BE ABLE TO TALK TO YOU GUYS UM AND HE WAS BORN HERE IN NINETEEN FORTY THREE IN THIS CENTRAL CITY PART OF THE TOWN,20.502,0
../data_processed_voc/wav/voc_13_part_11.wav,../data_processed_voc/txt/voc_13_part_11.txt,she uh went back a couple of times to visit her family that was back there which was huge i- she had a lot of family back there and um the last time she went back um she said would be the last time  that was it she was  cut those ties and out you know she was here so,SHE UH WENT BACK A COUPLE OF TIMES TO VISIT HER FAMILY THAT WAS BACK THERE WHICH WAS HUGE I SHE HAD A LOT OF FAMILY BACK THERE AND UM THE LAST TIME SHE WENT BACK UM SHE SAID WOULD BE THE LAST TIME THAT WAS IT SHE WAS CUT THOSE TIES AND OUT YOU KNOW SHE WAS HERE SO,19.718,0
../data_processed_voc/wav/voc_0_part_299.wav,../data_processed_voc/txt/voc_0_part_299.txt,he built the arena and everything then we started going down there And then finally why uh Redding built the arena rodeo grounds They built that I'm trying to think in the fifties. Late fifties uh they built the rodeo grounds,HE BUILT THE ARENA AND EVERYTHING THEN WE STARTED GOING DOWN THERE AND THEN FINALLY WHY UH REDDING BUILT THE ARENA RODEO GROUNDS THEY BUILT THAT I'M TRYING TO THINK IN THE FIFTIES LATE FIFTIES UH THEY BUILT THE RODEO GROUNDS,21.951,0
../data_processed/wav/DCB_se1_ag3_m_03_1_part_31.wav,../data_processed/txt/DCB_se1_ag3_m_03_1_part_31.txt,"[So], you know, that's just how that is. Have you ever- uh, have you ever participated in a band? Yeah I actually have. Man, I actually- Well, when I was younger when we first started I was [about-] [How old] were you? I was about like, thirteen, fourteen, seventh- seventh, eighth grade, ninth grade. You know what I'm saying, we started a band called Young Influence Band. You know what I'm saying, I used to- I used to be the singer in that band. I went from like the drummer playing the drum,",SO YOU KNOW THAT'S JUST HOW THAT IS HAVE YOU EVER UH HAVE YOU EVER PARTICIPATED IN A BAND YEAH I ACTUALLY HAVE MAN I ACTUALLY WELL WHEN I WAS YOUNGER WHEN WE FIRST STARTED I WAS ABOUT HOW OLD WERE YOU I WAS ABOUT LIKE THIRTEEN FOURTEEN SEVENTH SEVENTH EIGHTH GRADE NINTH GRADE YOU KNOW WHAT I'M SAYING WE STARTED A BAND CALLED YOUNG INFLUENCE BAND YOU KNOW WHAT I'M SAYING I USED TO I USED TO BE THE SINGER IN THAT BAND I WENT FROM LIKE THE DRUMMER PLAYING THE DRUM,24.105,1
../data_processed_voc/wav/voc_33_part_62.wav,../data_processed_voc/txt/voc_33_part_62.txt,right on the border of Rancho Cordova  so I might stop at Costco on my way home from work um might go into Fulsom for dinner or for shopping um not go to the mall as much. I might run over to Sunrise Mall for something.,RIGHT ON THE BORDER OF RANCHO CORDOVA SO I MIGHT STOP AT COSTCO ON MY WAY HOME FROM WORK UM MIGHT GO INTO FULSOM FOR DINNER OR FOR SHOPPING UM NOT GO TO THE MALL AS MUCH I MIGHT RUN OVER TO SUNRISE MALL FOR SOMETHING,21.015,0
../data_processed_voc/wav/voc_6_part_58.wav,../data_processed_voc/txt/voc_6_part_58.txt,Okay so when the navy called  nearly all of the people who showed up at Austin for the navy were from California  and they -- at that point they asked us to choose one of the engineering professions,OKAY SO WHEN THE NAVY CALLED NEARLY ALL OF THE PEOPLE WHO SHOWED UP AT AUSTIN FOR THE NAVY WERE FROM CALIFORNIA AND THEY AT THAT POINT THEY ASKED US TO CHOOSE ONE OF THE ENGINEERING PROFESSIONS,21.291999999999998,0
../data_processed/wav/DCB_se3_ag4_f_02_1_part_18.wav,../data_processed/txt/DCB_se3_ag4_f_02_1_part_18.txt,"So they either- after a certain point, we either got- they either sent us to private schools- most of us went to private schools, or they bussed us to- or we went to- and when I say bussed, I don't mean like, you know, really bussed. I mean like we would catch- we would have to catch a bus, get on the bus and go,",SO THEY EITHER AFTER A CERTAIN POINT WE EITHER GOT THEY EITHER SENT US TO PRIVATE SCHOOLS MOST OF US WENT TO PRIVATE SCHOOLS OR THEY BUSSED US TO OR WE WENT TO AND WHEN I SAY BUSSED I DON'T MEAN LIKE YOU KNOW REALLY BUSSED I MEAN LIKE WE WOULD CATCH WE WOULD HAVE TO CATCH A BUS GET ON THE BUS AND GO,20.261,1
../data_processed_voc/wav/voc_3_part_10.wav,../data_processed_voc/txt/voc_3_part_10.txt,a lot and it makes people mad just because a lot of times I play devil's advocate  and oth- th- nobody really knows what I actually believe,A LOT AND IT MAKES PEOPLE MAD JUST BECAUSE A LOT OF TIMES I PLAY DEVIL'S ADVOCATE AND OTH TH NOBODY REALLY KNOWS WHAT I ACTUALLY BELIEVE,9.457,0
../data_processed_voc/wav/voc_24_part_29.wav,../data_processed_voc/txt/voc_24_part_29.txt,The Mount Shasta Mall over on Hilltop. and uh there was another store I think it was a bath supply type place or something and they had designed it that to walk into the store you actually walked over like a little wood bridge to go into it and there was just uniqueness. There was a a burger place that the whole front of it,THE MOUNT SHASTA MALL OVER ON HILLTOP AND UH THERE WAS ANOTHER STORE I THINK IT WAS A BATH SUPPLY TYPE PLACE OR SOMETHING AND THEY HAD DESIGNED IT THAT TO WALK INTO THE STORE YOU ACTUALLY WALKED OVER LIKE A LITTLE WOOD BRIDGE TO GO INTO IT AND THERE WAS JUST UNIQUENESS THERE WAS A A BURGER PLACE THAT THE WHOLE FRONT OF IT,21.883000000000003,0
