wav_file,txt_file,groundtruth_text,duration
~/aave_speech_rec/data_processed/wav/DCB_se1_ag3_m_02_1_part_9.wav,~/aave_speech_rec/data_processed/txt/DCB_se1_ag3_m_02_1_part_9.txt,"new. Or, you know what I'm saying, or something that you do very well, we'll be like, nigga I'm tight. I'm tight at that. Or you'll say you know, I'm tight at football or something that you do very well we'll say, I'm tight. Or, uh, what else? I mean it ain't much changed since back in the day. Like we still use the words from today, for real for real. How old are you? Thirty-six. Thirty-six? So tell me about your neighborhood that you grew up in and tell me like, how was it. Neighborhood I grew up in was tight as a motherfu- <laugh> Neighborhood I grew up in was tight, man, it was all family around there no- no /?/. <cough> You know we had a-",50.691
~/aave_speech_rec/data_processed/wav/PRV_se0_ag1_f_01_2_part_7.wav,~/aave_speech_rec/data_processed/txt/PRV_se0_ag1_f_01_2_part_7.txt,"[Mm-hm.] Yes. And um, Miss /RD-NAME-2/, her daughter? [She-] she stays in Princeville now.",5.006
~/aave_speech_rec/data_processed/wav/ROC_se0_ag3_m_01_1_part_22.wav,~/aave_speech_rec/data_processed/txt/ROC_se0_ag3_m_01_1_part_22.txt,"liberate, or free us until we go back to o- you know, our basic axiology or our value system that is of value to us which is our relationships. Those are the biggest things that black folks have. The axiology of European people is, uh, an object and the acquisition of it, and that's- that's what they do. They go around and conquer and do things like that. And I'm not saying that's good, bad, or indifference, but I'm just saying is that, uh, for us, as a people, we have to put a black head on a black body. We can no longer put a white head on a black body and thinks that we're gonna get results. And, uh, not be impacted, uh, you know, adversely, uh, by, uh, a lot of decision making because, um, <clears throat> it doesn't fit",50.28100000000001
~/aave_speech_rec/data_processed/wav/DCB_se3_ag3_m_02_1_part_148.wav,~/aave_speech_rec/data_processed/txt/DCB_se3_ag3_m_02_1_part_148.txt,"And the other one is a little more sweeter and more brighter. One is the same color as barbecue sauce, and it tastes like barbecue sauce a little bit like a tangy, like, Kansas City barbecue sauce. The other one, is the one when you eat it and it gets on your fingers and you eat it, the color of the barbecue s- I mean, the mumbo sauce is still on your fingers.",18.418
~/aave_speech_rec/data_processed/wav/ROC_se0_ag1_m_01_1_part_118.wav,~/aave_speech_rec/data_processed/txt/ROC_se0_ag1_m_01_1_part_118.txt,"It was just- it was- it was wild. And it- it went to like, three in the morning.",6.872000000000001
~/aave_speech_rec/data_processed/wav/DCB_se1_ag2_f_02_1_part_28.wav,~/aave_speech_rec/data_processed/txt/DCB_se1_ag2_f_02_1_part_28.txt,"and like would talk to her any type of way just do anything to her and things like that. And my mother couldn't do anything on her own like she couldn't wipe her own butt, she couldn't clothe herself, she couldn't- nothing, like she had like the mind of a two year old she would just go in the kitchen, cut on the stove and like- and just walk away, and stuff be on the stove, like so you had to tend to her like a- all the time. So me and him had got into a heated- oh and then I was getting child support from my dad. My dad just disappeared after a while. But he- the child support was ending. And so I was like, you know, I need my money to take care of me like my mom can't take care of me and my child support so me and him got into it one day and he was like, well you gotta go. And like just put me out. And so, I'm still going to /RD-SCHOOL-4/, still going to school, so I end up moving with my aunt. And then I don't know what happened with me and my aunt, but that didn't work out either. So I moved from my aunt, I went to go- still going to school. I never dropped out, still going to school.",50.63
~/aave_speech_rec/data_processed/wav/ATL_se0_ag1_m_03_1_part_43.wav,~/aave_speech_rec/data_processed/txt/ATL_se0_ag1_m_03_1_part_43.txt,"You know what I mean. It's always gonna be that factor, like Jordan is going to win- he's going- a- and that's another reason why I exp- I respect Kobe so much, cause he the same way. When he was nineteen in the NBA, he going to Jordan like nigga either you gonna win or I'm gonna win, but I guarantee you, you gonna fight for this. I ain't giving up.",17.881
~/aave_speech_rec/data_processed/wav/DCB_se2_ag4_f_02_1_part_64.wav,~/aave_speech_rec/data_processed/txt/DCB_se2_ag4_f_02_1_part_64.txt,"Oh I w- I went wild. I went wild I was seventeen, I came from this very protective home, um, you know I came from a home where I had stuff and you know when I was sixteen I got my license I had open access to a car but I still had to be home",14.61
~/aave_speech_rec/data_processed/wav/ROC_se0_ag1_m_01_1_part_14.wav,~/aave_speech_rec/data_processed/txt/ROC_se0_ag1_m_01_1_part_14.txt,"Um, I don't know, it's just, /RD-ADDRESS-3/ is kind of like the- it's like the quirky area of Rochester. Like, pretty much anything can happen on /RD-ADDRESS-3/. Um, but, the living was nice and then, uh, really what ended up happening was the stuff that happened over the two and a half years, came to a bubble between my aunt and my mom. And they got into it, my mom's like, alright we moving. But we stayed over in the /RD-ADDRESS-2/ area, moved off of /RD-ADDRESS-2/, which was really quiet. I realized that I like the /RD-ADDRESS-2/ a lot. /RD-ADDRESS-2/ is really a nice place. Um, even- even like now, [I'm just like,]",40.685
~/aave_speech_rec/data_processed/wav/DCB_se1_ag2_f_03_1_part_74.wav,~/aave_speech_rec/data_processed/txt/DCB_se1_ag2_f_03_1_part_74.txt,"what is going on? Apartments, people hanging out on the corners all night, like you can't really, you know, do what you wanna do cause you're worried- Like my mom used to always to be like, you gotta come in before dark. Why? Because something might happen. And now and I understand that but back then I'm like, nothing's gonna happen. Just let me be out too. But now I'm like, no, I'm glad I did go in before dark cause something could've happened. So the city's just different all over. Now, I guess they're building up in every different area, but Northwest is completely different. Every time I go there it's a new building or it's some condos, it's stuff that you never used to see. So, the demographics changed and then the look of everything has changed.",52.25899999999999
~/aave_speech_rec/data_processed/wav/PRV_se0_ag3_m_03_1_part_61.wav,~/aave_speech_rec/data_processed/txt/PRV_se0_ag3_m_03_1_part_61.txt,"Uh-huh. But, uh, since that time, s- some moved or different places, you know, like that.",8.154
~/aave_speech_rec/data_processed/wav/DCB_se2_ag3_f_02_1_part_14.wav,~/aave_speech_rec/data_processed/txt/DCB_se2_ag3_f_02_1_part_14.txt,"Um, my dad has his CDO so he does t- uh, like, kind of like the dump truck [drivers] that",6.153
~/aave_speech_rec/data_processed/wav/ROC_se0_ag2_f_03_1_part_85.wav,~/aave_speech_rec/data_processed/txt/ROC_se0_ag2_f_03_1_part_85.txt,"which was different from black pride. But, um. I see a lot of activism happening. Um, a lot of folks in my feed. Um, they're brave. I mean, it- you know, for me, It feels like a choice between my career and what I'm socially passionate about. And so that's why I- I think I try to get- honestly, if I'm being honest with myself, I try to give back in ways, that can't come back on me. You know what I mean. And so, I don't know what getting involved with BLACK and protesting and getting arrested would do. I'd probably get fired. Well- I'm- I- I make too much money. Not that anybody else's money is less important. You know, cause people are making those decisions everyday and they're brave.",51.356
~/aave_speech_rec/data_processed/wav/DCB_se3_ag3_f_02_1_part_57.wav,~/aave_speech_rec/data_processed/txt/DCB_se3_ag3_f_02_1_part_57.txt,"Oh my god. Um, <ts> I left, um, traveling with the military. And when I came back, um, like in O six I think it was, I- I- <sigh> I mean, I just was like- When you've been all over the world and you've been to these places where mentality is just so different, um, the mentality is more positive, people are more willing to help you be better, and people are willing to just be better, period. And you come back here and people are just angry, um, it's a crab world, everybody's pulling each other down, um, just a bunch of negativity basically. But, <ts> I s- I also digress and say that's what I see, because of where I came from, from so long being away that",50.09
~/aave_speech_rec/data_processed/wav/DCB_se2_ag4_f_03_2_part_66.wav,~/aave_speech_rec/data_processed/txt/DCB_se2_ag4_f_03_2_part_66.txt,"And I loved going in there. And we- we have been there several times. And we gone to- And I've been to the Air and Space, and I've been um- I've been up the monument stairs. I walked the monument stairs. I was sixteen. <laugh>",15.32
~/aave_speech_rec/data_processed/wav/PRV_se0_ag1_m_01_1_part_41.wav,~/aave_speech_rec/data_processed/txt/PRV_se0_ag1_m_01_1_part_41.txt,and so it was forty one people in her house for nine months. So that Sunday tradition basically turned into an everyday thing for nine months.,8.916
~/aave_speech_rec/data_processed/wav/DCB_se1_ag1_m_01_1_part_53.wav,~/aave_speech_rec/data_processed/txt/DCB_se1_ag1_m_01_1_part_53.txt,Because- I'll say I respect him a lot because it just whatever you go through he won't- he won't down talk you.,9.8
~/aave_speech_rec/data_processed/wav/DCB_se1_ag3_m_03_1_part_34.wav,~/aave_speech_rec/data_processed/txt/DCB_se1_ag3_m_03_1_part_34.txt,"You know what I'm saying, this is what we do, this is our stamp, you know what I'm saying. So we might be like, where the blams at? I might come in and be like, hey where the blam- you know where the blams at? The blams mean- or blimmy, means female. Blimmy or bla- [blimmy and-] [Blimmy] or blam means f- it [could be used] as female. [Blam.] Like, man it's like three blimmys over there, we about to go holler at the blimmys, you know what I'm saying. Oh, okay I got [you, I got you], I got you. [You know what I'm saying,] Like, shit where the blams at? You know what I'm saying, like shit the blams around the corner, they say it's a party tonight is you going? Like, yeah how many blams gonna be there? [/?/ oh okay.] [/??/ hal- half the] party? Like, oh aight we out there, we in there then, you know what I'm saying? Got you, got you, got you. You know, /sclusy/ like, /sclusy/. /Sclusy/ means that's- /sclusy/ also- that's a new form of word for tight",50.629
~/aave_speech_rec/data_processed/wav/PRV_se0_ag2_f_01_1_part_69.wav,~/aave_speech_rec/data_processed/txt/PRV_se0_ag2_f_01_1_part_69.txt,"So I feel it in my heart that God had chosen me to move my family in the realm that he wanted them to be in, [so.]",5.65
~/aave_speech_rec/data_processed/wav/ROC_se0_ag2_f_04_1_part_32.wav,~/aave_speech_rec/data_processed/txt/ROC_se0_ag2_f_04_1_part_32.txt,"I love love love my black lit courses, and I don't like the name minorities in lit but, you know, it is what it is. We're working to change that. But my black lit course has a, um- a particular significance to me. Uh, this past semester- I teach it only in the- in the, um, spring semester, but I started the semester out with thirty-two students. I ended up with twenty-nine, which is beyond fantastic. But I was looking at my students one day, and I had Facebook lived from- we were doing this party, and it was the most ridiculous thing, but I'm trying to incorporate different medias, and I want them to see that they matter to the world. And people are always interesting in what I do in my class, so I Facebook lived, and I was going around asking my students, you know, different things about the course and blackness and black, white students, whatever. When I looked at them, this was like the end of April, I said, you know, we have something here cause we talk, and I don't teach just,",50.371
~/aave_speech_rec/data_processed/wav/ROC_se0_ag2_m_01_1_part_1.wav,~/aave_speech_rec/data_processed/txt/ROC_se0_ag2_m_01_1_part_1.txt,"Um, I was born and raised in Rochester. Um. My mother emigrated here from Tallahassee, Florida. My father from Hazlehurst, Mississippi. Uh, he came here for Kodak, she came here for the U of R. They met in church. Um. <ts> We- when I was born, they- we were living in Henrietta. And then by second grade, we moved to Pittsford. They're still in that same house in Pittsford. So, I did  Pittsford schools from second grade on. Um, and then, went to U of R. And then after U of R ended up in Baltimore for eight years, and now I'm back.",36.191
~/aave_speech_rec/data_processed/wav/ROC_se0_ag3_f_01_1_part_35.wav,~/aave_speech_rec/data_processed/txt/ROC_se0_ag3_f_01_1_part_35.txt,"[That's the] sacrifices you make, so, you know, I don't- /RD-NAME-2/'s out now but, you know, she was still there in Charlotte alone, so I was still helping her, you know, so.",10.09
~/aave_speech_rec/data_processed/wav/DCB_se2_ag4_f_04_1_part_160.wav,~/aave_speech_rec/data_processed/txt/DCB_se2_ag4_f_04_1_part_160.txt,"everyone was pretty much on the same level. Um, I would say probably educationally, financially-",9.459
~/aave_speech_rec/data_processed/wav/ROC_se0_ag2_f_04_1_part_4.wav,~/aave_speech_rec/data_processed/txt/ROC_se0_ag2_f_04_1_part_4.txt,"that people you know, in this particular area, so there was not like, oh it's somebody robbing a house in the neighborhood that they lived in, you know an outsider would maybe have come in, or maybe a relative who was on drugs may have taken something. But it was really, uh, a place where people know, worked at Rochester Products and Kodak and they owned, um, houses in- in this- in that area but they owned other houses in the city, and, um, yeah, so it was a really, really good neighborhood.",24.74
~/aave_speech_rec/data_processed/wav/DCB_se1_ag2_f_03_1_part_78.wav,~/aave_speech_rec/data_processed/txt/DCB_se1_ag2_f_03_1_part_78.txt,"I wanna say it was the same year, a few months later. We were having like- on Mother's Day, the- they were having a big cookout. So we're walking- me and my friend, we're walking over to the cookout, and this guy that we know from the neighborhood he was just talking to us, we're like, hey, you know, da da da. He was like, run. And we're like, what? Why are we running? He was like, run. And then a car- we look back and a car just slows down, and like you can see the man pulling a gun out the window, I was like, oh no. So we run. And nobody knew what was going on. Like, everybody's running, nobody knows who's shooting at who, who trying to- they're trying to get, and they just start shooting each other. So those two incidents, even though I was younger. And I feel like",50.83
~/aave_speech_rec/data_processed/wav/ROC_se0_ag1_f_03_1_part_134.wav,~/aave_speech_rec/data_processed/txt/ROC_se0_ag1_f_03_1_part_134.txt,"for once, like in my whole life, I decided to try a whole different approach. And And to- to- just try being good.",9.847000000000001
~/aave_speech_rec/data_processed/wav/DCB_se3_ag3_m_01_1_part_59.wav,~/aave_speech_rec/data_processed/txt/DCB_se3_ag3_m_01_1_part_59.txt,"We moved to DC in two thousand thirteen. So from two thousand eight to two thousand thirteen I moved from Forestville, and I was living in Upper Marlboro briefly um, cause I didn't wanna be anywhere near DC. You know? I was kind of like- if- if you're familiar with the story of um, uh, Jonah in the Bible. He really hated the Ninevites. I can't stand this city! I hate Nineveh! And you know, DC when I was growing up um, was you know, Chocolate City. It was the murder capital of the world. Choppa City. And my mom worked in DC Public Schools, so we would ride in DC, and I would duck in the back of the car. I would duck in the back of the car cause I didn't wanna get shot. That's how scared I was of DC. So I didn't wanna live th- I didn't wanna live anywhere near DC. We moved to Upper Marlboro briefly, but in Upper Marlboro from two thousand eight to two thousand thirteen, God started really moving on my heart to give me a burden for the city",50.722
~/aave_speech_rec/data_processed/wav/PRV_se0_ag1_m_02_1_part_97.wav,~/aave_speech_rec/data_processed/txt/PRV_se0_ag1_m_02_1_part_97.txt,"[You know], I mean just like if you go to Virginia, you go to New York, you know, uh- Me and- What's your name? /RD-NAME-2/, might be a couple,",7.337999999999999
~/aave_speech_rec/data_processed/wav/ROC_se0_ag1_f_03_1_part_110.wav,~/aave_speech_rec/data_processed/txt/ROC_se0_ag1_f_03_1_part_110.txt,"But I just feel like it's incidental. Like I can if I decide to put makeup on, or do my hair or like, get dressed up. [I- it w- it] would happen. And maybe somebody like- if I did that on a regular basis,",13.985999999999999
~/aave_speech_rec/data_processed/wav/DCB_se2_ag4_f_04_1_part_71.wav,~/aave_speech_rec/data_processed/txt/DCB_se2_ag4_f_04_1_part_71.txt,"So I think I gave her that- I afforded her that opportunity, and I am very proud of her because she succeeded, and she made it. She graduated on time. Um, she was the think second or third only African American from the School of Art Cause she graduated with um, a art degree and a concentration in photography",18.76
~/aave_speech_rec/data_processed/wav/DCB_se3_ag4_f_01_1_part_84.wav,~/aave_speech_rec/data_processed/txt/DCB_se3_ag4_f_01_1_part_84.txt,"[<laugh>] I used to take the bus to Petworth Library and go up there. And I used to love to read these teenage romance novels. I'd get my- my books, and I'd hop right back down to um, home, and I'd read my books and- So sometimes I could convince a couple of my girlfriends to um, to go up with me. And we'd- You know- We'd hang out and be stupid at the library. Um, for a minute, I was a cheerleader for Pop Warner. We had [um]-",25.901
~/aave_speech_rec/data_processed/wav/PRV_se0_ag2_m_01_1_part_3.wav,~/aave_speech_rec/data_processed/txt/PRV_se0_ag2_m_01_1_part_3.txt,"And after we m- um, left New Jersey, that's when we went down to Panama. And went to Panama f- for three- three and a half years. Then after we left from Panama, that's when we came back- back down here.",12.745999999999999
~/aave_speech_rec/data_processed/wav/PRV_se0_ag3_f_01_1_part_16.wav,~/aave_speech_rec/data_processed/txt/PRV_se0_ag3_f_01_1_part_16.txt,"[And (laughing)] he said, you aren't gonna cry are you? I says, no I'm not gonna cry. I said- he said, well did you hurt yourself? I says, no I'm not hurting. It's just- I'm [embarrassed.]",9.184
~/aave_speech_rec/data_processed/wav/ROC_se0_ag3_f_02_1_part_100.wav,~/aave_speech_rec/data_processed/txt/ROC_se0_ag3_f_02_1_part_100.txt,"[She] was a social worker, but she was sort of like acting as the director. But they had another director, but I don't- I think he was more in the background. But somebody on this side of town might remember better than I do cause I lived on the other side. But I was over here so much people thought I lived over here. N- and what we would do- the wonder bread place was right next to Montgomery Center. And the t- f- trolley would cross Clarissa Street right at West Main, um, near Ni- Nick Tahou but on the other side of the bridge. So it's the open door misison. You know that block?",49.791000000000004
~/aave_speech_rec/data_processed/wav/DCB_se3_ag4_m_01_1_part_52.wav,~/aave_speech_rec/data_processed/txt/DCB_se3_ag4_m_01_1_part_52.txt,"the museum is important, you know. If the p- if parents take their time to enlighten their kids that you know it's not like you said. It's not just video games and going to the club. You gotta pay attention about what's going on around here. And the same thing with, you know, I'm all for wanting to be yourself and all this o- other kind of stuff but if you've got dreads and you- especially one that you're not taking care of, you know, and you gonna go to an interview and you want a job working in a bank, okay. You gotta look around and see, okay, hm. Who- what is the- what is the image of this company and do I represent the image of this company? Mm-hm. And if I don't",50.806999999999995
~/aave_speech_rec/data_processed/wav/DCB_se2_ag4_f_01_1_part_3.wav,~/aave_speech_rec/data_processed/txt/DCB_se2_ag4_f_01_1_part_3.txt,"Well at one time when I was coming up, m- around the time, they would say you would have to have been at least minimum the second generation, if not the third.",9.062000000000001
~/aave_speech_rec/data_processed/wav/PRV_se0_ag2_m_01_1_part_88.wav,~/aave_speech_rec/data_processed/txt/PRV_se0_ag2_m_01_1_part_88.txt,"It's /with/ responsibility cause just like me and him, we tight, but if I'm doing something slack,",7.963999999999999
~/aave_speech_rec/data_processed/wav/ROC_se0_ag1_f_03_1_part_150.wav,~/aave_speech_rec/data_processed/txt/ROC_se0_ag1_f_03_1_part_150.txt,"I literally- I think at this point, I think if this doesn't work out, I'm just gonna leave.",6.5829999999999975
~/aave_speech_rec/data_processed/wav/PRV_se0_ag3_f_03_1_part_111.wav,~/aave_speech_rec/data_processed/txt/PRV_se0_ag3_f_03_1_part_111.txt,[/inaudible/] [With a smile on my] face. Sure is. I got to leave y'all good girls now. It's about eleven o'clock ain't it.,5.4060000000000015
~/aave_speech_rec/data_processed/wav/DCB_se1_ag1_m_01_1_part_12.wav,~/aave_speech_rec/data_processed/txt/DCB_se1_ag1_m_01_1_part_12.txt,"[Oh] yeah. I'm allowed to go in other neighborhoods because my family's mostly spread out through DC, [so.]",5.746
~/aave_speech_rec/data_processed/wav/ATL_se0_ag2_f_02_1_part_41.wav,~/aave_speech_rec/data_processed/txt/ATL_se0_ag2_f_02_1_part_41.txt,"Um, somethings you can grind longer for, you know. It's all about consistency I would say, what you stay down for.",9.574
~/aave_speech_rec/data_processed/wav/DCB_se3_ag3_m_01_1_part_81.wav,~/aave_speech_rec/data_processed/txt/DCB_se3_ag3_m_01_1_part_81.txt,"I was lost in my sin, and now I'm made alive in Christ. I can see him. Man. I w- Uh, that song, Amazing Grace, how sweet the sound. Save the rest like me. I once was lost, but now am found, was blind but now I see. Like, that song is amazing because that what's happens when a person is converted, when a person goes from being a sinner, on their way to hell, to a person who is a saint on their way to heaven because of their faith in Jesus Christ. So, those are some of my golden moments, seeing people's eyes open",30.246
~/aave_speech_rec/data_processed/wav/ROC_se0_ag3_f_02_3_part_45.wav,~/aave_speech_rec/data_processed/txt/ROC_se0_ag3_f_02_3_part_45.txt,"I tell everybody that story because, not all the time it will show. Cause, and- and if I'd've waited another two years, they said I'd've been dead. So, they- Doctor Chang was his name. Vincent Chang. He did the surgery. He- he cut three feet of my large intestine out of my stomach. And, he redirected my bowels so I didn't have to wear the sack.",31.813000000000002
~/aave_speech_rec/data_processed/wav/PRV_se0_ag3_m_01_1_part_72.wav,~/aave_speech_rec/data_processed/txt/PRV_se0_ag3_m_01_1_part_72.txt,"The stagnation is still- is still here. And some folks know about it and some folks don't, but um, I have to be sort of precarious about how I say it.",14.312999999999999
~/aave_speech_rec/data_processed/wav/PRV_se0_ag2_f_02_1_part_38.wav,~/aave_speech_rec/data_processed/txt/PRV_se0_ag2_f_02_1_part_38.txt,"And I used to s- say, well, if this supposed to be sharecropping, why are we doing all the work?",5.215
~/aave_speech_rec/data_processed/wav/ROC_se0_ag2_m_01_3_part_5.wav,~/aave_speech_rec/data_processed/txt/ROC_se0_ag2_m_01_3_part_5.txt,"A- because they want to protect their children, like anybody does, but it has its social impact as well. Whereas, I think places like Greece, like Gates, a little more honest about what the world is doing and like, what's going on, and they're a little more open to it. Because, one, they have to be and- and, two, I think they're just they don't care as much. [<laugh>]",22.743000000000002
~/aave_speech_rec/data_processed/wav/DCB_se3_ag3_m_01_1_part_84.wav,~/aave_speech_rec/data_processed/txt/DCB_se3_ag3_m_01_1_part_84.txt,"And then when you are saved, God leads you on that path of righteousness, and it's not that you're not going to make mistakes or fall into sin, but God, his job is to help you stay up and stay focused as you keep walking. So explaining things like that to people who think that they can like lose their salvation or fall off the salvation ship <laugh> because, oh, I did this. Well I guess I deserve to go to hell now. Well you've always deserved to go to hell.",22.215999999999998
~/aave_speech_rec/data_processed/wav/ROC_se0_ag1_f_02_1_part_11.wav,~/aave_speech_rec/data_processed/txt/ROC_se0_ag1_f_02_1_part_11.txt,"[Oh.] Yeah, yeah. So I went to /RD-SCHOOL-4/ School, /RD-SCHOOL-7/. So that's the school I was saying like, there's a recreation center- actually it was connected to a recreation center.",8.901
~/aave_speech_rec/data_processed/wav/PRV_se0_ag1_f_02_1_part_28.wav,~/aave_speech_rec/data_processed/txt/PRV_se0_ag1_f_02_1_part_28.txt,"Everybody around us was evacuated. My whole family, both sides. My dad's family and my mom's family.",5.2620000000000005
~/aave_speech_rec/data_processed/wav/PRV_se0_ag3_m_02_2_part_33.wav,~/aave_speech_rec/data_processed/txt/PRV_se0_ag3_m_02_2_part_33.txt,"[He figured] down to a hundred and fifty dollars a month. I said, can't pay that either. And he said, man, how much money you wanna pay on a new car?",5.462999999999999
