wav_file,txt_file,groundtruth_text_raw,groundtruth_text_train,duration,AAVE
../data_processed/wav/DCB_se1_ag3_m_02_2_part_5.wav,../data_processed/txt/DCB_se1_ag3_m_02_2_part_5.txt,"How did that- does that like how does that translate like, what traits that you learned from growing up around your neighborhood and it's carried you over now, that you would never- that you would pass on to your kids or you'll p- you know what I mean? The memory I have /would to be/",HOW DID THAT DOES THAT LIKE HOW DOES THAT TRANSLATE LIKE WHAT TRAITS THAT YOU LEARNED FROM GROWING UP AROUND YOUR NEIGHBORHOOD AND IT'S CARRIED YOU OVER NOW THAT YOU WOULD NEVER THAT YOU WOULD PASS ON TO YOUR KIDS OR YOU'LL P YOU KNOW WHAT I MEAN THE MEMORY I HAVE WOULD TO BE,25.517,1
../data_processed/wav/DCB_se2_ag4_m_01_1_part_191.wav,../data_processed/txt/DCB_se2_ag4_m_01_1_part_191.txt,"But a lot of times in- in- in DC the go go- It's like- it's like this. It- When it- when it came, in- t- go go parties, this that and the other, you c- you- you had to party there. You had to party in your neighborhood. You can't go to somebody else because I'm like this. You go there, this that and the other. Hey, somebody, hey, get jealous cause you dancing with the girl. You wind up getting stabbed, shot, this that and the other, or it'd be a fight.",BUT A LOT OF TIMES IN IN IN DC THE GO GO IT'S LIKE IT'S LIKE THIS IT WHEN IT WHEN IT CAME IN T GO GO PARTIES THIS THAT AND THE OTHER YOU C YOU YOU HAD TO PARTY THERE YOU HAD TO PARTY IN YOUR NEIGHBORHOOD YOU CAN'T GO TO SOMEBODY ELSE BECAUSE I'M LIKE THIS YOU GO THERE THIS THAT AND THE OTHER HEY SOMEBODY HEY GET JEALOUS CAUSE YOU DANCING WITH THE GIRL YOU WIND UP GETTING STABBED SHOT THIS THAT AND THE OTHER OR IT'D BE A FIGHT,21.872,1
../data_processed_voc/wav/voc_5_part_156.wav,../data_processed_voc/txt/voc_5_part_156.txt,and then Trinity County's kinda split because depending on where you are in the county it's like pretty much Weaverville goes to Redding then when you get down river uh by Burnt Ranch anyway you just go to Eureka for everything,AND THEN TRINITY COUNTY'S KINDA SPLIT BECAUSE DEPENDING ON WHERE YOU ARE IN THE COUNTY IT'S LIKE PRETTY MUCH WEAVERVILLE GOES TO REDDING THEN WHEN YOU GET DOWN RIVER UH BY BURNT RANCH ANYWAY YOU JUST GO TO EUREKA FOR EVERYTHING,20.246,0
../data_processed/wav/DCB_se1_ag2_m_01_1_part_96.wav,../data_processed/txt/DCB_se1_ag2_m_01_1_part_96.txt,"[I told you that- we supposed] to have got- we supposed to have- look, we supposed to have won the game before that one, and this one when we came back home it was supposed to be over. But like I said, that last one in Toronto it threw us off when we ain't had Whiteside, we had to adjust to it. And watch, you gonna see it this next game. [We gonna beat 'em.]",I TOLD YOU THAT WE SUPPOSED TO HAVE GOT WE SUPPOSED TO HAVE LOOK WE SUPPOSED TO HAVE WON THE GAME BEFORE THAT ONE AND THIS ONE WHEN WE CAME BACK HOME IT WAS SUPPOSED TO BE OVER BUT LIKE I SAID THAT LAST ONE IN TORONTO IT THREW US OFF WHEN WE AIN'T HAD WHITESIDE WE HAD TO ADJUST TO IT AND WATCH YOU GONNA SEE IT THIS NEXT GAME WE GONNA BEAT 'EM,14.684,1
../data_processed/wav/PRV_se0_ag2_f_01_1_part_58.wav,../data_processed/txt/PRV_se0_ag2_f_01_1_part_58.txt,"Everything. I seek Him for anything. You know, sometime you can't talk to your friends, and sometime some things you don't wanna tell people how you feeling, and you can go to God and ask God for strength and ask God for directions and stuff, and He just been my everything. And I- And I began to uh, depend on Him wholeheartedly, [so.]",EVERYTHING I SEEK HIM FOR ANYTHING YOU KNOW SOMETIME YOU CAN'T TALK TO YOUR FRIENDS AND SOMETIME SOME THINGS YOU DON'T WANNA TELL PEOPLE HOW YOU FEELING AND YOU CAN GO TO GOD AND ASK GOD FOR STRENGTH AND ASK GOD FOR DIRECTIONS AND STUFF AND HE JUST BEEN MY EVERYTHING AND I AND I BEGAN TO UH DEPEND ON HIM WHOLEHEARTEDLY SO,18.658,1
../data_processed/wav/DCB_se2_ag4_m_01_1_part_106.wav,../data_processed/txt/DCB_se2_ag4_m_01_1_part_106.txt,We'll take it down to the park. We'll play the- we'll play the game down there. But we can't not go in this place and play. We can't.,WE'LL TAKE IT DOWN TO THE PARK WE'LL PLAY THE WE'LL PLAY THE GAME DOWN THERE BUT WE CAN'T NOT GO IN THIS PLACE AND PLAY WE CAN'T,7.182,1
../data_processed_voc/wav/voc_7_part_35.wav,../data_processed_voc/txt/voc_7_part_35.txt,Oh yeah I loved it. I loved -- I loved working in the theater. Uh I eventually gave it up the school was being uh renovated and the auditorium was gone and I would do plays over at Washington Middle school because I also taught drama over there so I would get the kids in the seventh grade and keep 'em til they were seniors.,OH YEAH I LOVED IT I LOVED I LOVED WORKING IN THE THEATER UH I EVENTUALLY GAVE IT UP THE SCHOOL WAS BEING UH RENOVATED AND THE AUDITORIUM WAS GONE AND I WOULD DO PLAYS OVER AT WASHINGTON MIDDLE SCHOOL BECAUSE I ALSO TAUGHT DRAMA OVER THERE SO I WOULD GET THE KIDS IN THE SEVENTH GRADE AND KEEP 'EM TIL THEY WERE SENIORS,24.033,0
../data_processed/wav/ROC_se0_ag3_f_02_3_part_10.wav,../data_processed/txt/ROC_se0_ag3_f_02_3_part_10.txt,"And I said, I'm not gonna say anything to him. What would I accomplish? He's so sick, I cannot say something that might upset him. So, I didn't. So, we we ate the tart, we sipped the tea. And he told me, um,",AND I SAID I'M NOT GONNA SAY ANYTHING TO HIM WHAT WOULD I ACCOMPLISH HE'S SO SICK I CANNOT SAY SOMETHING THAT MIGHT UPSET HIM SO I DIDN'T SO WE WE ATE THE TART WE SIPPED THE TEA AND HE TOLD ME UM,20.927,1
../data_processed_voc/wav/voc_14_part_24.wav,../data_processed_voc/txt/voc_14_part_24.txt,been wanting to like take pictures for so long I mean I've been doing it for ten years now it started when I was fourteen years old and it's been you know non-stop ever since so I knew I had to like it was kind of a solid idea and I had to go for it and I uh you know started taking the photos like two days later um and started putting them on I just you know made a Facebook page for it,BEEN WANTING TO LIKE TAKE PICTURES FOR SO LONG I MEAN I'VE BEEN DOING IT FOR TEN YEARS NOW IT STARTED WHEN I WAS FOURTEEN YEARS OLD AND IT'S BEEN YOU KNOW NON STOP EVER SINCE SO I KNEW I HAD TO LIKE IT WAS KIND OF A SOLID IDEA AND I HAD TO GO FOR IT AND I UH YOU KNOW STARTED TAKING THE PHOTOS LIKE TWO DAYS LATER UM AND STARTED PUTTING THEM ON I JUST YOU KNOW MADE A FACEBOOK PAGE FOR IT,22.16,0
../data_processed_voc/wav/voc_16_part_254.wav,../data_processed_voc/txt/voc_16_part_254.txt,"But no- nobody you know, there was no question or anything on the application. To uh tell 'em that. So but uh, that really s- struck him. Uh-huh. Uh-huh. Yeah. So because like you know, um, when the war was, and i- and uh, but w- and even at their house",BUT NO NOBODY YOU KNOW THERE WAS NO QUESTION OR ANYTHING ON THE APPLICATION TO UH TELL 'EM THAT SO BUT UH THAT REALLY S STRUCK HIM UH HUH UH HUH YEAH SO BECAUSE LIKE YOU KNOW UM WHEN THE WAR WAS AND I AND UH BUT W AND EVEN AT THEIR HOUSE,20.862,0
../data_processed/wav/DCB_se1_ag3_f_03_1_part_52.wav,../data_processed/txt/DCB_se1_ag3_f_03_1_part_52.txt,"for good. So they have, uh, two arch enemies <ts> which are, what is it, the- uh, the Destroyer, and Bang. So, in the book, that's what they're doing, defeating their- um, <ts> their arch enemies. <laugh>",FOR GOOD SO THEY HAVE UH TWO ARCH ENEMIES WHICH ARE WHAT IS IT THE UH THE DESTROYER AND BANG SO IN THE BOOK THAT'S WHAT THEY'RE DOING DEFEATING THEIR UM THEIR ARCH ENEMIES,15.047,1
../data_processed/wav/ROC_se0_ag2_m_01_4_part_25.wav,../data_processed/txt/ROC_se0_ag2_m_01_4_part_25.txt,"But, If you look at say, what Eminem does. Nas, Mos Def, Common, even Kanye, in the way that they structure an argument lyrically. These are guys that are from traditional urban backgrounds.",BUT IF YOU LOOK AT SAY WHAT EMINEM DOES NAS MOS DEF COMMON EVEN KANYE IN THE WAY THAT THEY STRUCTURE AN ARGUMENT LYRICALLY THESE ARE GUYS THAT ARE FROM TRADITIONAL URBAN BACKGROUNDS,21.987,1
../data_processed_voc/wav/voc_32_part_241.wav,../data_processed_voc/txt/voc_32_part_241.txt,"You got to get it out of there yeah it was bad. Not fun. Not fun. I was like, that is the pinnacle of my relationship with my father",YOU GOT TO GET IT OUT OF THERE YEAH IT WAS BAD NOT FUN NOT FUN I WAS LIKE THAT IS THE PINNACLE OF MY RELATIONSHIP WITH MY FATHER,7.263999999999999,0
../data_processed_voc/wav/voc_5_part_107.wav,../data_processed_voc/txt/voc_5_part_107.txt,yeah yeah and yeah with our son focus is important he doesn't need more energy focus yes um,YEAH YEAH AND YEAH WITH OUR SON FOCUS IS IMPORTANT HE DOESN'T NEED MORE ENERGY FOCUS YES UM,8.003,0
../data_processed_voc/wav/voc_24_part_6.wav,../data_processed_voc/txt/voc_24_part_6.txt,not really we actually weren't that close um growing up just because we were doing different things different stages of life um we're actually a lot closer know which is nice. I'm very thankful even though we're so far apart. But you know we'll talk some times on the fun or email and so it's nice to have that connection so,NOT REALLY WE ACTUALLY WEREN'T THAT CLOSE UM GROWING UP JUST BECAUSE WE WERE DOING DIFFERENT THINGS DIFFERENT STAGES OF LIFE UM WE'RE ACTUALLY A LOT CLOSER KNOW WHICH IS NICE I'M VERY THANKFUL EVEN THOUGH WE'RE SO FAR APART BUT YOU KNOW WE'LL TALK SOME TIMES ON THE FUN OR EMAIL AND SO IT'S NICE TO HAVE THAT CONNECTION SO,20.53,0
../data_processed_voc/wav/voc_10_part_13.wav,../data_processed_voc/txt/voc_10_part_13.txt,uh ... and uh daddy became no this was when he was in high school uh he went out to all of the eighth grades in junior high schools ... and registered the kids for high school ...,UH AND UH DADDY BECAME NO THIS WAS WHEN HE WAS IN HIGH SCHOOL UH HE WENT OUT TO ALL OF THE EIGHTH GRADES IN JUNIOR HIGH SCHOOLS AND REGISTERED THE KIDS FOR HIGH SCHOOL,21.482,0
../data_processed/wav/PRV_se0_ag3_f_02_2_part_74.wav,../data_processed/txt/PRV_se0_ag3_f_02_2_part_74.txt,"And we rode around for a while to see you know, how it did different people in the area where some of the houses was just washed up, some was sitting in the highway,",AND WE RODE AROUND FOR A WHILE TO SEE YOU KNOW HOW IT DID DIFFERENT PEOPLE IN THE AREA WHERE SOME OF THE HOUSES WAS JUST WASHED UP SOME WAS SITTING IN THE HIGHWAY,11.512,1
../data_processed_voc/wav/voc_34_part_31.wav,../data_processed_voc/txt/voc_34_part_31.txt,Um (( )) trying to think. Yes! Yes {BR} Yes Yes I do.,UM TRYING TO THINK YES YES YES YES I DO,5.853,0
../data_processed_voc/wav/voc_27_part_20.wav,../data_processed_voc/txt/voc_27_part_20.txt,there um he has two two boys um that um is the main reason they moved back to um Frezno so he could be by his sons cuz they're still they're still in high school I mean they were younger when they moved back there but they're both in high school now so um they do plan on moving back here after the boys are,THERE UM HE HAS TWO TWO BOYS UM THAT UM IS THE MAIN REASON THEY MOVED BACK TO UM FREZNO SO HE COULD BE BY HIS SONS CAUSE THEY'RE STILL THEY'RE STILL IN HIGH SCHOOL I MEAN THEY WERE YOUNGER WHEN THEY MOVED BACK THERE BUT THEY'RE BOTH IN HIGH SCHOOL NOW SO UM THEY DO PLAN ON MOVING BACK HERE AFTER THE BOYS ARE,23.975,0
../data_processed_voc/wav/voc_32_part_246.wav,../data_processed_voc/txt/voc_32_part_246.txt,part of that is not legislating that gays can't be married and that you know pot shouldn't be legalized and all that. That's all more government and and stuff like that so In certain ways I think of myself as conservative. I I definitely don't like where our country's gone,PART OF THAT IS NOT LEGISLATING THAT GAYS CAN'T BE MARRIED AND THAT YOU KNOW POT SHOULDN'T BE LEGALIZED AND ALL THAT THAT'S ALL MORE GOVERNMENT AND AND STUFF LIKE THAT SO IN CERTAIN WAYS I THINK OF MYSELF AS CONSERVATIVE I I DEFINITELY DON'T LIKE WHERE OUR COUNTRY'S GONE,15.26,0
../data_processed_voc/wav/voc_19_part_11.wav,../data_processed_voc/txt/voc_19_part_11.txt,"Uh, I had friends that drove, and then I think I finally got my license when I was about seventeen, so we would take turns driving. But I had some friends that were older. So that was always nice, that were graduated already.",UH I HAD FRIENDS THAT DROVE AND THEN I THINK I FINALLY GOT MY LICENSE WHEN I WAS ABOUT SEVENTEEN SO WE WOULD TAKE TURNS DRIVING BUT I HAD SOME FRIENDS THAT WERE OLDER SO THAT WAS ALWAYS NICE THAT WERE GRADUATED ALREADY,10.3,0
../data_processed/wav/PRV_se0_ag3_m_01_1_part_106.wav,../data_processed/txt/PRV_se0_ag3_m_01_1_part_106.txt,"And uh, and we are standing- /RD-NAME-2/ is standing next to her. He's sitting and I'm standing, and I think I got a lollipop in my mouth.",AND UH AND WE ARE STANDING IS STANDING NEXT TO HER HE'S SITTING AND I'M STANDING AND I THINK I GOT A LOLLIPOP IN MY MOUTH,7.766,1
../data_processed_voc/wav/voc_32_part_33.wav,../data_processed_voc/txt/voc_32_part_33.txt,"but it does -- from like l- +like thinking back like on T V shows and movies and stuff, I still feel like what was more racially diverse",BUT IT DOES FROM LIKE L LIKE THINKING BACK LIKE ON TV SHOWS AND MOVIES AND STUFF I STILL FEEL LIKE WHAT WAS MORE RACIALLY DIVERSE,6.47,0
../data_processed/wav/DCB_se1_ag3_m_01_1_part_66.wav,../data_processed/txt/DCB_se1_ag3_m_01_1_part_66.txt,"I don't give away victories. I don't care if you're four years old. I don't care if you're two years old. I don't care if you're thirty-five, fifty years old. I do not give up give up victories. Next question?",I DON'T GIVE AWAY VICTORIES I DON'T CARE IF YOU'RE FOUR YEARS OLD I DON'T CARE IF YOU'RE TWO YEARS OLD I DON'T CARE IF YOU'RE THIRTY FIVE FIFTY YEARS OLD I DO NOT GIVE UP GIVE UP VICTORIES NEXT QUESTION,10.56,1
../data_processed_voc/wav/voc_34_part_144.wav,../data_processed_voc/txt/voc_34_part_144.txt,"{BR} uh I know one family that -- but anyhow, it's Yeah That's what happened. {BR} I- -- It's what's happening, like in this neighborhood. {BR} You know, being here so long {BR} I mea- +mean",UH I KNOW ONE FAMILY THAT BUT ANYHOW IT'S YEAH THAT'S WHAT HAPPENED I IT'S WHAT'S HAPPENING LIKE IN THIS NEIGHBORHOOD YOU KNOW BEING HERE SO LONG I MEA MEAN,12.833,0
../data_processed_voc/wav/voc_1_part_54.wav,../data_processed_voc/txt/voc_1_part_54.txt,and Covenant we want to be able to do all of that in one club just like we go to when we go down below to l-a ... and so we did ... and people have been very very supportive and very cool about it and so that's how that happened and so we went one month then the next month the next month and ... so here we are,AND COVENANT WE WANT TO BE ABLE TO DO ALL OF THAT IN ONE CLUB JUST LIKE WE GO TO WHEN WE GO DOWN BELOW TO L A AND SO WE DID AND PEOPLE HAVE BEEN VERY VERY SUPPORTIVE AND VERY COOL ABOUT IT AND SO THAT'S HOW THAT HAPPENED AND SO WE WENT ONE MONTH THEN THE NEXT MONTH THE NEXT MONTH AND SO HERE WE ARE,21.057,0
../data_processed_voc/wav/voc_21_part_21.wav,../data_processed_voc/txt/voc_21_part_21.txt,{BR} well back then they only took so many people and your mom had to write a letter to kinda save your spot a lot of moms would write their letter {BR} to save their kids spot when that child was in third grade {BR} so because of that ((sin)) it was kind of a waiting list then because of that you kind of only got the people who had been living in Redlands pretty much their whole life,WELL BACK THEN THEY ONLY TOOK SO MANY PEOPLE AND YOUR MOM HAD TO WRITE A LETTER TO KINDA SAVE YOUR SPOT A LOT OF MOMS WOULD WRITE THEIR LETTER TO SAVE THEIR KIDS SPOT WHEN THAT CHILD WAS IN THIRD GRADE SO BECAUSE OF THAT SIN IT WAS KIND OF A WAITING LIST THEN BECAUSE OF THAT YOU KIND OF ONLY GOT THE PEOPLE WHO HAD BEEN LIVING IN REDLANDS PRETTY MUCH THEIR WHOLE LIFE,20.614,0
../data_processed/wav/DCB_se2_ag3_f_01_1_part_24.wav,../data_processed/txt/DCB_se2_ag3_f_01_1_part_24.txt,"So that was the s- that was the spot. Um, another- another hot spot was Crystal's Skating Rink, which is actually on Branch Avenue, and this is in Prince George's County. Um, just outside of DC, Southeast DC, and that was another like, hot spot. You would do the same thing, on Saturday morning you would clean the house up, because we couldn't go out if we didn't clean up. That was the rule, you know, you clean up first and do all your chores and then, you know, you would get your best outfit and hop on the subway and just-",SO THAT WAS THE S THAT WAS THE SPOT UM ANOTHER ANOTHER HOT SPOT WAS CRYSTAL'S SKATING RINK WHICH IS ACTUALLY ON BRANCH AVENUE AND THIS IS IN PRINCE GEORGE'S COUNTY UM JUST OUTSIDE OF DC SOUTHEAST DC AND THAT WAS ANOTHER LIKE HOT SPOT YOU WOULD DO THE SAME THING ON SATURDAY MORNING YOU WOULD CLEAN THE HOUSE UP BECAUSE WE COULDN'T GO OUT IF WE DIDN'T CLEAN UP THAT WAS THE RULE YOU KNOW YOU CLEAN UP FIRST AND DO ALL YOUR CHORES AND THEN YOU KNOW YOU WOULD GET YOUR BEST OUTFIT AND HOP ON THE SUBWAY AND JUST,23.45,1
../data_processed/wav/PRV_se0_ag2_m_02_1_part_129.wav,../data_processed/txt/PRV_se0_ag2_m_02_1_part_129.txt,"[You know], everybody's not out to uh, bring the town down or- or- or we out to make sure that whatever bad we can /help do/ this, you know, make it better.",YOU KNOW EVERYBODY'S NOT OUT TO UH BRING THE TOWN DOWN OR OR OR WE OUT TO MAKE SURE THAT WHATEVER BAD WE CAN HELP DO THIS YOU KNOW MAKE IT BETTER,8.49,1
../data_processed/wav/DCB_se2_ag4_f_02_1_part_40.wav,../data_processed/txt/DCB_se2_ag4_f_02_1_part_40.txt,"But I mean if it- but it's- it's- it's- it's just- it's- With them it was a little more subtle. Um, but I saw you know promotions, saw raises, saw who was treated differently, who was treated um, a little more friendly.",BUT I MEAN IF IT BUT IT'S IT'S IT'S IT'S JUST IT'S WITH THEM IT WAS A LITTLE MORE SUBTLE UM BUT I SAW YOU KNOW PROMOTIONS SAW RAISES SAW WHO WAS TREATED DIFFERENTLY WHO WAS TREATED UM A LITTLE MORE FRIENDLY,17.211,1
../data_processed_voc/wav/voc_24_part_140.wav,../data_processed_voc/txt/voc_24_part_140.txt,it was going down the cliffs. And it was just like Wow that's the house. [laughter],IT WAS GOING DOWN THE CLIFFS AND IT WAS JUST LIKE WOW THAT'S THE HOUSE,7.075,0
../data_processed/wav/ROC_se0_ag3_f_02_1_part_129.wav,../data_processed/txt/ROC_se0_ag3_f_02_1_part_129.txt,"And I had two friends, /RD-NAME-2/ and /RD-NAME-2/, and they would take turns going up there at night. And they'd come back with the hot dogs. And then when it was my turn, they'd both go with me <laugh> so I didn't have to go by myself. (laughing) <laugh> I was so funny. As I got older, we laughed about it. (laughing)",AND I HAD TWO FRIENDS AND AND THEY WOULD TAKE TURNS GOING UP THERE AT NIGHT AND THEY'D COME BACK WITH THE HOT DOGS AND THEN WHEN IT WAS MY TURN THEY'D BOTH GO WITH ME SO I DIDN'T HAVE TO GO BY MYSELF I WAS SO FUNNY AS I GOT OLDER WE LAUGHED ABOUT IT,20.505,1
../data_processed/wav/DCB_se1_ag4_m_02_1_part_90.wav,../data_processed/txt/DCB_se1_ag4_m_02_1_part_90.txt,"it's too many slangs- it's too many- it's definitely too many slangs being used. You know. And like I said about my girlfriend, she tryna sound slick, you know, but she's sixty two years old. So you know, sh- she should be herself. <ts> Stop tryna impress people. /?/. Just be yours- be yourself. Mm.",IT'S TOO MANY SLANGS IT'S TOO MANY IT'S DEFINITELY TOO MANY SLANGS BEING USED YOU KNOW AND LIKE I SAID ABOUT MY GIRLFRIEND SHE TRYNA SOUND SLICK YOU KNOW BUT SHE'S SIXTY TWO YEARS OLD SO YOU KNOW SH SHE SHOULD BE HERSELF STOP TRYNA IMPRESS PEOPLE JUST BE YOURS BE YOURSELF MM,20.314,1
../data_processed_voc/wav/voc_34_part_252.wav,../data_processed_voc/txt/voc_34_part_252.txt,"Right 'Cause like I have my -- one of my be- +best -- another best friend I didn't mention, Anabel {BR} Garcia, she was Garcia last name when we went to school. {BR} And she {BR} uh",RIGHT 'CAUSE LIKE I HAVE MY ONE OF MY BE BEST ANOTHER BEST FRIEND I DIDN'T MENTION ANABEL GARCIA SHE WAS GARCIA LAST NAME WHEN WE WENT TO SCHOOL AND SHE UH,11.558,0
../data_processed_voc/wav/voc_38_part_78.wav,../data_processed_voc/txt/voc_38_part_78.txt,"and they're like, ""Dontcha know,"" and different things an' ""We don't sound like that!"" Like, yes you do. {LG} That's exactly how those people sound. So, a lot of it's just being away from where you are an' when I go visit her in North Dakota and hearin' how they talk an'. {LG} It's kinda funny. {LG}",AND THEY'RE LIKE DONTCHA KNOW AND DIFFERENT THINGS AN' WE DON'T SOUND LIKE THAT LIKE YES YOU DO THAT'S EXACTLY HOW THOSE PEOPLE SOUND SO A LOT OF IT'S JUST BEING AWAY FROM WHERE YOU ARE AN' WHEN I GO VISIT HER IN NORTH DAKOTA AND HEARIN' HOW THEY TALK AN' IT'S KINDA FUNNY,15.843,0
../data_processed/wav/DCB_se2_ag4_f_01_1_part_123.wav,../data_processed/txt/DCB_se2_ag4_f_01_1_part_123.txt,"Didn't wanna go to a black school. Don't- n- n- I don't think any of us liked ourselves at the time. We were saying it loud, black and I'm proud but you know, we had some issues with you know, we were not succeeding. All you heard was negative things.",DIDN'T WANNA GO TO A BLACK SCHOOL DON'T N N I DON'T THINK ANY OF US LIKED OURSELVES AT THE TIME WE WERE SAYING IT LOUD BLACK AND I'M PROUD BUT YOU KNOW WE HAD SOME ISSUES WITH YOU KNOW WE WERE NOT SUCCEEDING ALL YOU HEARD WAS NEGATIVE THINGS,15.561,1
../data_processed_voc/wav/voc_36_part_106.wav,../data_processed_voc/txt/voc_36_part_106.txt,"different kinds of people, not just based on race or ethnicity but based on what people perceive to be difference, you know. Um, I'm so happy that California was one of the (( free )) -- you take that if you want, yeah. Yeah, I'm so happy that California was one of the f -- you know, first states to f -- well, no, it wasn't one of the first -- finally get the {LG} gay marriage thing together, so, you know, uh. Gender equality going on.",DIFFERENT KINDS OF PEOPLE NOT JUST BASED ON RACE OR ETHNICITY BUT BASED ON WHAT PEOPLE PERCEIVE TO BE DIFFERENCE YOU KNOW UM I'M SO HAPPY THAT CALIFORNIA WAS ONE OF THE FREE YOU TAKE THAT IF YOU WANT YEAH YEAH I'M SO HAPPY THAT CALIFORNIA WAS ONE OF THE F YOU KNOW FIRST STATES TO F WELL NO IT WASN'T ONE OF THE FIRST FINALLY GET THE GAY MARRIAGE THING TOGETHER SO YOU KNOW UH GENDER EQUALITY GOING ON,20.9,0
../data_processed/wav/DCB_se1_ag3_m_03_1_part_114.wav,../data_processed/txt/DCB_se1_ag3_m_03_1_part_114.txt,"If I like it, then it's- that's gonna be good enough, you know what I'm saying. I have people to help though, I have, you know, people to ask, and you know, see their- their input or whatever or what they would like me to write, or you know what I'm saying, what they would like to- Cause they're gonna be reading it, so I would- you know, what",IF I LIKE IT THEN IT'S THAT'S GONNA BE GOOD ENOUGH YOU KNOW WHAT I'M SAYING I HAVE PEOPLE TO HELP THOUGH I HAVE YOU KNOW PEOPLE TO ASK AND YOU KNOW SEE THEIR THEIR INPUT OR WHATEVER OR WHAT THEY WOULD LIKE ME TO WRITE OR YOU KNOW WHAT I'M SAYING WHAT THEY WOULD LIKE TO CAUSE THEY'RE GONNA BE READING IT SO I WOULD YOU KNOW WHAT,21.363000000000003,1
../data_processed/wav/ATL_se0_ag1_m_02_1_part_9.wav,../data_processed/txt/ATL_se0_ag1_m_02_1_part_9.txt,"hm, as a independent artist, you know, we have our egos about ourselves, and we feel like god damn, pretty much I could do it on my own. We hear o- everybody on the- on the radio talking about some I did it on my own I did it my own. Self made. You know, all this and that. But they really got a whole team behind them.",HM AS A INDEPENDENT ARTIST YOU KNOW WE HAVE OUR EGOS ABOUT OURSELVES AND WE FEEL LIKE GOD DAMN PRETTY MUCH I COULD DO IT ON MY OWN WE HEAR OH EVERYBODY ON THE ON THE RADIO TALKING ABOUT SOME I DID IT ON MY OWN I DID IT MY OWN SELF MADE YOU KNOW ALL THIS AND THAT BUT THEY REALLY GOT A WHOLE TEAM BEHIND THEM,20.737,1
../data_processed/wav/DCB_se3_ag4_f_02_1_part_45.wav,../data_processed/txt/DCB_se3_ag4_f_02_1_part_45.txt,"like everything else. You see m- almost more white people over there than you- than you see- saw black people- see black people. And that's why the- the hous- pricing- the housing prices have gone up is what I'm saying. I mean that was a little- I mean, you know, those houses are <sigh> you know. And even the school systems haven't caught up with those neighborhoods,",LIKE EVERYTHING ELSE YOU SEE M ALMOST MORE WHITE PEOPLE OVER THERE THAN YOU THAN YOU SEE SAW BLACK PEOPLE SEE BLACK PEOPLE AND THAT'S WHY THE THE HOUS PRICING THE HOUSING PRICES HAVE GONE UP IS WHAT I'M SAYING I MEAN THAT WAS A LITTLE I MEAN YOU KNOW THOSE HOUSES ARE YOU KNOW AND EVEN THE SCHOOL SYSTEMS HAVEN'T CAUGHT UP WITH THOSE NEIGHBORHOODS,21.133000000000006,1
../data_processed_voc/wav/voc_1_part_221.wav,../data_processed_voc/txt/voc_1_part_221.txt,I never thought about it ... maybe ... I don't know about the bay area I hardly ever enter ... act with people from the bay area for some reason I've never been there and I hardly know anybody from there ... so I don't know ... in Los Angeles ...,I NEVER THOUGHT ABOUT IT MAYBE I DON'T KNOW ABOUT THE BAY AREA I HARDLY EVER ENTER ACT WITH PEOPLE FROM THE BAY AREA FOR SOME REASON I'VE NEVER BEEN THERE AND I HARDLY KNOW ANYBODY FROM THERE SO I DON'T KNOW IN LOS ANGELES,20.108,0
../data_processed_voc/wav/voc_5_part_131.wav,../data_processed_voc/txt/voc_5_part_131.txt,curves and whatever to shorten that time you know if they did that maybe this'd become more of a bedroom community for Redding I don't know how much time they're gonna be able to shave,CURVES AND WHATEVER TO SHORTEN THAT TIME YOU KNOW IF THEY DID THAT MAYBE THIS'D BECOME MORE OF A BEDROOM COMMUNITY FOR REDDING I DON'T KNOW HOW MUCH TIME THEY'RE GONNA BE ABLE TO SHAVE,13.093,0
