wav_file,txt_file,groundtruth_text,duration
~/aave_speech_rec/data_processed/wav/DCB_se3_ag3_f_01_1_part_110.wav,~/aave_speech_rec/data_processed/txt/DCB_se3_ag3_f_01_1_part_110.txt,"<ts> I mean I've eaten it. It's- I mean it's something that I feel like you get on your fried chicken when I would you know, uh- go to carry outs and whatnot growing up. Um, <ts> something else I didn't really realize was unique to DC until I got older. It's tasty. <ts>",22.206999999999997
~/aave_speech_rec/data_processed/wav/ROC_se0_ag1_m_03_1_part_87.wav,~/aave_speech_rec/data_processed/txt/ROC_se0_ag1_m_03_1_part_87.txt,"upstate lingo with a little bit of down south words, <laugh>",8.117
~/aave_speech_rec/data_processed/wav/ROC_se0_ag3_f_02_1_part_61.wav,~/aave_speech_rec/data_processed/txt/ROC_se0_ag3_f_02_1_part_61.txt,"So they didn't have, uh, projects and, uh, townhouses and apartment buildings and stuff. They didn't have all that back then.",11.821
~/aave_speech_rec/data_processed/wav/PRV_se0_ag2_m_02_2_part_8.wav,~/aave_speech_rec/data_processed/txt/PRV_se0_ag2_m_02_2_part_8.txt,"Um, most of 'em were moving back because they believe in uh, it's- it's h- they s- use the term homeland.",7.142
~/aave_speech_rec/data_processed/wav/PRV_se0_ag3_m_02_3_part_4.wav,~/aave_speech_rec/data_processed/txt/PRV_se0_ag3_m_02_3_part_4.txt,"Uh, but I don't know how many years. But it used to come up here and go across the roads there, just a couple of days and go on back down, [something like that.]",8.991
~/aave_speech_rec/data_processed/wav/ATL_se0_ag2_m_03_1_part_138.wav,~/aave_speech_rec/data_processed/txt/ATL_se0_ag2_m_03_1_part_138.txt,"[You gotta] know. You gotta know that. E- easily too, bro. So it just- you know what I mean, it just depends, you feel me.",6.377999999999999
~/aave_speech_rec/data_processed/wav/ROC_se0_ag1_m_01_1_part_65.wav,~/aave_speech_rec/data_processed/txt/ROC_se0_ag1_m_01_1_part_65.txt,"it's community service at the end of the day. Like, I wanna go everywhere. I wanna offer my service everywhere touch- excuse me, touch as many people as possible. And, um, it allowed me a lot of different connections that, I mean, I still have today that still allows me do certain things in the community. I'm like, alright, I want a event over here. Okay let's contact so and so. Um, yeah. I mean, now- um, I mean, now I'm at /RD-SCHOOL-2/. But, uh, earlier this year I did a contract at /RD-SCHOOL-4/ from September to June. Which I got from being in /RD-WORK-4/, [um,]",40.546
~/aave_speech_rec/data_processed/wav/ROC_se0_ag2_f_03_1_part_78.wav,~/aave_speech_rec/data_processed/txt/ROC_se0_ag2_f_03_1_part_78.txt,"you know. But it was something that I was never able to do at /RD-WORK-2/, you know. And so, that was- that was a good thing. It was important. You know, so.",9.522
~/aave_speech_rec/data_processed/wav/DCB_se1_ag1_m_01_1_part_80.wav,~/aave_speech_rec/data_processed/txt/DCB_se1_ag1_m_01_1_part_80.txt,<laugh> I /um-/ I like to laugh so I say like I watch MTV or BET. I like to laugh a lot.,7.109
~/aave_speech_rec/data_processed/wav/DCB_se1_ag2_m_02_1_part_26.wav,~/aave_speech_rec/data_processed/txt/DCB_se1_ag2_m_02_1_part_26.txt,"there is a higher power and I- I mean beyond that, I'm still searching for any- or everything else, all of the- you know, I don't really have a belief far as a religion. Like I don't have a religion that I could be like oh I'm this or that. I don't even wanna label myself as such [cause I don't even] wanna box myself in [How-] to only being able to go or obtain knowledge in this box right here. I wanna be able to have knowledge on everything. I don't wanna box myself in. Oh, okay. I feel you. [You know what I'm saying? So- [Oh, okay.] So you wanna think for yourself [instead of] being told [what to think.] [Yeah I-] [Yeah yeah. I don't- I don't wanna have to be confined to restrictions of different things just by somebody's belief or pretty much offer their opinions.",50.378
~/aave_speech_rec/data_processed/wav/DCB_se2_ag3_m_01_1_part_19.wav,~/aave_speech_rec/data_processed/txt/DCB_se2_ag3_m_01_1_part_19.txt,"reconnecting with that part of the family was weird at first. Um, but refreshing. And I remember sitting- We had the little banquet that night, and they actually went through the lineage. And to be in a room and- and to be- feel connected, was, you know, the- All the other stuff from me and my father went out the window because I realized the connect- the connection that I had with, you know, eight generations of people. And they're tracing and going back and looking and seeing that this and this and this and this. So, it was interesting. Humbling, I'll say.",31.958000000000002
~/aave_speech_rec/data_processed/wav/PRV_se0_ag1_f_02_1_part_97.wav,~/aave_speech_rec/data_processed/txt/PRV_se0_ag1_f_02_1_part_97.txt,"[They- <laugh>] It's like- It's Princeville against East Tarboro which is only a bridge separating [them, and]",6.435
~/aave_speech_rec/data_processed/wav/DCB_se2_ag3_m_02_1_part_70.wav,~/aave_speech_rec/data_processed/txt/DCB_se2_ag3_m_02_1_part_70.txt,"I remember one day, I was the brave soul that darted out there. Um, I got across the gate, and I ran down the street, uh, cut through a alley, got away from the cops, and it happened to be free ice cone day- I mean ice cream day at Ben and Jerry's, so I went to Ben and Jerry's and got ice cream. Delinquent, hood /RD-NAME-2/ stories. Boom. Um, so there was- there was that. Um, it was a bittersweet moment when I left /RD-SCHOOL-2/ though because I was finally starting to connect with folks. Um, so that was interesting. Like, leaving the school. Um, we had to write- oh! My teacher, uh, Miss /RD-NAME-2/, my English teacher, um, she had us",50.49
~/aave_speech_rec/data_processed/wav/DCB_se1_ag2_f_03_1_part_62.wav,~/aave_speech_rec/data_processed/txt/DCB_se1_ag2_f_03_1_part_62.txt,"didn't work out this time. Let's do it better next time, and how am I gonna do X Y and Z? So like, it's a lot different being on the other side. But it's like, the best of both worlds at the same [time] because you can tell the kids like,",14.532
~/aave_speech_rec/data_processed/wav/DCB_se1_ag2_m_01_1_part_172.wav,~/aave_speech_rec/data_processed/txt/DCB_se1_ag2_m_01_1_part_172.txt,"[Yeah, you got] different lingos everywhere you go. That's a- that's a- that's a- that's a- that's a urban culture thing. Like that's just like- you know what I'm saying, every- every- you know what I'm saying, every section got they own little lingos whatever but that's just a urban thing like everywhere you go, you gonna hear different type of languages and stuff like- but that's just like, we unique people. Like, black people got a unique gene in our body. They can't take that from us, they try to, try to beat the shit out of us, but they couldn't do that. We some special people, so it was just like yeah, it's just like- yeah, that's- that's everywhere. [You gonna find] different [lingos.]",29.47300000000001
~/aave_speech_rec/data_processed/wav/DCB_se2_ag3_m_01_1_part_137.wav,~/aave_speech_rec/data_processed/txt/DCB_se2_ag3_m_01_1_part_137.txt,"[and go] each hymn by hymn and just sing cause it- that was a- just a part of you know, our upbringing. When I was younger, there was a white, blue and orange Fisher Price radio that set on my bed frame at the head- on the headboard. Had a little microphone on the side in case you wanted to get real extra and sing. Every night that mus- that radio played classical music, every night. Every night. And so it was- it was embedded in me, and the power of the- I think the power of the art while I was s- while I was such a student of the arts, it was put in me.",38.036
~/aave_speech_rec/data_processed/wav/DCB_se1_ag2_m_01_1_part_12.wav,~/aave_speech_rec/data_processed/txt/DCB_se1_ag2_m_01_1_part_12.txt,"[Well my- my sister-] yeah my older sister like, my- my older sister yeah, she was out there, you know what I'm saying, she was out there too you know what I'm saying, she's four years older than me so it was like, she was out there doing her thing having fun and stuff too but like my little sister, she was more like sheltered like by the time she got of age like she was- we already had, you know what I'm saying, established what's going on, and you ain't about to be out there doing all this and that you know what I'm saying so like, she grew up /?/ like different from us she was r- real like /?/ like /?/. Me and my older sister we was out there, like she wasn't really- she ain't really experienced the stuff that we experienced like that.",29.359
~/aave_speech_rec/data_processed/wav/PRV_se0_ag3_f_02_1_part_75.wav,~/aave_speech_rec/data_processed/txt/PRV_se0_ag3_f_02_1_part_75.txt,"You know how to become a better parent, um, uh, parent- control parenting,",5.814
~/aave_speech_rec/data_processed/wav/PRV_se0_ag1_f_01_1_part_57.wav,~/aave_speech_rec/data_processed/txt/PRV_se0_ag1_f_01_1_part_57.txt,"It was like, you could do this and you made a little hole, and he was like, okay. And um, we was like, Lord, and um, <ts> I guess the houses, /uh they would stay/ swell like, just cause so much was- and dried and it was swelling.",11.953
~/aave_speech_rec/data_processed/wav/ROC_se0_ag3_f_02_1_part_12.wav,~/aave_speech_rec/data_processed/txt/ROC_se0_ag3_f_02_1_part_12.txt,"I didn't let him know that. And I didn't run from him or anything like that. So one day he was- um, he was reading in the library, and, um, he used to read the Who's Who. So he said, /RD-NAME-1/, come here. So I went over, and he said, this is my dad or father, whatever he said. I said, oh, /RD-ADDRESS-4/ Georgia, I said, that's where I'm from. He said, really? I said, yeah. I said, I knew some /RD-NAME-3/. I said, you must, uh, be the /RD-NAME-3/ from /RD-ADDRESS-4/. I said, you know /RD-NAME-4/? He said, it was my grandfather. I said, really? And he said, yeah. I said, oh, I knew them. I knew. your family, and like that.",51.148999999999994
~/aave_speech_rec/data_processed/wav/PRV_se0_ag3_f_02_2_part_84.wav,~/aave_speech_rec/data_processed/txt/PRV_se0_ag3_f_02_2_part_84.txt,"Yes. I think uh, people have worked well. Um, I did have some pictures where we took uh, like in- when some of the foundations were done,",11.868
~/aave_speech_rec/data_processed/wav/DCB_se2_ag4_f_02_1_part_149.wav,~/aave_speech_rec/data_processed/txt/DCB_se2_ag4_f_02_1_part_149.txt,"[And that's because I'm] here with it and I see it every day and I guess I take it for granted. And every once in a while I'll stop and take- you know if I'm driving downtown for something um, and go that way especially at night cause DC is [beautiful at] night. The monuments and all the white stone, it's just beautiful at night.",15.827
~/aave_speech_rec/data_processed/wav/ROC_se0_ag1_f_03_1_part_147.wav,~/aave_speech_rec/data_processed/txt/ROC_se0_ag1_f_03_1_part_147.txt,"Yeah. I mean you're right, but I tried to keep that goal in mind and I tried to think that even if I got my heart broken, I still kno- at least know that I can- I can try to be with someone without manipulation, [or riding] on the coat tails of something else, or like-",16.009
~/aave_speech_rec/data_processed/wav/PRV_se0_ag3_f_04_3_part_61.wav,~/aave_speech_rec/data_processed/txt/PRV_se0_ag3_f_04_3_part_61.txt,"Mm-hm. And /when- and when I/ don't eat to my sister. Cause she told me Saturday, you come by here and you eat.",9.326
~/aave_speech_rec/data_processed/wav/DCB_se1_ag2_m_01_1_part_39.wav,~/aave_speech_rec/data_processed/txt/DCB_se1_ag2_m_01_1_part_39.txt,"[You] gotta look for it, it's a nice smooth tequila. I'm a tequila man I can't do nothing but tequila. I can drink Cognac now, at first I couldn't drink Cognac it used to make me go to sleep instantly. But now I can drink Cognac.",8.642999999999999
~/aave_speech_rec/data_processed/wav/DCB_se2_ag4_m_01_1_part_128.wav,~/aave_speech_rec/data_processed/txt/DCB_se2_ag4_m_01_1_part_128.txt,"And I- I- I w- I'm working at /RD-WORK-3/. You know, and I'm like this. I went in there, I did what I had to do. Not only that, I had a test on the system. I'm- I'm testing three floors. I got water on the system. I had water on the system from yesterday to /??/. You know how much pressure on them pipes? And I'm like this. I went in there to make sure. I walked in there- walked in there, the mother fucking- so much w- water pressure on the mother fucking pipes the mother fucking /??/ burst. I h- I had to release the plug. I had to release the plug. Man sitting up there telling me- the security come in talking about what you doing here? I'm like this. Who you talking to, dog, this is- Hey, this is my thing. I come and put this in here to make sure this building be operating when I leave. So I'm like this, I release the plug, this that and the other. And th- and my boys jumped on me and set up there and tell me and say hey, why- why was- w- what you do here /RD-NAME-1/? Ho, ho, ho. I set up there, I was laying down in my bed, and I said, man, you know what? I got so much pressure on that line. I said, man, jump up.",52.276
~/aave_speech_rec/data_processed/wav/ATL_se0_ag1_f_03_1_part_17.wav,~/aave_speech_rec/data_processed/txt/ATL_se0_ag1_f_03_1_part_17.txt,"Um, I- Not in high school. I mean I know when I was in New York when I use to g- when I was in junior high, I would leave my house extra early to go to the park in the morning time. To swing on the swings. As old as I was in junior high, I could still fit on the swings [<laugh>]",15.640999999999998
~/aave_speech_rec/data_processed/wav/PRV_se0_ag3_m_01_1_part_130.wav,~/aave_speech_rec/data_processed/txt/PRV_se0_ag3_m_01_1_part_130.txt,"She said she couldn't take it cause one of us- I think my baby- younger brother had got hitten by a car, going across the street to Mr. /RD-NAME-1/ house",9.857999999999999
~/aave_speech_rec/data_processed/wav/ATL_se0_ag1_m_03_1_part_4.wav,~/aave_speech_rec/data_processed/txt/ATL_se0_ag1_m_03_1_part_4.txt,I am of black descent. I'm African American.,5.202000000000001
~/aave_speech_rec/data_processed/wav/ROC_se0_ag1_f_03_1_part_129.wav,~/aave_speech_rec/data_processed/txt/ROC_se0_ag1_f_03_1_part_129.txt,"we're like, hey, serve this slice to that black guy over there. And then when I quit, nobody realized that I was black.",5.414
~/aave_speech_rec/data_processed/wav/PRV_se0_ag2_f_01_2_part_5.wav,~/aave_speech_rec/data_processed/txt/PRV_se0_ag2_f_01_2_part_5.txt,"but I still let them think it's unprofessional that you have a client here, you're not here.",5.077
~/aave_speech_rec/data_processed/wav/ATL_se0_ag1_m_03_1_part_17.wav,~/aave_speech_rec/data_processed/txt/ATL_se0_ag1_m_03_1_part_17.txt,"[the- yeah], the fancy- the shrimp scampis and sca- I don't- I don't need all tha- I'm allergic to seafood matter fact. I [can't even eat none of] that.",6.49
~/aave_speech_rec/data_processed/wav/DCB_se3_ag4_f_02_1_part_90.wav,~/aave_speech_rec/data_processed/txt/DCB_se3_ag4_f_02_1_part_90.txt,"[Yeah.] So um, w- Okay. The- Were the riots happen in sixty three?",6.452999999999999
~/aave_speech_rec/data_processed/wav/DCB_se1_ag3_f_01_1_part_107.wav,~/aave_speech_rec/data_processed/txt/DCB_se1_ag3_f_01_1_part_107.txt,"[take advantage] of it cause like/RD-NAME-2/ um- /RD-NAME-1/ has four older sisters, and two of his older sisters I raised through foster care. And I used to tell them, I hate the situation that y'all are in, but y'all are in the best situation that anybody could aks for. Go to school, get your education. Get those grades- They will pay for four- any four year [institution.]",23.901999999999997
~/aave_speech_rec/data_processed/wav/PRV_se0_ag2_m_02_2_part_2.wav,~/aave_speech_rec/data_processed/txt/PRV_se0_ag2_m_02_2_part_2.txt,"[based] on finances or based on uh, situations going on, sometime you may think this should be top priority but the town administration see that this is top priority.",8.502
~/aave_speech_rec/data_processed/wav/DCB_se1_ag4_m_01_1_part_66.wav,~/aave_speech_rec/data_processed/txt/DCB_se1_ag4_m_01_1_part_66.txt,"[You know] /and you/ talking about eyes on the prize but you know that documentary about King? We taking our eyes off the prize you know and we pretty much let- let uh, let a lot of thing- even technology you know, separate us, you know. Just because people have access to cell phones and you know computers and uh, laptops uh, w- and- and- and iPads and you know what have you um- They cannot- okay and cable TV uh, and you cannot for a m- for a minute become complacent and feel that you know you uh, should let those things be you know, your driving force of you know, empowerment, those are not. They're not. You know, in other words those are just /to/ we're- we are consumers rather than manufacturers, you know.",39.805
~/aave_speech_rec/data_processed/wav/DCB_se1_ag3_m_03_1_part_57.wav,~/aave_speech_rec/data_processed/txt/DCB_se1_ag3_m_03_1_part_57.txt,"President position now. But he's just a man with no filter. Donald Trump tells you what's on- What you see is what you get from Donald Trump. I c- I actually can trust him. You know what I'm saying, cause it's no- He gonna tell you the- [you figure he gonna tell-] [He gon- he can't hide] what he's [Feeling.] [feeling.] [You know what I'm saying.] [And he- and you can-] even though you may think he lunching or [tripping,] [Yeah.] you can respect that at least he ain't [Exactly.] [hiding] it. Yeah, least he not hiding it. If Donald Trump don't like /the uh,/ the Mexicans, you know he don't like Mexicans. He not hiding [it.] [Right] as opposed to someone there who don't like Mexicans but they're playing like they do. Yeah, but [playing], yeah, see, but what [you see is what you get from him, so.] [/Okay./] [I mean, I mean, I understand, I understand] what you're saying, [/man./] [I- me], personally, I could respect that and shit like that. And I don't",51.773
~/aave_speech_rec/data_processed/wav/ATL_se0_ag1_f_02_1_part_23.wav,~/aave_speech_rec/data_processed/txt/ATL_se0_ag1_f_02_1_part_23.txt,"Yeah. His biological father was white, but his mother- I mean his biological father was Black, but his mother was white.",6.021
~/aave_speech_rec/data_processed/wav/PRV_se0_ag3_f_03_1_part_118.wav,~/aave_speech_rec/data_processed/txt/PRV_se0_ag3_f_03_1_part_118.txt,"[I waited] so old before I got any. Started age uh, thirty seven when I had the girl and age of thirty eight when I had the boy. I prayed the Lord for my kids- to have some kids. And he gave 'em to me. [<laugh>]",12.748
~/aave_speech_rec/data_processed/wav/ROC_se0_ag2_f_01_1_part_16.wav,~/aave_speech_rec/data_processed/txt/ROC_se0_ag2_f_01_1_part_16.txt,"Yeah. Well, you know, I- you know I- I- I think that someone- someone apparently back in the sixties was somewhat forward looking to the degree that they were able to map out like a neighborhood that would be close to the center of the city, and- you know, and- you know like an easy walk or an easy bike ride, you know, to downtown work, and, you know, businesses, and- and government offices, and /they/ bought up a bunch of property. And, y- you know, it- I don't know at what point- I thought it was- it was more seventies, eighties, nineties when people from the suburbs were coming back into the city. But yeah, uh, that's about the time Corn Hill like sprung up too. So, you know, you know, people were coming back into the city, and they were like scoping out neighborhoods that would",51.074
~/aave_speech_rec/data_processed/wav/PRV_se0_ag1_f_01_3_part_10.wav,~/aave_speech_rec/data_processed/txt/PRV_se0_ag1_f_01_3_part_10.txt,"Um, <ts> let's see. I don't really- I can't really say because um, I had a- I had a good GPA.",8.816
~/aave_speech_rec/data_processed/wav/PRV_se0_ag3_f_03_1_part_98.wav,~/aave_speech_rec/data_processed/txt/PRV_se0_ag3_f_03_1_part_98.txt,To the foot and to the bottom to the head. Well we kept one but one thing my dad was very /survivor man/ he raise a lot of hogs. He raise a lot of chicken. So we didn't go hungry.,9.439
~/aave_speech_rec/data_processed/wav/ATL_se0_ag2_m_02_1_part_56.wav,~/aave_speech_rec/data_processed/txt/ATL_se0_ag2_m_02_1_part_56.txt,"you know what I'm saying, from his business aspect and how he moves as a businessman is fucking impeccable.",5.056
~/aave_speech_rec/data_processed/wav/DCB_se3_ag3_m_02_1_part_163.wav,~/aave_speech_rec/data_processed/txt/DCB_se3_ag3_m_02_1_part_163.txt,"And if you in a position to help, you put yours to the side. And that's [how I always] been, put yours to the side to try and help them.",5.355
~/aave_speech_rec/data_processed/wav/PRV_se0_ag3_f_04_1_part_85.wav,~/aave_speech_rec/data_processed/txt/PRV_se0_ag3_f_04_1_part_85.txt,"And when they did let us come, the bedroom over there, it had a /bare roof/. I didn't even know. I said, what is that?",9.785
~/aave_speech_rec/data_processed/wav/ROC_se0_ag1_f_02_1_part_57.wav,~/aave_speech_rec/data_processed/txt/ROC_se0_ag1_f_02_1_part_57.txt,"I knew I could do it, but I just didn't want to. And I think I'm okay, w- with, uh, living with that decision.",6.858
~/aave_speech_rec/data_processed/wav/ROC_se0_ag1_f_03_1_part_136.wav,~/aave_speech_rec/data_processed/txt/ROC_se0_ag1_f_03_1_part_136.txt,"And I figured at this point, if I can't be a completely good person and just try this and see if it works, like I needed it to be like, the control in an experiment.",11.254000000000001
~/aave_speech_rec/data_processed/wav/PRV_se0_ag3_f_02_1_part_82.wav,~/aave_speech_rec/data_processed/txt/PRV_se0_ag3_f_02_1_part_82.txt,"And some of them uh, like when growing up, you can just about tell you know, how a person's gonna turn out [if you] be with them for a [while.]",10.514000000000001
~/aave_speech_rec/data_processed/wav/PRV_se0_ag1_m_02_1_part_103.wav,~/aave_speech_rec/data_processed/txt/PRV_se0_ag1_m_02_1_part_103.txt,"You know, they in the hot sun, which is beaming straight down on 'em, but you in this tin, it- it even more hotter.",5.9220000000000015
~/aave_speech_rec/data_processed/wav/DCB_se1_ag3_m_01_1_part_15.wav,~/aave_speech_rec/data_processed/txt/DCB_se1_ag3_m_01_1_part_15.txt,"[They go-] they got new houses. They building new houses in the back, in the- in the back of the neighborhood They developed the neighborhood, definitely. [Uh, it's p- it's p-]",11.037
~/aave_speech_rec/data_processed/wav/ATL_se0_ag1_m_02_1_part_5.wav,~/aave_speech_rec/data_processed/txt/ATL_se0_ag1_m_02_1_part_5.txt,"Well, man, I started actually l- legit living in Atlanta really Decatur east side Atlanta, uh, what was- this was like twenty fifteen. This w- this around twenty fifteen, I s- I came here when I- right around November twenty fifteen, man. And, uh, you know, it was just like obviously Atlanta is the land of opportunity, so, you know, coming from where I come from, which is Rockdale county AKA Trapdale, you know, everybody is kind of in this closed box. I- [it's no-]",39.86
~/aave_speech_rec/data_processed/wav/DCB_se2_ag2_f_02_1_part_76.wav,~/aave_speech_rec/data_processed/txt/DCB_se2_ag2_f_02_1_part_76.txt,"um, cause my grandmother I guess was born in about nineteen thirty or nineteen fortyish? Um, so always telling me, you know, you got to be a young lady, um, and to this day, I remember, and I tell people all the time. My grandmother drunk beer, but she would pour the beer into a glass. Always drunk out a straw. Never put her lips on the rim of a cup. Um, and she would yell at me for it. Like, you're a young lady. Why are you doing that? You shouldn't do that. And I- I guess it confused me because I guess my family grew up in DC, but she didn't grew up in DC. She grew i- up in the South somewhere.",32.709
~/aave_speech_rec/data_processed/wav/ATL_se0_ag2_m_03_1_part_36.wav,~/aave_speech_rec/data_processed/txt/ATL_se0_ag2_m_03_1_part_36.txt,"there's a bigger calling in life, and I rather be focused, you see what I'm saying, than be blow. But I still get- I still get blow, and I ain't even necessarily just talking about weed, you feel me.",8.475
~/aave_speech_rec/data_processed/wav/DCB_se1_ag3_f_01_1_part_160.wav,~/aave_speech_rec/data_processed/txt/DCB_se1_ag3_f_01_1_part_160.txt,"Who else? Um, <ts> I remember Fat Rodney used to rap with one of the go go bands. Um, I'm trying to think. I was a go go fanatic. Chuck Brown. [Oh!]",14.963
~/aave_speech_rec/data_processed/wav/PRV_se0_ag1_m_02_1_part_33.wav,~/aave_speech_rec/data_processed/txt/PRV_se0_ag1_m_02_1_part_33.txt,"<sigh> M- What? Give and take. Um, I don't know, man. What? I don't know. <laugh> Cause I- I- [I-]",8.942
~/aave_speech_rec/data_processed/wav/DCB_se1_ag3_f_03_1_part_84.wav,~/aave_speech_rec/data_processed/txt/DCB_se1_ag3_f_03_1_part_84.txt,"But then, when Backyard Band came in, they had like this bounce beat. So you had like this- this, you know, ongoing bounce beat or whatever going on. I didn't care too much <laugh> for a [bounce beat.] (laughing)",13.519
~/aave_speech_rec/data_processed/wav/ATL_se0_ag2_m_03_1_part_124.wav,~/aave_speech_rec/data_processed/txt/ATL_se0_ag2_m_03_1_part_124.txt,"Everybody ain't gonna always like what the next person do. That's why everybody got different fans, you feel me. And some niggas got the same fan that listen to ten different artists, you feel me, but might not fuck with this one artist, you feel me. So I drop everything on the internet first. I drop all visuals, everything, and just like- like- even like what- you know what I mean, what we doing right now, you feel me, like nigga w- I got that- had that tripod, you feel me. We coulda put th- my little iPhone right there, <sound effect>",25.886
