../data_processed_voc/wav/voc_23_part_25.wav,../data_processed_voc/txt/voc_23_part_25.txt,IT WAS A GOOD JOB THEN MY OTHER BROTHER IS IN NEW YORK CAUSE HIS WIFE'S FROM BUFFALO SO THEY MOVED BACK AND MY YOUNGER BROTHER JUST MOVED TO OAKLAND FROM WASHINGTON STATE AND THEN MY OLDER SISTER UH IS IN WASHINGTON DC SHE GOT HER JOB WITH THE FEDERAL GOVERNMENT,0,it was a good job then my other brother is in New York cuz his wife's from Buffalo so they moved back and my younger brother just moved to Oakland from Washington State and then my older sister uh is in Washington D C. She got her job with the federal government,18.805
../data_processed_voc/wav/voc_16_part_250.wav,../data_processed_voc/txt/voc_16_part_250.txt,AND UH SO UM THEN ONE BY ONE THEY WOULD GET CALLED SOMEBODY WENT THIS WAY THAT WAY THE OTHER WAY BUT MY HUSBAND DIDN'T GET CALLED SO HE SAYS WHY NOT WHY DIDN'T THEY CALL ME SO HE WENT DOWN THEY SAID WELL NOT YET NOT YET SO FINALLY THEY CALLED HIM IN AND UH SO THEY CALLED HIM INTO AN OFFICE AND THEN THERE WAS UH THE BRASS WAS THERE AND TH THERE WAS A THERE A FELLOW TAKING NOTES AND SUCH SO THEY START ASKING HIM QUESTIONS,0,"And uh, so um, then one by one, they would get called. Somebody went this way, that way, the other way, but my husband didn't get called. So he says, ""why not? Why didn't they call me?"" So he went down, they said, ""well, not yet, not yet"". So finally they called him in. And uh, so they called him into an office, and then there was uh, the brass was there, and th- there was a (()) there, a fellow taking notes and such, so they start asking him questions.",26.82
../data_processed_voc/wav/voc_27_part_101.wav,../data_processed_voc/txt/voc_27_part_101.txt,YOU KNOW IT'S JUST LIKE FINE YOU KNOW I DON'T CARE I STILL LOVE YOU WE'RE STILL FRIENDS UM WE CAN PLAY THIS GAME IF YOU WANT I DON'T CARE AND HER OLDEST DAUGHTER IS ALSO GAY AND I'M LIKE OKAY WELL BUT IT'S LIKE NOBODY EVER SAYS ANYTHING ABOUT BUT I THINK IT'S THE OLD MENTALITY SHE DOESN'T KNOW HOW,0,you know it's just like fine you know I don't care I still love you we're still friends um we can play this game if you want I don't care and her oldest daughter is also gay and I'm like okay well but it's like nobody ever says anything about but I think it's the old mentality she doesn't know how,20.836
../data_processed_voc/wav/voc_16_part_273.wav,../data_processed_voc/txt/voc_16_part_273.txt,EUREKA I'VE THERE'S A LADY HERE THAT CAME FROM EUREKA I BELIEVE AND ONE OF MY COUSINS LIVE THERE AND MENDECI I'M I'VE THESE ARE JUST,0,"Eureka, I've there's a lady here that came from Eureka I believe, and one of my cousins live there. And Mendeci- I'm I've these are just",11.597000000000001
../data_processed_voc/wav/voc_11_part_17.wav,../data_processed_voc/txt/voc_11_part_17.txt,NO IN MY INDUSTRY IN THE DESIGN WORLD IT'S NOT A BIG DEAL,0,"No. In my industry, in the design world, it's not a big deal.",5.954
../data_processed_voc/wav/voc_13_part_91.wav,../data_processed_voc/txt/voc_13_part_91.txt,UM I LOVE THE WEATHER UM THERE'S JUST SO MUCH TO DO BUT IT DOESN'T FEEL OVERWHELMING UM AND I JUST YOU KNOW AND I LIKE I LIKE THAT UM HERE IN CALIFORNIA I WOULD LOVE TO LIVE LIKE IN THE MONTERREY BAY AREA,0,um  I love the weather um there's just so much to do but it doesn't feel  overwhelming um and I just you know and I like I like that um here in California I would love to live like in the Monterrey Bay Area,20.292
../data_processed_voc/wav/voc_35_part_8.wav,../data_processed_voc/txt/voc_35_part_8.txt,AND SO MY INTEREST REALLY WAS WRITING ABOUT UH AGING AND HOW IT UM IMPACTS OUR SOCIETY AND THE INDIVIDUALS AND THE SERVICES THAT ARE AVAILABLE NEVER DID GET THAT FAR UH WENT DID MY INDEPENDENT LIVING SKILLS WORKING WITH PEOPLE WITH DISABILITIES AND THEN MET MY HUSBAND AND,0,and so my interest really was writing about uh aging and how it um impacts our society and the individuals and the services that are available. Never did get that far uh went -- did my independent living skills working with people with disabilities and then met my husband and,20.287
../data_processed_voc/wav/voc_8_part_66.wav,../data_processed_voc/txt/voc_8_part_66.txt,BUT UM AT THE TIME WE HAD THE BIG FOUR WE AND WE HAD YOU KNOW THE START OF THE TRANSCONTINENTAL RAILROAD OUT OF HERE SO SOUTHERN PACIFIC ALL OF THAT HAD A HUGE INFLUENCE OVER,0,"-- but, um, at the time we had the big four -- we -- and we had, you know, the start of the Transcontinental Railroad out of here. So Southern Pacific, all of that had a huge influence over",15.638
../data_processed_voc/wav/voc_30_part_89.wav,../data_processed_voc/txt/voc_30_part_89.txt,SORT OF THE MORE REMOTE PLACES OF CALIFORNIA BUT JUST TAXES AND THINGS IN CALIFORNIA IS INSANE SO WE KIND OF JUST WANT OUT OF CALIFORNIA OKAY,0,"sort of the more remote places of california, but just taxes and things in California is insane, so we kind of just want out of California okay {LG}",14.075
../data_processed_voc/wav/voc_14_part_166.wav,../data_processed_voc/txt/voc_14_part_166.txt,UM SO THAT'S DEFINITELY ONE THING I WOULD CHANGE ABOUT ANY COMMUNITY ANYWHERE UM CAUSE EVEN IN SAN FRANCISCO EVEN THOUGH IT'S BIGGER IT'S STILL THE SAME THING IT'S VERY INCESTUOUS UM BUT WHAT I DO LIKE ABOUT UM THE COMMUNITY HERE IS UM THE SMALL TOWN MENTALITY WHERE THERE PEOPLE ARE I FEEL LIKE A LOT FRIENDLIER,0,um so that's definitely one thing I would change about any [spells out L.G.B.T.] community anywhere um cuz even in San Francisco even though it's bigger it's still the same thing it's very incestuous um but what I do like about um the [spells out L.G.B.T.] community here is um the small town mentality where there people are I feel like a lot friendlier,23.155
../data_processed_voc/wav/voc_14_part_162.wav,../data_processed_voc/txt/voc_14_part_162.txt,FEEL FILL WHICH WITCH COT CAUGHT PULL POOL WINDY WENDY,0,feel fill which witch cot caught pull pool windy Wendy,8.84
../data_processed_voc/wav/voc_34_part_163.wav,../data_processed_voc/txt/voc_34_part_163.txt,BUT THOSE UM UH YOU KNOW THOSE I THERE'S SOME REALLY YOU KNOW NICE THINGS THAT HAVE HAPPENED THROUGH THAT BUT BUT LIKE YOU YOU KNOW YOU KNOW WHAT I'M TALKING ABOUT AND I IT'S TOO BAD THAT THAT IS HAPPENING BECAUSE IT,0,"But those um -- uh, you know, those -- i- -- there's some really you know, nice things that have happened through that, but {BR} but like you you know, you know what I'm talking about, and {BR} i- -- it's too bad, that (( )) that is happening, because {BR} it",15.834000000000001
../data_processed_voc/wav/voc_15_part_108.wav,../data_processed_voc/txt/voc_15_part_108.txt,E BUT UH UM NANNA MCDONALD WAS BORN IN EIGHTEEN SIXTY FIVE JUST A FEW WEEKS AFTER LINCOLN WAS ASSASSINATED AND THEN SHE CAME HERE AS A YOUNG WOMAN AND THEN SHE MARRIED DIFFERENT PEOPLE AND DURING THE TIME AND THE SO THE ANCESTORS ARE STILL HERE SOME OF THEM LIKE JACK MCDONALD HE,0,e- but uh um Nanna McDonald was born in eighteen sixty five just a few weeks after Lincoln was assassinated and then she came here as a young woman and then she married different people and during the time and the so the ancestors are still here some of them like Jack McDonald he,23.039
../data_processed_voc/wav/voc_13_part_119.wav,../data_processed_voc/txt/voc_13_part_119.txt,FILTER THEM INTO THE PROPER HEALTH CARE SYSTEM SO THEY KNOW HOW TO UTILIZE A P C P HOW TO PROPERLY CALL IN THEIR PRESCRIPTIONS WHEN THEY'RE RUNNING OUT AND EDUCATE THEM ON ALL OF THIS BECAUSE COME TWENTY FOURTEEN THEY'RE GOING TO HAVE THE AVAILABILITY TO GO TO OTHER FACILITIES THEY WON'T BE STUCK WITH WELL WE CAN GO HERE BECAUSE,0,filter them into the proper health care system so they know how to utilize a P-C-P how to properly call in their prescriptions when they're running out and educate them on all of this because come twenty fourteen they're going to have the availability to go to other facilities they won't be stuck with well we can go here because,20.947
../data_processed_voc/wav/voc_27_part_223.wav,../data_processed_voc/txt/voc_27_part_223.txt,I THINK THEY'RE PRETTY UM YIN NOT VERY OPEN IN THEIR TALK I KNOW UM THE LITTLE TOWN BARSTOW THAT I WAS RAISED IN IS UM,0,I think they're pretty um yin not very open in their talk I know um the little town Barstow that I was raised in is um,11.702
../data_processed_voc/wav/voc_18_part_423.wav,../data_processed_voc/txt/voc_18_part_423.txt,EVEN THOUGH I COULDN'T OPEN MY MOUTH TO TALK I HAD TO SAY IN MY OWN WORDS WHAT HAD TRANSPIRED NOT THE FIGHT BUT WHAT HAPPENED AFTER THE FIGHT THE FACT THAT I HAD TO GO TO THE HOSPITAL THE EMERGENCY THE FACT THAT THEY SENT ME AND WHAT DID THEY SAY THEY SAID YOUR JAW'S BROKEN THREE PLACES F YOU HAVE FIVE OF YOUR TEETH ARE KNOCKED OUT YOU HAVE,0,even though I couldn't open my mouth to talk I had to say in my own words what had transpired not the fight but what happened after the fight the fact that I had to go to the hospital the emergency the fact that they sent me and what did they say they said your jaw's broken three places f- you have five of your teeth are knocked out you have,22.71
../data_processed_voc/wav/voc_26_part_249.wav,../data_processed_voc/txt/voc_26_part_249.txt,COUNTRY AND WESTERN TOWN BUT IT'S THERE'S IS THERE'S PLENTY OF PEOPLE THERE'S PLENTY OF PLENTY OF COW COUNTRY AND COUNTRY AND WESTERN PEOPLE AND AND WELL AND CHICHI JOHN PACKED THE AUDITORIUM CAUSE WE GOT OUR WE GOT OUR SHARE OF DOPE GROWERS YOU KNOW BUT UH EVEN HONEST PEOPLE ARE GROWING DOPE NOW TO MAKE A LIVING,0,country and western town but it's there's is there's plenty of people there's plenty of [inaudible] plenty of cow country and country and western people and and well and Chichi John packed the auditorium cuz we got our we got our share of dope growers you know but uh even honest people are growing dope now to make a living [laughter],21.546999999999997
../data_processed_voc/wav/voc_29_part_60.wav,../data_processed_voc/txt/voc_29_part_60.txt,YEAH I THINK I THINK THE OH ONLY THE FAMILY I HAVE OUT THERE LIVES UH NEAR MUNICH RIGHT NOW,0,yeah I think I think the o- +only the family I have out there lives uh near Munich right now.,5.425
../data_processed_voc/wav/voc_10_part_333.wav,../data_processed_voc/txt/voc_10_part_333.txt,THEN HE CALLED FOR HER TO COME AND ON THE WAY OVER THEY STOPPED IN L A AT A RELATIVE'S HOUSE AND GOT MARRIED AND CAME ON,0,then he called for her to come and on the way over they stopped in l-a at a relative's house and got married and came on ...,8.901
../data_processed_voc/wav/voc_29_part_1.wav,../data_processed_voc/txt/voc_29_part_1.txt,UH I DON'T REALLY KNOW I THINK I TOOK SOME CLASSES IN HIGH SCHOOL AND I STARTED TO GET COMFORTABLE WITH CAMERAS AND I LIKE USING THEM,0,Uh I don't really know. I think I took some classes in high school and I started to get comfortable with cameras and I like using them,7.34
../data_processed_voc/wav/voc_15_part_48.wav,../data_processed_voc/txt/voc_15_part_48.txt,I WENT TO WASHINGTON AND SPENT TWO YEARS THERE AND UH THEN UH AND THEN I GOT OUT OF THE SERVICE FOR A WHILE AND THEN THEN I CAME BACK TO THE RANCH AND THEN I DECIDED WELL I UH WELL IT WAS UH IN NINETEEN UM,0,I went to Washington and spent two years there and uh then uh and then I got out of the service for a while and then then I came back to the ranch and then I decided well I uh well [laugh] it was uh in nineteen um,20.215
../data_processed_voc/wav/voc_32_part_83.wav,../data_processed_voc/txt/voc_32_part_83.txt,UM Y YEAH OH YEAH YEAH IT'S KIND OF FUNNY THERE'S THE CERTAIN PEOPLE WHO ARE STILL TOGETHER AND THEN THE PEOPLE WHO,0,"Um, y- +yeah oh yeah. Yeah, it's kind of funny, there's the certain people who are still together, and then the people who",5.56
../data_processed_voc/wav/voc_34_part_41.wav,../data_processed_voc/txt/voc_34_part_41.txt,YEAH TARGET YOU KNOW IF YOU'RE U USING I'M JUST USING AN EX EXAMPLE I DON'T EVEN HARDLY GO TH THERE I TARGET PARTICULARLY BUT WHEN I WOULD GO AND THERE'S A UH LOWES AND THOSE D THOSE KINDA DEPARTMENT STORES UM UM YOU KNOW I BUT THEY'RE THEY'RE GOOD I MEAN THERE'S NOTHING MATTER WITH THE ONES HERE IT'S JUST,0,"Yeah Target, you know, if you're u- +using -- I'm just using {BR} an ex- +example -- I don't even hardly go th- +there -- i- -- Target particularly, but when I {BR} would go and there's a {BR} {LS} {BR} uh Lowes {BR} and those d- -- those kinda department stores {BR} um um you know, i- -- but they're -- they're good, I mean there's nothing matter with the ones here, it's just {BR}",20.796
../data_processed_voc/wav/voc_12_part_53.wav,../data_processed_voc/txt/voc_12_part_53.txt,NOT ALL IN ON IT YOU KNOW BUT I USED TO BUT I DON'T ANYMORE I HAD UM BOTH HIPS REPLACED AND AND SOME PEOPLE DO RIDE THAT WAY BUT ANYWAY I HAVEN'T FOR YEARS BUT I DID ENJOY IT,0,not ((all)) in on it you know but {BR} -- I used to but I don't anymore. I had um {LS} -- both hips replaced and {LS} and some people do ride that way but anyway I haven't for years. But I did enjoy it. {BR} {NS},21.307
../data_processed_voc/wav/voc_35_part_65.wav,../data_processed_voc/txt/voc_35_part_65.txt,AND THAT WE WANT TO ATTEND AND WE WANNA GO TO AND AND HIGH SCHOOL WASN'T THAT YES I KNOW I LOVED SCHOOL I BUT I NEVER WENT TO CLASS EITHER I GOT STRAIGHT A'S BUT I NEVER WENT TO CLASS I JUST I'D GO IN DO WHAT I NEEDED TO DO AND THEN SAY HEY I'M GONNA GO UH TO THE JOURNALISM LAB,0,and that we want to attend and we wanna go to and -- and high school wasn't that. {LG} Yes I know I loved school. I -- but I never went to class either. I got straight A's but I never went to class. I just -- I'd go in do what I needed to do and then say hey I'm gonna go uh to the journalism lab,22.246
../data_processed_voc/wav/voc_28_part_368.wav,../data_processed_voc/txt/voc_28_part_368.txt,A SINGLE STORY WITH A VAULTED CEILING IN IT AND UH WE HAD UH TWO GUYS THAT WERE BUILDING IT AND THEY WERE FRIENDS OF OURS THEY WERE HIGHWAY PATROLMEN AND TH AND THEY AND THEY DID THEY'D BUILD HOUSES AND STUFF IN THEIR S SPARE TIME,0,a single story with a vaulted ceiling in it and uh we had uh two guys that were building it and they were friends of ours they were Highway Patrolmen and th- and they and they did they'd build houses and stuff in their s- spare time,20.875
../data_processed_voc/wav/voc_21_part_10.wav,../data_processed_voc/txt/voc_21_part_10.txt,UM BUT UH BUT IN YOU KNOW IN OTHER WAYS IT'S JUST THE POPULATION HAS EXPLODED SO IT DOESN'T HAVE QUITE THE SMALL TOWN FEEL IT USED TO AND WE USED TO BE SURROUNDED BY ORANGE GROVES AND ALL OF THOSE HAVE BEEN CUT DOWN FOR SHOPPING MALLS AND ALL OF THAT SO IT'S CHANGED A LOT,0,um but uh but in you know in other ways it's just the population has exploded so it doesn't have quite the small town feel it used to {BR} and we used to {BR} be surrounded by orange groves and all of those have been cut down for shopping malls and all of that so it's changed a lot,19.430999999999997
../data_processed_voc/wav/voc_10_part_84.wav,../data_processed_voc/txt/voc_10_part_84.txt,OR YOU CAN HOW DO YOU GET ON THE FREEWAY GOING THE OTHER WAY YOU DON'T YOU HAVE TO GO OFF OF IT AND AROUND THIS WAY VERY COMPLICATED BUT IT STOPPED HERE BECAUSE THE POLITICAL IT WOULD HAVE GONE,0,or you can ... how do you get on the freeway going the other way you don't you have to go off of it and around this way very complicated ... but it stopped here because the political ... it would have gone ...,20.375999999999998
../data_processed_voc/wav/voc_12_part_120.wav,../data_processed_voc/txt/voc_12_part_120.txt,AND MADE IT A DOWNTOWN MALL WHICH WAS VERY PEACEFUL AND QUIET BECAUSE THEY HAD WATER RUNNING AND UH AND MAYBE 'CAUSE THERE WEREN'T THAT MANY STORES I DON'T KNOW AND THEN THEY JUST COULDN'T COULDN'T COMPETE WITH THEM WITH THE MOUNT SHASTA MALL AND PEOPLE FROM REDDING WERE RUNNING TO CHI TO THE CHICO MALLS BECAUSE THEY THOUGHT THEY WERE GONNA GET BETTER SHOPPING UH,0,"and made it a downtown mall. Which was very peaceful and quiet because they had water running and uh {BR} -- and maybe 'cause there weren't that many stores, I don't know. And then they just couldn't -- couldn't compete with them {LS} : with the Mount Shasta Mall. And people from Redding were running to Chi -- to the Chico malls because they thought they were gonna get better shopping. {BR} Uh",21.968000000000004
../data_processed_voc/wav/voc_0_part_267.wav,../data_processed_voc/txt/voc_0_part_267.txt,KNOWING A KEY OR A CODE CAUSE IT'S GATE LOCKED AM I RIGHT,0,knowing a key or a code cuz it's gate locked. Am I right?,6.653
../data_processed_voc/wav/voc_16_part_261.wav,../data_processed_voc/txt/voc_16_part_261.txt,WELL OF COURSE WE HAVE THE NORTH AND THE SOUTH AND TH A A AS TO AS TO THIS,0,"Well, of course we have the north and the south. And th- A- a- as to as to this?",6.345
../data_processed_voc/wav/voc_30_part_117.wav,../data_processed_voc/txt/voc_30_part_117.txt,I GUESS MY GENERAL CONCEPT WHICH I DON'T KNOW IF IT'S ACCURATE OR NOT UM BUT I WOULD SAY,0,"I guess my general concept, which I don't know if it's accurate or not um but I would say",7.9270000000000005
../data_processed_voc/wav/voc_10_part_72.wav,../data_processed_voc/txt/voc_10_part_72.txt,SO WHAT DO WE DO WE HAVE CALLOWAY AND WE HAVE OLD RIVER IT'S VERY VERY UH CONFUSING TO A LOT OF PEOPLE FURTHER THIS WAY AND THIS IS ALL CAUSED BY THE BUILDING,0,so what do we do? we have Calloway and we have Old River .... it's very very uh confusing to a lot of people further this way and this is all caused by the building,13.677999999999999
../data_processed_voc/wav/voc_16_part_3.wav,../data_processed_voc/txt/voc_16_part_3.txt,I DIDN'T HAVE ANY PROBLEM THAT I REMEMBER MAYBE I JUST KNEW ENOUGH TO GET BY ON MHM BUT UM NO UM ALL I KN I I REMEMBER IS I WENT HOME FROM SCHOOL AND MY MOTHER MADE ME SIT DOWN AND READ A BOOK OUT LOUD SHE COULDN'T READ ENGLISH BUT I READ A BOOK TO HER BUT I WOULD ALWAYS READ TO HER WHILE SHE WAS COOKING AND CLEANING AND,0,"I didn't have any problem that I remember. Maybe I just knew enough to get by on. Mhm but um, no, um all I kn- I I remember is I went home from school and my mother made me sit down and read a book out loud. She couldn't read English but I read a book to her {LG} but I would always read to her while she was cooking and cleaning and",21.412
../data_processed_voc/wav/voc_18_part_550.wav,../data_processed_voc/txt/voc_18_part_550.txt,HOW IT DID WHEN I WAS GROWING UP OUT THERE I DIDN'T GROW UP OUT THERE I BUT I THEY WENT TO SCHOOL WITH ME HERE AT ANDERSON AND WHEN WE'D GO SWIMMING AT CLEAR CREEK THAT'S WHERE IT WAS AT WAS RIGHT THERE WHERE THEIR CASINO IS BUT ON THIS SIDE OF THE HIGHWAY DOWN UNDER THE BRIDGE HERE WHERE WE USED TO GO BUT UM UH,0,how it did when I was growing up out there I didn't grow up out there I but I they went to school with me here at Anderson and when we'd go swimming at Clear Creek that's where it was at was right there where their casino is but on this side of the highway down under the bridge here where we used to go but um uh,21.749000000000002
../data_processed_voc/wav/voc_18_part_169.wav,../data_processed_voc/txt/voc_18_part_169.txt,AND YOU GO RIGHT PAST THE SCHOOL AND YOU SEE ALL THAT NEW NEIGHBORHOOD ALL THESE HOUSES OVER HERE WELL ALL OF A SUDDEN YOU SEE AN OLDER HOUSE THAT ALL THOSE HOUSE ABOUT THAT WAS THE ONLY HOUSE THERE WAS AND THAT WAS DAN FERRY'S PARENTS' HOUSE DAN FERRY IS HE'S THE ONE WHO OWNS FERRY'S PHARMACY HERE IN ANDERSON,0,and you go right past the school and you see all that new neighborhood all these houses over here well all of a sudden you see an older house that all those house about that was the only house there was and that was Dan Ferry's parents' house Dan Ferry is he's the one who owns Ferry's pharmacy here in Anderson,21.833000000000002
../data_processed_voc/wav/voc_33_part_56.wav,../data_processed_voc/txt/voc_33_part_56.txt,I WAS KIND OF UNUSUAL I HAD A OLDER BOYFRIEND THAT WASN'T IN MY HIGH SCHOOL THAT I ENDED UP MARRYING SO I'M NOT SURE IT SEEMS LIKE A LOTTA PEOPLE DATED OTHER PEOPLE BUT I DON'T KNOW,0,I was kind of unusual. I had a older boyfriend that wasn't in my high school that (()) I ended up marrying so  I'm not sure. It seems like a lotta people dated other people but I don't know.,19.14
../data_processed_voc/wav/voc_0_part_150.wav,../data_processed_voc/txt/voc_0_part_150.txt,ON IT FURHTER YOU HAD UH UH BUTTE STREET AND MAGNOLIA AND THEN THAT WAS ABOUT IT THAT WAS THE END OF THE COUNTRY I MEAN THE TOWN THAT THERE ALL THE REST FROM THERE ON WAS WAS MANZANITA AND BRUSH,0,on it furhter you had uh uh Butte Street and Magnolia and then that was about it. That was the end of the country. I mean the town. That there all the rest from there on was was Manzanita and Brush,13.735999999999999
../data_processed_voc/wav/voc_24_part_226.wav,../data_processed_voc/txt/voc_24_part_226.txt,YEAH I THERE IS THERE'S A LOT OF ARTISTIC STUFF IN THE FAMILY MY MOM'S AN ART MAJOR UM WITH A MINOR IN ENGLISH CAUSE SHE KNEW REALISTICALLY SHE WASN'T GOING TO MAKE A LOT OF MONEY AS AN WITH AN ART MAJOR UM,0,Yeah i- there is there's a lot of artistic stuff in the family. My mom's an art major Um with a minor in English cuz she knew realistically she wasn't going to make a lot of money as an [laughter] with an art major. [laughter] um,15.593
../data_processed_voc/wav/voc_7_part_15.wav,../data_processed_voc/txt/voc_7_part_15.txt,AND SO MY FAMILY ENDED UP SETTLING BASICALLY IN THE SAN JOSE AREA MY FATHER IS A FIRST GENERATION AMERICAN UH HIS PARENTS WERE BORN IN CANADA UH HE WAS BORN IN MISSOURI AND MOVED OUT HERE BY,0,and so my family ended up settling basically in the San Jose area. My father is a first generation American. Uh his parents were born in Canada.  Uh he was born in Missouri and moved out here by,20.294
../data_processed_voc/wav/voc_8_part_178.wav,../data_processed_voc/txt/voc_8_part_178.txt,COHESIVELY WITH THE MAJORITY THEY ALSO HAVE A REASONABLE EXPECTATION OF SHARING THAT WITH THEIR CONSTITUENCY AND GETTING INPUT FROM THEIR CONSTITUENCY INSTEAD OF MOVING FORWARD UNFORTUNATELY EVERYTHING THAT'S COME FORWARD OUT OF A STRONG THE STRONG MAYOR PUSH OVER THE LAST TEN YEARS,0,"Cohesively, with the majority. They also have a reasonable expectation of sharing that with their constituency and getting input from their constituency instead of moving forward. Unfortunately, everything that's come forward out of a Strong -- the Strong Mayor push over the last ten years",18.975
../data_processed_voc/wav/voc_29_part_99.wav,../data_processed_voc/txt/voc_29_part_99.txt,YEAH WITH TECHNOLOGY IT'S SO MUCH EASIER TO YOU KNOW BE ABLE TO WRITE THINGS DOWN,0,Yeah with technology it's so much easier to you know be able to write things down,5.079
../data_processed_voc/wav/voc_10_part_228.wav,../data_processed_voc/txt/voc_10_part_228.txt,UH AND BELOW IT'S NOT UP IN COLLEGE HEIGHTS IT'S BELOW I'D SAY COLOMBUS AVENUE AND LOW LOWER UH THERE'S A LOT OF MEXICANS IN THERE EAST BAKERSFIELD,0,uh and below it's not up in College Heights it's below I'd say Colombus avenue and low lower uh ... there's a lot of Mexicans in there East Bakersfield,17.007
../data_processed_voc/wav/voc_14_part_116.wav,../data_processed_voc/txt/voc_14_part_116.txt,ONE OF MY ALL TIME F MY PROBABLY MY FAVORITE PHOTOGRAPHER HIS NAME IS JOEL PETER WITKIN HE TOOK UM A LOT OF PHOTOGRAPHS WITH UM CADAVERS,0,one of my all time f- my probably my favorite photographer his name is Joel Peter Witkin he took um a lot of photographs with um cadavers,8.917
../data_processed_voc/wav/voc_4_part_33.wav,../data_processed_voc/txt/voc_4_part_33.txt,AND I LIKE IT WHEN I SEE YOU KNOW STUDENTS OR WHOEVER NOW PROTESTING THINGS DEPENDING ON TO WHAT LEVEL THEY GO YOU KNOW I THINK NONVIOLENT PROTEST IS IS FINE IS GOOD IS THE WAY TO GET THINGS DONE,0,and I like it when I see you know students or whoever now protesting things depending on to what level they go you know I think nonviolent protest is -- is fine is good is the way to get things done.,12.889000000000001
../data_processed_voc/wav/voc_4_part_104.wav,../data_processed_voc/txt/voc_4_part_104.txt,YEAH I I MEAN I DON'T KNOW IF AS A CHILD I WAS THAT AWARE OF THE AGRICULTURE PART BUT AS I GOT OLDER I SUDDENLY WAS AND NOW THAT I LIVE IN AN AREA THAT WAS JUST PURE AGRICULTURE YOU KNOW I MEAN WHEN I MOVED OUT THERE IN MY HOUSE WAS BUILT IN SEVENTY NINE OR SOMETHING YOU KNOW AND THEY PROBABLY TOOK OVER SOME FIELD AND YOU KNOW AND THAT WE'RE KIND OF ON THE EDGE OF THE LAST REMAINING OUT THERE BY ARENA AND YOU KNOW ON THE WAY TO THE AIRPORT,0,yeah I -- I mean I don't know if as a child I was that aware of the agriculture part but as I got older I suddenly was and now that I live in an area that was just pure agriculture you know I mean when I moved out there in my house was built in seventy-nine or something you know and they probably took over some field and you know and that we're kind of on the edge of the last remaining out there by (()) arena and (()) you know on the way to the airport,26.919
../data_processed_voc/wav/voc_7_part_133.wav,../data_processed_voc/txt/voc_7_part_133.txt,WELL I HAVE TO TELL YOU THE MOST MEMORABLE THING OF MY YOUTH WAS I HAD A JOB AT FIRST I TRIED THE FIELDS AND I LASTED SEVEN DAYS FELL ASLEEP AT A PARTY AND SAID I DON'T THINK THIS IS FOR ME SO I WENT TO WORK AND I GOT A JOB AT THE SKY VIEW DRIVE IN,0,Well I have to tell you the most memorable thing of my youth was I had a job at -- first I tried the fields and I lasted seven days fell asleep at a party and said I don't think this is for me  so I went to work and I got a job at the Sky View Drive in,22.897
../data_processed_voc/wav/voc_7_part_114.wav,../data_processed_voc/txt/voc_7_part_114.txt,YEAH YEAH THERE'S A BUNCH OF SW SWISS SWISS ITALIANS A LOTTA PORTUGUESE UH UH ANY ANY FISHING AND FARMING YOU KNOW THERE'S SOMEBODY IN THERE THAT'S ITALIAN OR SWISS ITALIAN YEAH,0,Yeah yeah there's a bunch of Sw- +swiss Swiss Italians -- a lotta Portuguese. Uh uh any -- any fishing and farming you know there's somebody in there that's Italian {LG} or Swiss Italian. Yeah,14.535
