../data_processed_voc/wav/voc_10_part_393.wav,../data_processed_voc/txt/voc_10_part_393.txt,SO UH I SAID WELL THAT'S GOOD SO HE'S LIFE A LIFER YEAH,0,"so uh I said ""well that's good"" so ... he's life ... a lifer [laughter] yeah",10.036
../data_processed_voc/wav/voc_28_part_107.wav,../data_processed_voc/txt/voc_28_part_107.txt,EUGENE TO COOS BAY AND ALBANY TO TOLEDO AND AND UH BY MC MCMINNVILLE WE HAD A SOME MORE UP THERE BUT SPENT A SPENT A COUPLE OF YEARS YOU KNOW WORKING UP THERE AND WE WE HAD TO LOGGER COUPLE LOGGERS,0,Eugene to Coos Bay and Albany to Toledo and and uh by Mc- McMinnville we had a some more up there but spent a spent a couple of years you know working up there and we- we had to logger couple loggers,20.535999999999998
../data_processed_voc/wav/voc_1_part_148.wav,../data_processed_voc/txt/voc_1_part_148.txt,THERE IS A BAR HERE IN TOWN THAT EVERY OTHER THURSDAY YOU CAN GO TO THE BAR AND THERE'S A D J THERE THAT DOES DEATH ROCK HE DOES LIKE DRUM AND BASS DEATH ROCK AND HIP HOP IT'S HIS THING HE MIXES IT ALL UP AND HE DOES A GREAT JOB AND SO THERE ARE OTHER PLACES YOU CAN GO IF,0,there is a bar here in town that every other Thursday you can go to the bar and there's a d-j there that does death rock he does like drum and bass death rock ... and hip hop it's his thing he mixes it all up and he does a great job ... and so there are other places you can go if,20.09
../data_processed_voc/wav/voc_21_part_99.wav,../data_processed_voc/txt/voc_21_part_99.txt,MHM YEAH I'M NOT I GOT NOT A BIG FANCY LUNCH EATER I'M NOT AND AGAIN I TRAVEL A LOT SO WHEN I DO I LIKE I HAVE A MISSION AND I DON'T WASTE TIME SITTING IN FANCY RESTAURANTS I 'CAUSE I WANNA MAKE SURE I DO THIS THIS THIS AND THIS THROUGHOUT THE DAY SO I HAVE AN AGENDA I DO I DO,0,"mhm {BR} Yeah, I'm not I ((got not)) a big fancy lunch eater I'm not -- and again I travel a lot so when I do I like I have a mission {BR} and I don't waste time sitting in fancy restaurants I 'cause I wanna make sure I do this this this and this throughout the day {BR} so I have an agenda. I do. I do",21.85
../data_processed_voc/wav/voc_6_part_172.wav,../data_processed_voc/txt/voc_6_part_172.txt,FILIPINOS IN THEM AND UH LOT OF THE DOCTORS NOW COME FROM INDIA,0,Filipinos in them and uh lot of the doctors now come from India.,5.621
../data_processed_voc/wav/voc_4_part_131.wav,../data_processed_voc/txt/voc_4_part_131.txt,PAL BANG CAUGHT BAG FILL BIN DO BATH PULL APRICOT SAT WHICH I KNOW THAT'S A BIG ONE SOMETIMES I MIGHT EVEN SAY APRICOT BUT I USUALLY SAY APRICOT,0,pal bang caught bag fill bin do bath pull apricot sat which I know that's a big one. Sometimes I might even say apricot but I usually say apricot.,12.888
../data_processed_voc/wav/voc_17_part_29.wav,../data_processed_voc/txt/voc_17_part_29.txt,YEAH YEAH WENT TO YOU KNOW WENT TO PEOPLE'S HOUSES SET UP SATELLITE DISHES AND THIS IS LIKE WHEN SATELLITE WAS LIKE FIRST KINDA COMING OUT SO YEAH WE'D SET UP SATELLITE AND BIG SCREENS FOR 'EM AND YOU KNOW SURROUND SOUND INTERESTING GOING INTO WELL I'M SURE YOU PROBABLY KNOW NOW IT WAS LIKE GOING TO PEOPLE'S HOUSES AND WHATNOT AND KINDA SEEING THE DIFFERENT WAYS THAT PEOPLE LIVE AND I DON'T THINK IT'S ALWAYS,0,"Yeah yeah. Went to, you know, went to people's houses, set up satellite dishes, and this is like when satellite was like first kinda coming out. So, yeah, we'd set up satellite and big screens for 'em, and, you know, surround sound. Interesting going into, well I'm sure you probably know now, it was like, going to people's houses and whatnot, and kinda seeing the different ways that people live and I don't think it's always.",19.359
../data_processed_voc/wav/voc_38_part_25.wav,../data_processed_voc/txt/voc_38_part_25.txt,THEN I GRADUATED FROM SIERRA COLLEGE AND HAD SIGNED UP TO TAKE A FIRST SEMESTER AT SAC STATE AND THEN THAT'S WHEN,0,then I graduated from Sierra College and had signed up to take a first semester at Sac State and then that's when,7.79
../data_processed_voc/wav/voc_6_part_212.wav,../data_processed_voc/txt/voc_6_part_212.txt,A AND AND AND THE HALLS AND EVERYTHING AND THEY STARTED OUT WITH WITH UH I THINK A FRIDAY NIGHT PERFORMANCE AND A SATURDAY MATINEE FOR OPERAS MAYBE ALSO FOR THE SYMPHONY BUT THE BUT THE SYMPHONY WOULD WOULD UH FINALLY UH BECOME PROFESSIONAL AND THEY PAY THE MUSICIANS,0,a- +and and -- and the halls and everything and they started out with -- with uh I think a Friday night performance and a Saturday matinee for operas. Maybe also for the symphony but the -- but the symphony would would uh finally uh become professional and they pay the musicians,21.779
../data_processed_voc/wav/voc_29_part_98.wav,../data_processed_voc/txt/voc_29_part_98.txt,DESCRIBE WHAT'S GOING ON AROUND YOU JUST THINGS THAT UH THINGS THAT KINDA STAND OUT TO YOU,0,describe what's going on around you -- just things that uh --  things that kinda stand out to you.,6.296
../data_processed_voc/wav/voc_9_part_36.wav,../data_processed_voc/txt/voc_9_part_36.txt,IMMIGRANTS FROM EASTERN EUROPE AND THEN UM THE UKRAINE AND RUSSIA AND A YEAH ALL OVER YEAH,0,immigrants from eastern Europe and then um the Ukraine and Russia and a- +(()) yeah. All over yeah.,9.324
../data_processed_voc/wav/voc_32_part_160.wav,../data_processed_voc/txt/voc_32_part_160.txt,TINY YEAH TINY AND VERY RURAL THAT'S WHY I WOULD THINK IT'D BE COOL UH HUH YEAH ACTUALLY WE WE JUST DROVE UP TO SEATTLE LAST MONTH TO SEE MY BROTHER AND WE DROVE ALL THE WAY THROUGH YREKA UP THROUGH OREGON UP INTO WASHINGTON,0,"Tiny, yeah. Tiny and very rural, that's why I would think it'd be cool. Uh-huh, yeah, actually we we just drove up to Seattle last month to see my brother and we drove all the way through Yreka up through Oregon up into Washington",13.15
../data_processed_voc/wav/voc_18_part_415.wav,../data_processed_voc/txt/voc_18_part_415.txt,UM I AND THEN SO PROBABLY I WAS IN I H HAD SURGERY I GOT OUT OF THE HOSPITAL THE NEXT DAY SO IN THREE DAYS CLINT THAT GUY I TOLD YOU THAT DIED FROM THE AIDS HE CALLS ME FROM SHASTA COUNTY JAIL AND HE SAID RICK,0,"um i- and then so probably I was in I h- had surgery I got out of the hospital the next day so in three days Clint that guy I told you that died from the aids he calls me from Shasta County Jail and he said ""Rick""",21.598000000000003
../data_processed_voc/wav/voc_0_part_142.wav,../data_processed_voc/txt/voc_0_part_142.txt,AND I WORE THIS DRESS TO WITH THE FLARED OUT EVERYTHING BUT IT WAS A MASQUERADE WE HAD TO DRESS UP AND EVERYTHING AND I HAD TO SING MARES EAT OATES AND DOES EAT OATES AND LITTLE LAMBS EAT IVY DO YOU KNOW THAT SONG,0,and I wore this dress to with the flared out everything but it was a masquerade. We had to dress up and everything. And I had to sing Mares Eat Oates and Does Eat Oates and little lambs eat ivy. Do you know that song?,16.01
../data_processed_voc/wav/voc_10_part_281.wav,../data_processed_voc/txt/voc_10_part_281.txt,MORE THAN THIS WAY OUT WEST UHUH,0,more ... than ... this way out West uhuh [yes],6.084
../data_processed_voc/wav/voc_15_part_32.wav,../data_processed_voc/txt/voc_15_part_32.txt,AND UM THEN FROM PLACERVILLE HE CAME TO LEWISTON TO MINE AND THEN UH UH MY GRANDMOTHER CAME FROM UM GERMANY AND UH IN AROUND UH WHERE MY DAD WAS BORN N IN EIGHTEEN NINETY TWO IN LEWISTON JUST DOWN THE DOWN THE WAY HERE,0,and um then from Placerville he came to Lewiston to mine and then uh uh my grandmother came from um Germany and uh in around uh where my dad was born n- in eighteen ninety two in Lewiston just down the down the way here,21.936
../data_processed_voc/wav/voc_4_part_129.wav,../data_processed_voc/txt/voc_4_part_129.txt,YEAH I I LOVED TRYING TO FIGURE OUT HOW YOU GUYS ARE GONNA PUT THIS ALL TOGETHER OKAY READY MAKE SAND DAN DANCE SAND DANCE FEEL COT TUESDAY COLT BETH POOL GEM GREASY OLD FAIL,0,Yeah I -- I loved trying to figure out how you guys are gonna put this all together. Okay ready? make sand dan- +dance sand dance feel cot tuesday colt beth pool gem greasy old fail,20.063
../data_processed_voc/wav/voc_18_part_523.wav,../data_processed_voc/txt/voc_18_part_523.txt,NOW THEY'RE THO THOSE PEOPLE THEY ALL TALK REAL FAST AND I DON'T THINK NONE OF THEM ARE ACTUALLY FROM THERE,0,now they're tho- those people they all talk real fast and I don't think none of them are actually from there,6.7989999999999995
../data_processed_voc/wav/voc_7_part_194.wav,../data_processed_voc/txt/voc_7_part_194.txt,NO NO ONE IS UH ONE'S AT U C DAVIS ONE'S AT M P C,0,No no one is uh -- one's at U C Davis. One's at M P C ,10.512
../data_processed_voc/wav/voc_38_part_93.wav,../data_processed_voc/txt/voc_38_part_93.txt,YEAH BUT AS FAR AS ME I MEAN I THINK IT'S LIKE 'CAUSE YOU HAVE LIKE NORTHERN CALIFORNIA AND THEN CENTRAL CALIFORNIA AND THEN SOUTHERN CALIFORNIA AND THEN I STILL THINK LIKE THE COASTAL TOO WHERE YOU'VE GOT,0,"Yeah. {LG} But as far as me, I mean, I think it's like 'cause you have like northern California and then central California and then southern California, and then I still think, like, the coastal too where you've got",11.918
../data_processed_voc/wav/voc_18_part_367.wav,../data_processed_voc/txt/voc_18_part_367.txt,I WAS UP IN REDDING AND I WAS IN ENTERPRISE AND I WAS JUST PULLING OUT OF WINCO GROCERY STORE AND HERE'S CLINT WALKING RIGHT ACROSS CR OF ALL THE PLACES IN THE WORLD I'M LIKE CLINT WHAT A WHAT ARE YOU DOING UP HERE YOU KNOW AND HERE AND SO HE HE GOT IN THE PICKUP AND I SAID YOU WANT TO GO OUT TO WHISKEYTOWN FOR A LITTLE BIT AND HE GOES YEAH SO,0,"I was up in Redding and I was in Enterprise and I was just pulling out of Winco Grocery Store and here's Clint walking right across cr- of all the places in the world I'm like ""Clint what a- what are you doing up here"" you know and here and so he he got in the pickup and I said ""you want to go out to Whiskeytown for a little bit"" and he goes ""yeah"" so",20.719
../data_processed_voc/wav/voc_32_part_95.wav,../data_processed_voc/txt/voc_32_part_95.txt,I WOULD TO I MEAN IT'S FAST BECAUSE I MEAN YOU'RE YOU GOT UH PEOPLE YEAH AND HEARING PEOPLE DON'T SPEAK,0,"I would to, I mean it's fast Because I mean you're you got uh people Yeah, and hearing people don't speak",8.68
../data_processed_voc/wav/voc_36_part_58.wav,../data_processed_voc/txt/voc_36_part_58.txt,UH MY HUSBAND AND I WERE TWENTY FIVE AND TWENTY AND THIRTY BASICALLY AND EVERYBODY AROUND US WERE OLDER PEOPLE WELL ALMOST ALL THOSE OLDER PEOPLE PRETTY MUCH ALL THOSE PEOPLE HAVE DIED NOW IN THE INTERVENING YEARS RIGHT SO I'M ONE OF THE OLDER PEOPLE ON MY STREET NOW AND I'M FIFTY SIX THIS YEAR MY UH NEIGHBOR ACROSS THE STREET SONIA HUNTER IS IN HER EARLY SEVENTIES AND SHE MOVED THERE IN THE MIDDLE SEVENTIES WITH HER BRAND NEW HUSBAND,0,"uh, my husband and I were twenty-five and twenty -- and thirty, basically. And everybody around us were older people. Well, almost all those older people -- pretty much all those people have died now, in the intervening years, right? {BR} So, I'm one of the older people on my street now, and I'm fifty-six this year, my uh, neighbor across the street, Sonia Hunter, is in her early seventies and she moved there in the middle seventies with her brand-new husband",21.081999999999997
../data_processed_voc/wav/voc_9_part_128.wav,../data_processed_voc/txt/voc_9_part_128.txt,IN FACT WHEN WHEN Y YOU BEFORE YOU CAME DOWN TO GET ME UM MY FRIEND THAT LIVES IN SAN DIEGO SHE SAID I'M ALL SCRUBBED UP YOU KNOW I WAS ANSWERING HER EMAIL AND SHE SAID I'M ALL SCRUBBED UP FOR THE BIG EVENT AND I SAID I'M STILL WORKING ON IT,0,in fact when -- when y- +you before you came down to get me um my friend that lives in San Diego she said I'm all scrubbed up. You know I was answering her email and she said I'm all scrubbed up for the big event {LG} and I said I'm still working on it. {LG},20.848000000000003
../data_processed_voc/wav/voc_29_part_137.wav,../data_processed_voc/txt/voc_29_part_137.txt,YEAH I ACTUALLY I MEAN LIKE I SAID I'M JUST OUT OF HIGH SCHOOL SO I'M STILL LIVING LIKE WITH MY PARENTS CAUSE I HAVEN'T GETTING TRYING TO SAVE UP FOR AN APARTMENT RIGHT NOW,0,Yeah I actually -- I mean like I said I'm just out of high school so I'm still living like with my parents cuz I haven't -- getting -- trying to save up for an apartment right now.,8.743
../data_processed_voc/wav/voc_9_part_34.wav,../data_processed_voc/txt/voc_9_part_34.txt,ABSOLUTELY YEAH IN MY LIFE AS A UH EMPLOYEE OF THE WELFARE DEPARTMENT IN SACRAMENTO COUNTY UH AND THE WORK THAT I DID I SAW A LOT OF UH SOUTHEAST ASIAN UH IMMIGRANTS DURING THE LATE SEVENTIES AND EIGHTIES THEN THERE WERE UM,0,Absolutely yeah in my life as a uh employee of the welfare department in Sacramento County uh and the work that I did I saw a lot of uh southeast Asian uh immigrants during the late seventies and eighties. Then there were um,20.519000000000002
../data_processed_voc/wav/voc_32_part_139.wav,../data_processed_voc/txt/voc_32_part_139.txt,AND I'VE BEEN WORKING ON THAT A WILLY'S JEEP I LOVE IT AND IT'S BRIGHT ORANGE I'VE BEEN WORKING ON IT ALL SUMMER AND UM I BOUGHT IT LAST AUGUST LIKE THINKING OH I COULD WORK ON IT ALL WINTER AND THEN I COULD DRIVE IT UP TO MY CABIN AND HAVE IT FOR THE SUMMER AND DAVIS WAS EXPONENTIALLY HARDER AND TOOK UP A LOT MORE TIME THAN I THOUGHT IT WOULD SO I DIDN'T GET TO WORKING ON IT TIL THIS SUMMER HE BOUGHT HIMSELF A F FORD AN OLD FORD F ONE HUNDRED,0,"and I've been working on that A Willy's Jeep, I love it. And it's bright orange, I've been working on it all summer And, um I bought it last August, like thinking, oh I could work on it all winter and then I could drive it up to my cabin and have it for the summer and Davis was exponentially harder and took up a lot more time than I thought it would so I didn't get to working on it till this summer He bought himself a F- +Ford an old Ford F one hundred",22.71
../data_processed_voc/wav/voc_7_part_161.wav,../data_processed_voc/txt/voc_7_part_161.txt,NO BORING Y YEAH,0,No  boring {LG} y- +yeah,5.526
../data_processed_voc/wav/voc_21_part_46.wav,../data_processed_voc/txt/voc_21_part_46.txt,THEN I HAVE A UM ONE WHO JUST GRADUATED COLLEGE FROM U C SANTA BARBARA AND NOW HE'S AT U C L A LAW SCHOOL AND THEN I MY BABY THE TWENTY YEAR OLD STARTED SCHOOL AT U C SANTA CRUZ VERY QUICKLY DIDN'T GO WELL AT ALL SO HE'S BACK HOME GOING TO JUNIOR COLLEGE AND WORKIN',0,"then I have a um {LS} one who just graduated college from U C Santa Barbara and now he's at U C L A Law School {BR} and then I -- my baby the twenty year old started school at U C Santa Cruz {BR} very quickly didn't go well at all, so he's back home going to junior college and workin'",20.003
../data_processed_voc/wav/voc_2_part_34.wav,../data_processed_voc/txt/voc_2_part_34.txt,OVER THIS WAY UM PROBABLY JUST A CHA CHANGE CHANGE OF SCENERY OR UM,0,over this way. Um probably just a cha- +change change of scenery or um,6.372999999999999
../data_processed_voc/wav/voc_26_part_143.wav,../data_processed_voc/txt/voc_26_part_143.txt,BUT NOT BECAUSE I DON'T WANT IT TO BE LIKE LA WE REALLY NEED THE ECONOMIC DEVELOPMENT WE JUST NEED IT IN THE RIGHT PLACE AND THAT'S NOT THE RIGHT PLACE THE RIGHT PLACE IS ON THIS ROCK PILE OUT NORTH OF TOWN WHERE YOU COULDN'T YOU COULDN'T GROW ANYTHING EXCEPT UH POISON OAK BUSH AND A MANZANITA,0,but not because I don't want it to be like LA we really need the economic development we just need it in the right place and that's not the right place the right place is on this rock pile out north of town where you couldn't you couldn't grow anything except uh poison oak bush and a manzanita ,20.548000000000002
../data_processed_voc/wav/voc_16_part_265.wav,../data_processed_voc/txt/voc_16_part_265.txt,I'VE BEEN ALONG THE COAST COUPLE OF TIMES AND OTHER THAN THAT BUT I'VE BEEN DOWN HERE A LITTLE FEW TIMES BUT NO I THIS IS WHERE I'VE CONCENTRATE SORT OF IN HERE AND THIS HERE AND AND L OVER HERE A LITTLE BIT,0,"I've been along the coast couple of times, and other than that, but I've been down here a little few times. But no, I- this is where I've concentrate sort of in here, and this here, and and l- over here a little bit.",14.61
../data_processed_voc/wav/voc_30_part_55.wav,../data_processed_voc/txt/voc_30_part_55.txt,UM MY HUSBAND LIVES NEAR IT HE OR LIVES HE WORKS NEAR IT HE WORKS AT THE AIRPORT UM,0,"um my husband lives near it, he or lives-- he works near it-- he works at the airport um",5.89
../data_processed_voc/wav/voc_14_part_44.wav,../data_processed_voc/txt/voc_14_part_44.txt,YOU KNOW IF YOU ARE OF THE COMMUNITY AND YOU FEEL DISCRIMINATED AGAINST THERE'S THIS DEFENSE MECHANISM AND PEOPLE IT'S LIKE YOU KNOW WHEN YOU GET MADE FUN OF WHEN YOU'RE WHEN YOU'RE YOUNGER WHEN YOU KEEP SAYING LIKE UM LIKE WHEN YOU RETALIATE THE KIDS KEEP DOING IT BECAUSE THEY LIKE THEY KNOW THAT IT'S GETTING TO YOU YOU KNOW AND I THINK THAT'S WHY,0,you know if you are of the [spells out L.G.B.T.] community and you feel discriminated against there's this defense mechanism and people it's like you know when you get made fun of when you're when you're younger when you keep saying like um like when you retaliate the kids keep doing it because they like they know that it's getting to you you know and I think that's why,22.02
../data_processed_voc/wav/voc_17_part_50.wav,../data_processed_voc/txt/voc_17_part_50.txt,NO NO I WAS JUST I DON'T KNOW IT'S TOO MUCH DRAMA IT WAS JUST KIND OF CHEESY TO ME THIS IS LIKE SO YEAH BUT IT WAS UM YEAH IT WAS COOL AND YOU KNOW I MADE A FEW FRIENDS THROUGH IT SO,0,"No, no. I was just, I don't know. It's too much drama. It was just kind of cheesy to me, this is like. So, yeah, but it was um, yeah it was cool. And you know, I made a few friends through it, so.",11.942
../data_processed_voc/wav/voc_27_part_264.wav,../data_processed_voc/txt/voc_27_part_264.txt,OH MY GOD DO I SOUND THAT NASALLY DO I TALK THAT SLOW HOW DOES ANYBODY STAND LISTENING TO ME THAT'S WHAT I'M LIKE I WOULD JUST BE WANT TO GO LIKE HURRY UP WOULD YOU GET IT OUT,0,oh my god do I sound that nasally do I talk that slow how does anybody stand listening to me that's what I'm like I would just be want to go like hurry up would you get it out,13.495999999999999
../data_processed_voc/wav/voc_27_part_222.wav,../data_processed_voc/txt/voc_27_part_222.txt,LIKE REALLY YOU DIDN'T THINK THAT WAS GONNA HAPPEN HOLY MACKEREL MY GOD I WAS SUPPOSED TO MAKE A LOT OF MONEY GRANDMA WHATEVER UM I I I DON'T I DON'T REALLY KNOW ABOUT THIS PART I THINK UM,0,like really you didn't think that was gonna happen holy mackerel my god I was supposed to make a lot of money grandma whatever um I I I don't I don't really know about this part I think um,16.83
../data_processed_voc/wav/voc_35_part_15.wav,../data_processed_voc/txt/voc_35_part_15.txt,IT'S BEEN ALMOST TWENTY YEARS SINCE I GOT MY DEGREE SO JUST REVISITING IT RE UM UH RETRAINING GETTING TH EXPOSURE AND THE EXPERIENCE IN THE FIELD AGAIN AND THEN HOPEFULLY I WOULD LIKE TO ACTUALLY GO THROUGH THE PHOTOJOURNALISM UM PROGRAM THAT THEY HAVE HERE THATS ACTUALLY GONNA BE IN THE BRAND NEW BUILDING THAT'S OPENING UP,0,it's been almost twenty years since I got my degree so just revisiting it. Re um uh retraining getting th exposure and the experience in the field again and then hopefully I would like to actually go through the photojournalism um program that they have here thats actually gonna be in the brand new building that's opening up,21.58
../data_processed_voc/wav/voc_6_part_137.wav,../data_processed_voc/txt/voc_6_part_137.txt,HE BEGAN FEELING NOT TOO WELL AND I SAID WELL MAYBE IT'S THE ALTITUDE AND WE STOPPED FOR LUNCH AND HE SAID ALRIGHT TOLD HIM TO DRINK SOME WATER WELL THAT DIDN'T TASTE GOOD EITHER FINALLY WE DECIDED THAT HE WAS SICK FROM ALTITUDE SO WE WERE GOING TOWARDS A SMALL BRIDGE UP,0,he began feeling not too well and I said well maybe it's the altitude and we stopped for lunch and he said alright. Told him to drink some water. Well that didn't taste good either. Finally we decided that he was sick from altitude so we were going towards a small bridge up,20.796999999999997
../data_processed_voc/wav/voc_26_part_39.wav,../data_processed_voc/txt/voc_26_part_39.txt,PERFECT JOHN SO HERE IS A LESSON IN REDDING ECONOMICS AND I'VE BEEN ON THE US BANK BOARD OF ADVISORY COMMITTEE UM AND WE WERE SUPPOSED TO BRING SOMETHING OF SUBSTANCE TO EVERY MEETING SO I ALWAYS HAD STUFF OF SUBSTANCE,0,perfect John  so here is a lesson in Redding economics  and I've been on the US bank board of advisory committee  um * and we were supposed to bring something of substance to every meeting  so I always had stuff of substance,20.896
../data_processed_voc/wav/voc_15_part_115.wav,../data_processed_voc/txt/voc_15_part_115.txt,AND THEN AFTER ABOUT TWO HOURS HE'D GET UP AND GO AND SHE'D GO BACK TO THE ROOM SO SO THEY'RE GENERALLY BY NATURE I IN IN IN THEIR NATURAL HABITAT THE THEY THEY DIDN'T CONVERSE VERY MUCH THEY VERY QUIET AND WHAT HAVE YOU AND UH SO I'D MEET THESE GUYS ON THE TRAIL WYOU KNOW WE'D TALK AND I'D SAY,0,and then after about two hours he'd get up and go and she'd go back to the room so so they're generally by nature i- in in in their natural habitat the- they they didn't converse very much they very quiet and what have you and uh so I'd meet these guys on the trail wyou know we'd talk and I'd say,21.55
../data_processed_voc/wav/voc_15_part_76.wav,../data_processed_voc/txt/voc_15_part_76.txt,THEY UM I THINK GOT A FIFTY AT THE REUNION I THINK WE HAD ABOUT FIFTY A AT THE HAD AND THEN THERE WAS ONE GUY THAT WAS IN MY GRADUATING CLASS HIS NAME WAS BILL CLARK AND HE BECAME A SUPREME COURT JUSTICE IN CALIFORNIA AND HE WAS UH RONALD REAGAN'S UH CHIEF ADVISOR WHEN HE WAS PRESIDENT UH,0,they um I think got a fifty at the reunion I think we had about fifty a- at the had and then there was one guy that was in my graduating class his name was Bill Clark and he became a supreme court justice in California and he was uh Ronald Reagan's uh chief advisor when he was president uh,24.430999999999997
../data_processed_voc/wav/voc_21_part_119.wav,../data_processed_voc/txt/voc_21_part_119.txt,IT IS CONVENIENT UM AND YOU KNOW THE PEOPLE THERE THEY KNOW WHAT YOU LIKE WHAT YOU LIKE TO EAT WHAT YOU LIKE TO DRINK YOU CAN LINGER AT YOUR TABLE AS LONG AS YOU WANT IT'S NOT LIKE AT A RESTAURANT DOWNTOWN WHERE YOU FEEL LIKE YOU NEED TO GET IN AND OUT SO THEY CAN GET OTHER PEOPLE THERE SO UM,0,It is convenient um And you know the people there they know what you like what you like to eat what you like to drink {BR} you can linger at your table as long as you want it's not like at a restaurant downtown where you feel like you need to get in and out so they can get other people there {BR} so {LS} um,20.067999999999998
../data_processed_voc/wav/voc_18_part_156.wav,../data_processed_voc/txt/voc_18_part_156.txt,I KNOW MORE ABOUT MY STEPDAD THAN HIS FAMILY THAN ANYONE OF HIS OWN KIDS HIS HIS ONE SON WAS IN A WE HAVEN'T SEEN HIM IN ABOUT TWELVE YEARS AND THEN HE HAS A DAUGHTER THAT LIVES DOWN IN CORNING THAT'S NOT CLOSE TO HIM AT ALL AND SO HE DON'T S GET TO SEE NOT ONLY THE THE KIDS BUT THE GRANDKIDS,0,I know more about my stepdad than his family than anyone of his own kids his his one son was in a [unknown] we haven't seen him in about twelve years and then he has a daughter that lives down in Corning that's not close to him at all and so he don't s- get to see not only the the kids but the grandkids,24.114
../data_processed_voc/wav/voc_28_part_44.wav,../data_processed_voc/txt/voc_28_part_44.txt,SHOOT THERE THAT PULLED THEM INTO THE SAW MILL AND TH THEY'D THEY'D THEY'D BUILT A PRETTY GOOD SIZED SAW MILL THERE AND I HAD HAD A BIG TEEPEE BURNER AND HAD A LADER A AND AND UH BUT I HAD TO GET ON THEM LOGS I HAD A PIPE PIKE POLE THAT I'D P,0,"shoot there that pulled them into the saw mill and th- they'd they'd they'd built a pretty good sized saw mill there and I- had had a big teepee burner and had a ""lader"" a- and and uh but I had to get on them logs I had a pipe pike pole that I'd p-",19.590999999999998
../data_processed_voc/wav/voc_36_part_137.wav,../data_processed_voc/txt/voc_36_part_137.txt,WHICH IS A VERY APPARENTLY A VERY MIDWESTERN THING AND I THOUGHT THAT WAS REALLY FUNNY WHY WOULD YOU CALL IT A BROWN COW WELL BECAUSE THE ROOT BEER IS BROWN AND YOU PUT ICE CREAM IN IT OOH THAT HAD TO BE EXPLAINED TO ME AS A CHILD MY NEICE AND NEPHEW WOULD NEVER CALL A ROOT BEER FLOAT A BROWN COW RIGHT SO BUT THAT THAT I THINK HAS TO DO WITH THE NAMING OF THINGS RIGHT AS OPPOSED TO SLANG TERMS WHICH I THINK ARE VERY GENERATIONAL AND PROBABLY REGIONAL TOO,0,"Which is a very -- apparently a very Midwestern thing. And I thought that was really funny. Why would you call it a brown cow? Well, because the root beer is brown and you put ice cream in it. Ooh. That had to be explained to me as a child. My neice and nephew would never call a root beer float a brown cow. Right? So, but that -- that I think has to do with the naming of things, right? As opposed to slang terms which I think are very generational and probably regional, too,",23.418000000000003
../data_processed_voc/wav/voc_25_part_40.wav,../data_processed_voc/txt/voc_25_part_40.txt,MY MOTHER WAS BORN HERE IN EIGHTEEN NINETY EIGHT AND WENT TO SACRAMENTO HIGH SCHOOL WHEN IT WAS DOWNTOWN SHE TAUGHT AT UH SAN SAN JOSE SHE UH SHE WENT TO SCHOOL AT SAN JOSE STATE WHEN IT WAS JUST A TEACHER'S COLLEGE AND SHE TAUGHT IN A ONE ROOM SCHOOLHOUSE IN GAULT TAUGHT GRAMMAR SCHOOL UM SO,0,My mother was born here in eighteen ninety-eight and went to Sacramento high school when it was downtown. She taught at uh San- +San Jose she uh she went to school at San Jose State when it was just a teacher's college and she taught in a one room schoolhouse in Gault -- taught grammar school. Um so,20.967
../data_processed_voc/wav/voc_34_part_158.wav,../data_processed_voc/txt/voc_34_part_158.txt,PALMA THAT'S OVER HERE PLAY W WELL IT KINDA,0,"Palma, that's over here. {BR} Play, w- -- {BR} Well it kinda",6.218
