/juice/scr/cpajot/data_processed_voc/wav/voc_0_part_45.wav,/juice/scr/cpajot/data_processed_voc/txt/voc_0_part_45.txt,WALNUT STREET THE NEXT STREET THAT WOULD BE BUILT WAS ALMOND AND UH THE EUREKA WAY WAS JUST A TWO WAY A TWO WAY STREET THE HIGH SCHOOL STILL LOOKS THE SAME,0,Walnut Street. The next street that would be built was Almond. and uh the Eureka Way was just a two-way a two-way street. The high school still looks the same.,13.597999999999999
/juice/scr/cpajot/data_processed_voc/wav/voc_28_part_349.wav,/juice/scr/cpajot/data_processed_voc/txt/voc_28_part_349.txt,YEAH AND W W WHEN HE WHEN HE HEARD THAT HE SAID THAT'S WHAT I WANTED TO HEAR HE SAID THAT THAT'S THAT'S S,0,"yeah and w- w- when he- when he heard that he said ""that's what I wanted to hear"" he [inaudible] said that- that's that's s-",9.743
/juice/scr/cpajot/data_processed_voc/wav/voc_14_part_55.wav,/juice/scr/cpajot/data_processed_voc/txt/voc_14_part_55.txt,THEY UH THEY BROUGHT ME IN THEIR ROOM AND THEY WERE MY MOM WAS REALLY UPSET AND SHE WAS SAYING YOU KNOW IS THIS A GOOD IDEA YOU KNOW I DON'T WANT KIDS TO HURT YOU SHE WAS REALLY UPSET JUST THE FACT WHAT PEOPLE MIGHT DO TO ME AND MY DAD WAS REALLY SUP I MEAN THEY WERE BOTH SUPPORTIVE OF COURSE BUT MY DAD WAS THE MOST SUPPORTIVE HE WAS LIKE YOU'RE MY SON THAT DOESN'T YOU KNOW THAT DOESN'T MAKE A DIFFERENCE AND IT WAS REALLY EMOTIONAL UM,0,they uh they brought me in their room and they were my mom was really upset and she was saying you know is this a good idea you know I don't want kids to hurt you she was really upset just the fact what people might do to me and my dad was really sup- I mean they were both supportive of course but my dad was the most supportive he was like you're my son that doesn't you know that doesn't make a difference and it was really emotional um,23.441999999999997
/juice/scr/cpajot/data_processed_voc/wav/voc_28_part_106.wav,/juice/scr/cpajot/data_processed_voc/txt/voc_28_part_106.txt,AND AND WE DID SOME WORK IN S IN OREGON SOUTHER SOUTHERN OREGON TOO AFTER THE AFTER THE COMPANY SOLD OUT ALL TH ALL OF THEIR LANDS DOWN HERE AND THEY AND WE WORKED UP IN UP ALONG THE OH THE RAILROAD FROM THE SISKIYOU SUMMIT TO PORTLAND AND EU,0,and and we did some work in s- in Oregon Souther- Southern Oregon too after the after the company sold out all th- all of their lands down here and they and we worked up in up along the oh the railroad from the Siskiyou Summit to Portland and Eu-,20.354
/juice/scr/cpajot/data_processed_voc/wav/voc_0_part_279.wav,/juice/scr/cpajot/data_processed_voc/txt/voc_0_part_279.txt,NOW THEY'RE GETTING PAID GOOD BUT ALSO THEY'RE PUTTING A LIFE ON THEIR HANDS BUT THEY FEEL LIKE THEY'RE GETTING ENOUGH MONEY THAT IT'S WORTH IT TO TAKE THAT CHANCE BECUASE THEY'RE NOT GOING TO CAUGHT,0,[inaudible] Now they're getting paid good. but also they're putting a life on their hands. But they feel like they're getting enough money That it's worth it to take that chance becuase they're not going to caught.,13.402000000000001
/juice/scr/cpajot/data_processed_voc/wav/voc_12_part_9.wav,/juice/scr/cpajot/data_processed_voc/txt/voc_12_part_9.txt,WE COULD HAVE FIRES AND COOK POTATOES IN THE FIRE AND AND EVEN MY YOUNGER SISTER DID THE SAME THINGS WITH HER FRIENDS WHEN SHE CAME ALONG SO IT WAS A FUN PLACE TO GROW UP AND MY GRANDFATHER OWNED THE SAW MILL THERE AND MY FATHER WORKED FOR HIM NO IT WAS SHUT DOWN IN THE SIXTIES THEY RAN OUT OF TIMBER,0,We could have fires and cook potatoes in the fire and {LS} -- and even my younger sister {BR} did the same things with her friends when she came along. So it was a fun place to grow up. And my grandfather owned the saw mill there and my father worked for him. No it was shut down in the sixties. They ran out of timber.,21.875
/juice/scr/cpajot/data_processed_voc/wav/voc_28_part_403.wav,/juice/scr/cpajot/data_processed_voc/txt/voc_28_part_403.txt,AND I CAN I CAN TELL THAT IT THERE YOU CAN TELL WHICH WAY THE BREEZE IS BLOWING AND YOU SO YOU KNOW WHERE IT IS IT'S AWFUL HARD TO HIDE THEM THINGS FROM EVERYBODY CAUSE,0,and I can I can tell that it there you can tell which way the breeze is blowing and you so you know where it is it's awful hard to hide them things from everybody cuz [breath],12.294
/juice/scr/cpajot/data_processed_voc/wav/voc_25_part_135.wav,/juice/scr/cpajot/data_processed_voc/txt/voc_25_part_135.txt,YEAH YEAH TWENTY YEARS OF W YOU KNOW WE'VE BEEN RETIRED MY WIFE AND I'VE BEEN RETIRED SINCE NINETEEN NINETY SEVEN SO WE'VE HAD A WONDERFUL LUCKY LIFE WE BOTH UH WE BOTH ARE THANKFUL EVERY DAY ABOUT THE LIFE WE LIVE BECAUSE WE REALLY HAVE SOMETHING TO DO EVERY DAY THAT WE LOVE TO DO,0,Yeah yeah twenty years of w- +(()) you know we've been retired -- my wife and I've been retired since nineteen ninety-seven so we've had a wonderful lucky life. We both uh -- we both are thankful every day about the life we live because we really have something to do every day that we love to do.,19.26
/juice/scr/cpajot/data_processed_voc/wav/voc_7_part_251.wav,/juice/scr/cpajot/data_processed_voc/txt/voc_7_part_251.txt,GO OUT SIXTY EIGHT AND THERE'S IT SPLITS INTO RESERVATION ROAD GOES ONE WAY RIVER ROAD GOES THE OTHER WAY,0,Go out sixty-eight and there's -- it splits into Reservation Road goes one way River Road goes the other way.,7.526
