/juice/scr/cpajot/data_processed_voc/wav/voc_31_part_24.wav,/juice/scr/cpajot/data_processed_voc/txt/voc_31_part_24.txt,AND SOMETIMES WE WERE BOTH THERE WHEN WE WERE OUT AT THE RANCH IT WAS FINE 'CAUSE WE ALL DID DIFFERENT THINGS WE WEREN'T CONFINED YEAH,0,and sometimes we were both there. When we were out at the ranch it was fine 'cause we all did different things. We weren't confined yeah,6.76
/juice/scr/cpajot/data_processed_voc/wav/voc_24_part_238.wav,/juice/scr/cpajot/data_processed_voc/txt/voc_24_part_238.txt,IT WAS IN LIKE THE HIGH UM UM LIKE THE HIGH WATCH AREA OR WHATEVER AND UH WHEN WE WENT THROUGH THEY WERE JUST LIKE THAT HALL OVER THERE THAT'S WHERE IT HAPPENED WOW BUY YOU KNOW AND THEN WE HAVE ONE WHERE WE DID UM,0,it was in like the high um [tongue click] um like the high watch area or whatever and uh when we went through they were just like that hall over there that's where it happened Wow. [laughter] [laughter] buy you know and then we have one where we did um,24.430999999999997
/juice/scr/cpajot/data_processed_voc/wav/voc_10_part_227.wav,/juice/scr/cpajot/data_processed_voc/txt/voc_10_part_227.txt,UH THOSE AREAS ARE IN THE NORTH UH KIND OF OVER BY COLLEGE HEIGHTS BUT SOUTH OF COLLEGE HEIGHTS WHICH IS IN THE NORTHEAST,0,uh- those areas are in the North ... uh ... kind of over by College Heights but South of College Heights which is in the Northeast,13.639000000000001
/juice/scr/cpajot/data_processed_voc/wav/voc_0_part_37.wav,/juice/scr/cpajot/data_processed_voc/txt/voc_0_part_37.txt,UH SEQUOIA SCHOOL MIDDLE SCHOOL AND THEY'RE LOTS OF GRAMMAR SCHOOLS ARE IN WHEN UM MY KIDS STARTED ONE OF MY DAUGHTERS WENT TO HAPPY VALLEY UH SHE GRADUATED FROM WEST VALLEY WHICH IS ONE OF THE FINEST HIGH SCHOOLS I BELIEVE THERE IS,0,uh Sequoia School Middle School and they're lots of grammar schools are in when um my kids started. One of my daughters went to Happy Valley. Uh she graduated from West Valley which is one of the finest high schools I believe there is.,15.539000000000001
/juice/scr/cpajot/data_processed_voc/wav/voc_27_part_258.wav,/juice/scr/cpajot/data_processed_voc/txt/voc_27_part_258.txt,WHEN YOU FIND SOMEBODY YOU CAN BOND WITH YOU JUST DO SO THAT COULD BE IT I DON'T KNOW BUT,0,when you find somebody you can bond with you just do so that could be it I don't know but,8.526
/juice/scr/cpajot/data_processed_voc/wav/voc_22_part_155.wav,/juice/scr/cpajot/data_processed_voc/txt/voc_22_part_155.txt,GROWING POUNDS OF WEED ON THEIR PROPERTY AND THEY HAVE GUNS AND STUFF AND BUT THE AND THEY DON'T BELIEVE IN TAXES BUT YOU KNOW WHATEVER THEYV IT'S JUST,0,growing pounds of weed on their property and they have guns and stuff and but the -- and they don't believe in taxes but you know whatever theyv-- it's just,12.286
/juice/scr/cpajot/data_processed_voc/wav/voc_25_part_117.wav,/juice/scr/cpajot/data_processed_voc/txt/voc_25_part_117.txt,THAT I FACED IN IN LAW SCHOOL AND I REALIZED THAT ONE OUT OF EVERY THREE OF US WAS GONNA GET DUMPED AFTER THE FIRST YEAR THAT THAT WAS THE SYSTEM WE STARTED OFF THREE HUNDRED AND YOU END UP WITH TWO HUNDRED AND THAT WAS IT NO MATTER HOW GOOD YOU WERE IF YOU WERE IN THE BOTTOM THIRD YOU WERE THROUGH SO THERE WAS THIS TREMENDOUS PRESSURE YOU KNOW THE GUYS AROUND ME LO LOTS LOTS OF PEOPLE FROM IVY LEAGUE SCHOOLS WHO HAD BEEN AT THE TOP OF THEIR CLASS EXCETERA,0,that I faced in -- in law school and I realized that one out of every three of us was gonna get dumped after the first year. That -- that was the system. We started off three hundred and you end up with two hundred and that was it. No matter how good you were if you were in the bottom third you were through so there was this tremendous pressure you know the guys around me lo- +lots lots of people from ivy league schools who had been at the top of their class excetera,24.947
/juice/scr/cpajot/data_processed_voc/wav/voc_9_part_6.wav,/juice/scr/cpajot/data_processed_voc/txt/voc_9_part_6.txt,COMPANY AND SO AND IT IT WAS A ONGOING P PROJECT IT'S BEEN AN ONGOING PROJECT FOR A NUMBER A NUMBER OF YEARS BUT JUST THIS YEAR THEY STARTED UM BUILDING THE HOUSES JUST THIS SUMMER SO WE JUST LEARNED THAT UH SAFEWAY IS GOING IN WHICH I DON'T CARE FOR,0,company and so and it -- it was a ongoing p- +project - it's been an ongoing project for a number -- a number of years but just this year they started um building the houses just this summer so we just learned that uh Safeway is going in which I don't care for,22.01
/juice/scr/cpajot/data_processed_voc/wav/voc_4_part_28.wav,/juice/scr/cpajot/data_processed_voc/txt/voc_4_part_28.txt,OH I DON'T I MEAN YEAH ARE WE TALKING ABOUT THROUGH HIGH SCHOOL ELEMENTARY IT IT'S HARD I MEAN I'M SO FAR REMOVED FROM IT RIGHT NOW I DON'T KNOW YOU KNOW I'VE ALWAYS JUST GONE TO SCHOOL AND WHEN I GOT OUTTA HIGH SCHOOL IT WAS LIKE EXPECTED IT WSAN'T EVEN TALKED ABOUT THAT I WOULD GO TO COLLEGE AND NOT,0,Oh I don't -- I mean {LG} yeah are we talking about through high school? (()) elementary -- it -- it's hard. I mean I'm so far removed from it right now I don't know you know? I've always just gone to school and when I got outta high school it was like expected it wsan't even talked about that I would go to college and not,20.558000000000003
/juice/scr/cpajot/data_processed_voc/wav/voc_30_part_162.wav,/juice/scr/cpajot/data_processed_voc/txt/voc_30_part_162.txt,YEAH I I THOUGHT IT WAS INTERESTING IS THERE GONNA BE RESULTS OR ANYTHING ARE WE GONNA BE ABLE TO SEE,0,yeah I {LG}-- I thought it was interesting is there gonna be results or anything? Are we gonna be able to see?,6.558
/juice/scr/cpajot/data_processed_voc/wav/voc_18_part_55.wav,/juice/scr/cpajot/data_processed_voc/txt/voc_18_part_55.txt,AND YEAH AND THEIR MILL AND THEN WHEN IT BURNED IT BURNED IN NINETEEN FIFTY EIGHT AND THEN THEY WENT ON TO BUILD THE MILL WHICH GEORGIA PACIFIC BOUGHT AND THAT'S WHAT BECAME GEORGIA PACIFIC THEY BOUGHT THE FORWARD BROTHERS' MILL THEY'RE IN RED BLUFF CAUSE W AFTER IT BURNED UP IN FORWARD THEN THEY BUILD THE MILLL IN RED BLUFF,0,and yeah and their mill and then when it burned it burned in nineteen fifty eight and then they went on to build the mill which Georgia Pacific bought and that's what became Georgia Pacific they bought the forward brothers' mill they're in Red Bluff cuz w- after it burned up in forward then they build the milll in Red Bluff,20.32
/juice/scr/cpajot/data_processed_voc/wav/voc_34_part_406.wav,/juice/scr/cpajot/data_processed_voc/txt/voc_34_part_406.txt,OH G GO DOWN OKAY YOU'RE COMING UH GO GO OH YOU GOT YOUR MAPQUEST OR WHATE WHATEVER UH YEAH AND YOU PARK IN THE BACK OR THE S THERE'S OTHER PARKING IT'S A ONE WAY STREET AND THAT IS EXCELLENT,0,"Oh G- -- Go down, okay, you're coming {BR} uh Go (( )) Go -- Oh you got your Mapquest or whate- +whatever -- {BR} Uh, yeah And you park in the back, or the s- -- there's other parking. {BR} It's a one-way street. {LS} {BR} And That is excellent.",16.345
/juice/scr/cpajot/data_processed_voc/wav/voc_21_part_16.wav,/juice/scr/cpajot/data_processed_voc/txt/voc_21_part_16.txt,UM YOU MEAN FOR ME PERSONALLY OR OR IN THAT IN THAT CITY OR,0,{LS} um You mean for me personally or or in that in that city? or,7.529
/juice/scr/cpajot/data_processed_voc/wav/voc_7_part_87.wav,/juice/scr/cpajot/data_processed_voc/txt/voc_7_part_87.txt,MY MOM TELLING ME BE CAREFUL DON'T TALK TO STRANGERS ON THE WAY TO SCHOOL WELL THAT'S SOMETHING YOU HEAR NOW NOT THEN BUT YOU KNOW IT WAS IN THE PAPERS AND UH UH SO SHE WARNED US AND I'M LIKE WHY BUT I HAD A REALLY GOOD FRIEND WHO WHO WENT TO VIETNAM LIVED ON THE SAME STREET,0,my mom telling me be careful don't talk to strangers on the way to school. Well that's something you hear now not then but you know it was in the papers {COUGH} and uh uh so she warned us and I'm like why? But (()) -- I had a really good friend who -- who went to Vietnam -- lived on the same street,22.51
/juice/scr/cpajot/data_processed_voc/wav/voc_7_part_348.wav,/juice/scr/cpajot/data_processed_voc/txt/voc_7_part_348.txt,MY NEIGHBOR'S FUNERAL ABOUT TEN YEARS AGO THEY MUST BE GOING ON TWO HUNDRED,0, my neighbor's funeral about  ten years ago. They must be going on two hundred.,8.942
/juice/scr/cpajot/data_processed_voc/wav/voc_30_part_40.wav,/juice/scr/cpajot/data_processed_voc/txt/voc_30_part_40.txt,OR THERE'S LIKE UM SANTA FE MARKETS THERE'S SO THERE'S SOME MEXICAN UM UM FOOD STORES AND MARKETS THAT ARE MUCH MORE AFFORDABLE SO WE KIND OF GO TO THOSE,0,"or there's like um Santa Fe markets, there's-- so there's some Mexican um um food stores and markets that are much more affordable so we kind of go to those",11.663
/juice/scr/cpajot/data_processed_voc/wav/voc_11_part_38.wav,/juice/scr/cpajot/data_processed_voc/txt/voc_11_part_38.txt,UM YES I WAS I WAS LIKE AN INTERN BASICALLY I RAN COPIES AND PRINTS AND ERRANDS AND THAT KIND OF STUFF SO THAT'S HOW I GOT INTO THE BUSINESS,0,"Um, {LG} yes I was. I was like an intern basically. I ran copies and prints and errands and that kind of stuff. So that's how I got into the business.",10.624
/juice/scr/cpajot/data_processed_voc/wav/voc_27_part_119.wav,/juice/scr/cpajot/data_processed_voc/txt/voc_27_part_119.txt,THAT HAVING TO GO TO THE BAR TO MEET PEOPLE IT SEEMS TO BE A PROBLEM BUT YOU KNOW WHERE ELSE ARE THEY GON THAT'S WHERE WE TRY TO HAVE ALL THESE EVENTS AND WE INVITE EVERYBODY ANYBODY EVERYBODY COME PLEASE BOWL DO WHATEVER IT DOESN'T MATTER BECAUSE IF THE ONLY PLACE YOU CAN GO TO IS THE BAR,0,that having to go to the bar to meet people it seems to be a problem but you know where else are they gon- that's where we try to have all these events and we invite everybody anybody everybody come please bowl do whatever it doesn't matter because if the only place you can go to is the bar,22.19
/juice/scr/cpajot/data_processed_voc/wav/voc_32_part_102.wav,/juice/scr/cpajot/data_processed_voc/txt/voc_32_part_102.txt,UM WE Y YEAH WE WEREN'T EVER WHEN WE WERE GROWING UP HE'S FIVE YEARS OLDER THAN I AM AND WE HE AND SINCE HE'S MOVED OUT HE AND I HAVE BECOME EXTREMELY CLOSE E EVEN EVEN WITH STATES IN BETWEEN WE STILL STAY CLOSE SO UM AND I DON'T SEE HIM MORE THAN JUST MAYBE ONCE OR TWICE A YEAR,0,"Um we y- +yeah we weren't ever when we were growing up. He's five years older than I am. And, we he and since he's moved out he and I have become extremely close. e- +even even with states in between we still stay close so um, and I don't see him more than just maybe once or twice a year",14.6
/juice/scr/cpajot/data_processed_voc/wav/voc_35_part_78.wav,/juice/scr/cpajot/data_processed_voc/txt/voc_35_part_78.txt,OPPORTUNITIES AND IT'S A JUST A VERY DEPRESSING AREA BECAUSE THEY DON'T HAVE THE SAME RESOURCES THAT THEIR COUNTERPARTS IN WEALTHIER PARTS OF THE DISTRICT HAVE AND IT'S IT'S VERY FRUSTRATING AND THAT'S THE AREA I GREW UP IN HE TEACHES AT THE HIGH SCHOOL THAT I WENT TO FRESHMAN YEAR IN AND THEN WHEN THEY BUILT A NEW HIGH SCHOOL IN THE AREA I ACTUALLY MOVED TO THAT HIGH SCHOOL MY SOPHOMORE YEAR,0,opportunities and it's a -- just a very depressing area because they don't have the same resources that their counterparts in wealthier parts of the district have and it's -- it's very frustrating and that's the area I grew up in. He teaches at the high school that I went to freshman year in and then when they built a new high school in the area I actually moved to that high school my sophomore year,24.551
/juice/scr/cpajot/data_processed_voc/wav/voc_28_part_284.wav,/juice/scr/cpajot/data_processed_voc/txt/voc_28_part_284.txt,THAT H TH THIS OLD DICK LYNCH HE'S GOT S OH THERE'S THERE'S SOME STORIES I CAN'T TELL ABOUT HIM BUT BUT HE WAS FUNNY BUT HE DID A GOOD JOB HERE YOU KNOW FOR YEARS HE HE WAS HE WAS THE CONSTABLE AND AND HE ROAD HARD ON THE KIDS HERE BUT,0,that [laughter] h- th- this old Dick Lynch he's got s- oh there's there's some stories I can't tell about him but [laughter] but he was funny but he did a good job here you know for years he he was he was the constable and and he road hard on the kids here but,20.488000000000003
/juice/scr/cpajot/data_processed_voc/wav/voc_16_part_277.wav,/juice/scr/cpajot/data_processed_voc/txt/voc_16_part_277.txt,WHAT MAKES 'EM TICK BUT I KNOW THERE UP THERE'S A LOT OF PEOPLE AND UH IT'S LOVELY HOUSES AND YOU KNOW CAUSE WE HAVE A FRIEND UP IN REDDING WE USED TO ONCE IN A WHILE GO UP THERE BUT WE DON'T OF LI ANYMORE BUT UH NO I I DON'T KNOW WHAT TO SAY,0,"what makes 'em tick. {LS} But I know there up there's a lot of people, and uh, it's lovely houses and you know, cuz we have a friend up in Redding, we used to once in a while go up there, but we don't of li- anymore, but uh, no, I I don't know what to say.",17.66
/juice/scr/cpajot/data_processed_voc/wav/voc_9_part_88.wav,/juice/scr/cpajot/data_processed_voc/txt/voc_9_part_88.txt,I WISH I COULD SAY THAT IT'S DIVERSE NO I I HONESTLY WISH THAT I COULD SAY THAT IT IS THERE ARE UM IT'S PRETTY WHITE UH THANKFULLY THERE'RE A LOT OF GAY AND LESBIAN PEOPLE THAT ARE THERE YOU KNOW AND UM,0,I wish I could say that it's diverse no. I -- I honestly wish that I could say that it is. There are um -- it's pretty white uh thankfully there're a lot of gay and lesbian people that are there you know and um,25.320999999999998
/juice/scr/cpajot/data_processed_voc/wav/voc_32_part_185.wav,/juice/scr/cpajot/data_processed_voc/txt/voc_32_part_185.txt,UM ABOUT HOW YOU GUYS A ARE WERE JUST TRYING TO FIND TO DISTINGUISH UM HOW WE SAY WORDS VERSUS OTHER PEOPLE IN CALIFORNIA OTHER PLACES AND IN OTHER PLACES IN THE COUNTRY AND,0,Um about how you guys a- +are were just trying to find -- to distinguish um how we say words versus other people in California other places and in other places in the country and,8.76
/juice/scr/cpajot/data_processed_voc/wav/voc_27_part_177.wav,/juice/scr/cpajot/data_processed_voc/txt/voc_27_part_177.txt,OH MY GOSH UH YOU CAN'T EVEN BELIEVE WHAT TIME IT IS YOU KNOW WE'RE JUST TALKING LIKE WE'VE KNOWN EACH OTHER FOREVER AND SO CHRISTINA UM SAYS LET ME TAKE YOUR PICTURE CAUSE SHE'S ALWAYS TAKING MY PHONE AND TAKES PICTURES AND THEN SHE POSTS THEM ON FACEBOOK AND I'M LIKE WHATEVER A HA NONE OF THE PICTURES THAT ARE ON THERE DID I TAKE,0,"""oh my gosh uh you can't even believe what time it is"" you know we're just talking like we've known each other forever and so Christina um says ""let me take your picture"" cuz she's always taking my phone and takes pictures and then she posts them on Facebook and I'm like whatever a- ha- none of the pictures that are on there did I take",23.878
/juice/scr/cpajot/data_processed_voc/wav/voc_17_part_6.wav,/juice/scr/cpajot/data_processed_voc/txt/voc_17_part_6.txt,UM WELL MY UM PATERNAL GRANDFATHER LIVED IN MARYSVILLE AND THEN UM SACRAMENTO AND THEN UM MY MATERNAL GRANDFATHER OR GRANDPARENTS LIVED IN PLACERVILLE SO,0,"Um, well my um paternal grandfather lived in Marysville. And then um Sacramento, and then um, my maternal grandfather, or grandparents, lived in Placerville. So.",13.077
/juice/scr/cpajot/data_processed_voc/wav/voc_14_part_110.wav,/juice/scr/cpajot/data_processed_voc/txt/voc_14_part_110.txt,IT'S TRUE IS LIKE I SAYING EARLIER IF I LIKE I GO THROUGH THESE RUTS WHERE I DON'T HAVE ANY CREATIVITY I'M WHAT DO YOU WA WHAT DO I WANT TO TAKE PICTURE CAUSE I OH I ONLY PHOTOGRAPH PEOPLE THAT'S THE ONLY THING I LIKE TO PHOTOGRAPH I THINK PEOPLE ARE VERY INTERESTING LIKE I ALWAYS WANT TO KNOW EVERYTHING ABOUT EVERYONE I JUST,0,it's true is like I saying earlier if I like I go through these ruts where I don't have any creativity I'm what do you wa- what do I want to take picture cuz I o- I only photograph people that's the only thing I like to photograph I think people are very interesting like I always want to know everything about everyone I just,21.096999999999998
/juice/scr/cpajot/data_processed_voc/wav/voc_8_part_108.wav,/juice/scr/cpajot/data_processed_voc/txt/voc_8_part_108.txt,I KNOW A LOT OF PEOPLE WHO'VE PARTICIPATED IN AN AWFUL LOT OF THINGS IN DEVELOPING OUR CITY UM JUST WITH MY WORK WITH NEIGHBORHOOD ASSOCIATIONS GOING BACK TO NINETEEN NINETY SEVEN UM,0,"I know a lot of people who've participated in an awful lot of things in developing our city. Um, just with my work with neighborhood associations going back to nineteen ninety-seven. Um,",14.967
/juice/scr/cpajot/data_processed_voc/wav/voc_6_part_169.wav,/juice/scr/cpajot/data_processed_voc/txt/voc_6_part_169.txt,WE'RE INTEGRATING EVERYTHING AREN'T WE YEAH AND UH IF ANYTHING YOU KNOW THIS PART,0,we're integrating everything aren't we? Yeah  and uh  if anything you know this part,17.416
/juice/scr/cpajot/data_processed_voc/wav/voc_22_part_110.wav,/juice/scr/cpajot/data_processed_voc/txt/voc_22_part_110.txt,YEAH YEAH WE'VE HAD WE'VE HAD THAT FOR YEARS I MEAN WE'VE HAD SOME BIGGER YOU KNOW SOME GROUPS MAKE IT KINDA BIGGER YOU KNOW THE DEAF TONES,0,Yeah yeah we've had -- we've had that for years. I mean we've had some bigger you know some groups make it kinda bigger you know the Deaf Tones,10.269
/juice/scr/cpajot/data_processed_voc/wav/voc_28_part_184.wav,/juice/scr/cpajot/data_processed_voc/txt/voc_28_part_184.txt,WHERE WE'D SPEND THE NIGHT AND WE JUST JUST THREW OUR SLEEPING BAGS OUT ON THE GROUND AND AND UH AND THEN THEN WHEN WE'D GO UP TO CANYON CREEK LAKES WE'D THAT WAS ONE OF ONE OF OUR N USUAL TRIPS WE'D BUT UH WE'D CAMP AT UP AT THE,0,where we'd spend the night and we just just threw our sleeping bags out on the ground and and uh and then- then when we'd go up to Canyon Creek Lakes we'd that was one of one of our n- usual trips we'd but uh we'd camp at- up at the,20.363
/juice/scr/cpajot/data_processed_voc/wav/voc_12_part_16.wav,/juice/scr/cpajot/data_processed_voc/txt/voc_12_part_16.txt,AND WE SHOPPED THERE SOME TOO BUT MOSTLY I THINK AFTER WE MOVED OVER OVER THERE WE SHOPPED IN THE M MACARTHUR FALL RIVER AREA AND THEN IN THE WINTER TIME MY PARENTS WOULD COME TO REDDING AND BUY CASES OF CANNED FOOD AND FOR THE WINTER,0,and we shopped there some too. {LS} But mostly I think after we moved over -- over there {BR} we shopped in the M- +MacArthur-Fall River area and then {LS} in the winter time my parents would come to Redding and buy cases of canned food and -- for the winter. {BR},20.796999999999997
/juice/scr/cpajot/data_processed_voc/wav/voc_0_part_33.wav,/juice/scr/cpajot/data_processed_voc/txt/voc_0_part_33.txt,AH WE DIDN'T HAVE ANY CRIME WE COULD OPENLY LEAVE OUR DOORS OPEN PEOPLE COME COME AND GO OR THEY COULD UH MY BROTHER HE HE STILL LEAVES HIS DOOR OPEN HE STILL TRUSTS PEOPLE,0,Ah We didn't have any crime. We could openly leave our doors open. People come come and go or they could uh my brother he he still leaves his door open. He still trusts people.,14.944
/juice/scr/cpajot/data_processed_voc/wav/voc_32_part_84.wav,/juice/scr/cpajot/data_processed_voc/txt/voc_32_part_84.txt,KIDS SO THERE WAS A SIZABLE AMOUNT OF PEOPLE THAT DID MOVE ON WITH THEIR LIVES AND GO ELSEWHERE AND JUST WEREN'T FROM OUR CLASS,0,"kids. So, there was a sizable amount of people that did move on with their lives and go elsewhere, and just weren't from our class",7.629
/juice/scr/cpajot/data_processed_voc/wav/voc_24_part_26.wav,/juice/scr/cpajot/data_processed_voc/txt/voc_24_part_26.txt,TO ME THERE WERE INTERESTING STRUCTURAL THINGS IN IT THAT YOU KNOW KIDS COULD CLIMB ON AND POLES AND,0,to me there were interesting structural things in it that you know kids could climb on and poles and,6.276
/juice/scr/cpajot/data_processed_voc/wav/voc_24_part_265.wav,/juice/scr/cpajot/data_processed_voc/txt/voc_24_part_265.txt,THEY PROBABLY ARE STILL SOMEWHAT IT'S JUST YOU KNOW I PROBABLY WAS MORE AWARE OF THEM BECAUSE I WAS GOING TO SCHOOL WITH THEM,0,They probably are still somewhat it's just you know I probably was more aware of them because I was going to school with them,5.851
/juice/scr/cpajot/data_processed_voc/wav/voc_26_part_24.wav,/juice/scr/cpajot/data_processed_voc/txt/voc_26_part_24.txt,I THINK THAT THAT WAS CAUSED BY THE TREMENDOUS HOUSING PRICE INCREASE IN THE BAY AREA AND THOSE REFUGEES WERE SELLING THEIR FOUR HUNDRED THOUSAND DOLLAR IN HOUSE IN BAY AREA AND COMING TO REDDING AND BUYING A TWO HUNDRED THOUSAND DOLLAR HOUSE THAT WAS JUST AS GOOD OR BETTER THEY WERE TOWARDS RETIREMENT,0,I think that that was caused by the tremendous housing price increase in the Bay Area and those refugees were selling their four hundred thousand dollar in house in Bay Area and coming to Redding and buying a two hundred thousand dollar house that was just as good or better  they were towards retirement,21.633000000000003
/juice/scr/cpajot/data_processed_voc/wav/voc_20_part_56.wav,/juice/scr/cpajot/data_processed_voc/txt/voc_20_part_56.txt,THAT'S A GOOD QUESTION UM I KIND OF LIKE THE DOWNTOWN AREA BUT MORE OLD SAC VERSUS LIKE THE DOWNTOWN BUSINESS PARTY KIND OF SCENE I'M NOT A BIG PARTIER SO I DON'T REALLY CARE FOR THE BARS OR THE CLUBS AND I'M ALSO NOT OLD ENOUGH YET ANYWAYS UM BUT I I JUST LIKE HOW PICTURESQUE IT IS LIKE THE TOWER BRIDGE OUT THERE IS GORGEOUS AT NIGHT,0,That's a good question um I kind of like the downtown area but more old Sac versus like the downtown business party kind of scene. I'm not a big partier so I don't really care for the bars or the clubs and I'm also not old enough yet anyways um but I -- I just like how picturesque it is. Like the tower bridge out there is gorgeous at night.,24.695999999999998
/juice/scr/cpajot/data_processed_voc/wav/voc_34_part_324.wav,/juice/scr/cpajot/data_processed_voc/txt/voc_34_part_324.txt,Y WELL I IT'S THE SMART THING ANYHOW YOU KNOW UH PUTTING IN A G UH WHEN YOU GO IN THE GROCERY STORE AND THE CARTS AND PEOPLE WOMEN LEAVE THEIR PURSE THERE THAT'S JUST ASKING FOR TROUBLE AND UH BUT ANYHOW IT SURE T HE HE R CERTAINLY CLEANED UP THAT TOWN AT THAT,0,"Y- -- {BR} Well i- -- it's the smart thing anyhow (( )) {BR} you know uh, putting, in a g- uh, when you go in the {BR} grocery store and the carts, and people {BR} women leave their purse there {BR} that's just asking for trouble. {BR} And uh {BR} but anyhow, it sure t- -- {BR} he -- he r- certainly cleaned up that town at that {BR}",20.462
/juice/scr/cpajot/data_processed_voc/wav/voc_34_part_345.wav,/juice/scr/cpajot/data_processed_voc/txt/voc_34_part_345.txt,I ALWAYS THAT'S ONE THING I I LIKE U I KNOW SOME PEOPLE THEY'RE OLDER LIKE ME THAT DON'T THEY DON'T KNOW WHAT DAY IT I IS I ALWAYS HAVE I KNOW WHAT I'M DOING TOMORROW,0,{BR} I always {BR} that's one thing I -- I {BR} like u- -- I know some people {BR} they're older like me {BR} that don't -- they don't know what day it i- +is -- I always have {BR} I know what I'm doing tomorrow.,14.966
/juice/scr/cpajot/data_processed_voc/wav/voc_18_part_215.wav,/juice/scr/cpajot/data_processed_voc/txt/voc_18_part_215.txt,BUT IF YOU GO THERE AND FISH I'LL SHOW YOU BEFORE YOU LEAVE HOW TO RIG YOUR ROD UP YOU ONLY NEED ONE BAIT AND THAT'S RED PAUTZKE EGGS GREEN LABELED RED PAUTZKE EGGS AND USE A SINGLE EGG HOOK DON'T PUT TWO EGGS ON PUT ONE SINGLE EGG,0,but if you go there and fish I'll show you before you leave how to rig your rod up you only need one bait and that's red Pautzke eggs green labeled red Pautzke eggs and use a single egg hook don't put two eggs on put one single egg,20.019000000000002
/juice/scr/cpajot/data_processed_voc/wav/voc_15_part_38.wav,/juice/scr/cpajot/data_processed_voc/txt/voc_15_part_38.txt,AND WE CAME MY DAD LOST THE PLACE AND WELL HIS BROTHER DIED NINETEEN TWENTY FOUR AND HIS BROTHER DIED THAT WAS THE ONE THAT WAS FLORENCE'S FATHER AND UM MY DAD AND HIS SISTER NELLY WERE UH AND IRVIN WAS THE ONE THAT DIED,0,and we came my dad lost the place and well his brother died nineteen twenty four and his brother died that was the one that was Florence's father and um my dad and his sister Nelly were uh and Irvin was the one that died,22.308000000000003
/juice/scr/cpajot/data_processed_voc/wav/voc_28_part_168.wav,/juice/scr/cpajot/data_processed_voc/txt/voc_28_part_168.txt,WE'D KEEP IT TIED UP WE FINALLY HAD TO KEEP WHEN THEY GOT THE M S MARINAS BUILT TH WE WE WE TIED THEM UP THERE AND WE'D WE HAD A MOTOR ON IT THEN AND WE'D JUST MOTOR OUT AND SOMETIMES HELL WE'D WE'D HAVE PARTIES OUT THERE AND A COUPLE OF OUR FRIENDS HAD HAD BUILT BUILT,0,we'd keep it tied up- we finally had to keep- when they got the m- s- marinas built th- we we we tied them up there and we'd we had a motor on it then and we'd just motor out and sometimes hell we'd we'd have parties out there and a couple of our friends had had built built,20.55
/juice/scr/cpajot/data_processed_voc/wav/voc_7_part_263.wav,/juice/scr/cpajot/data_processed_voc/txt/voc_7_part_263.txt,AND I GOT A STAMP ORIGINAL STAMP FIRST DAY ISSUE STILL STILL HAVE IT,0, and I got a  stamp -- original stamp first day issue {LG} still -- still have it.,9.96
/juice/scr/cpajot/data_processed_voc/wav/voc_16_part_34.wav,/juice/scr/cpajot/data_processed_voc/txt/voc_16_part_34.txt,SHE WAS EXPOSED TO THE FINER THINGS IN LIFE LIKE SHE HAD AUNTS THAT WOULD TAKE HER TO THE OPERA AND DOWN IN THE IN THE BIG CITIES AND THINGS LIKE THAT AND UH SHE ALWAYS WANTED TO TO BETTER HERSELF AND AND HER GOAL WAS TO SPEAK ENGLISH WITHOUT AN ACCENT AND UH SO SHE W CAME FROM A DIFFERENT BACKGROUND SO SHE DID A SHE WAS,0,"she was exposed to the finer things in life, like she had aunts that would take her to the opera. And down in the in the big cities and things like that. And uh she always wanted to to better herself and and her goal was to speak English without an accent. And uh, so she w- came from a different background. So she did a, she was",21.938000000000002
/juice/scr/cpajot/data_processed_voc/wav/voc_10_part_198.wav,/juice/scr/cpajot/data_processed_voc/txt/voc_10_part_198.txt,AND THROUGH DAVID I REUNITED WITH MARY AND HANK NOW MARY AND HANK WENT TO SCHOOL WITH US AND THEY WERE TWO YEARS AHEAD OF ME,0,and through David I reunited with Mary and Hank now Mary and Hank went to school with us and they were two years ahead of me,12.279000000000002
