/juice/scr/cpajot/data_processed_voc/wav/voc_2_part_135.wav,/juice/scr/cpajot/data_processed_voc/txt/voc_2_part_135.txt,STOCKTON UM ACTUALLY THEY DO HAVE THAT ONE STORE WHAT'S IT CALLED DILLARDS,0,Stockton um actually they do have that one store. What's it called? Dillards?,6.526
/juice/scr/cpajot/data_processed_voc/wav/voc_1_part_144.wav,/juice/scr/cpajot/data_processed_voc/txt/voc_1_part_144.txt,WITH BURNING IMAGE YEAH THEY WANTED A GUARANTEE THEY GAVE ME THEIR PRICE I SAID YES WE MET WITH THE SINGER THE DAY PRIOR AND TOOK CARE OF EVERYTHING WE GAVE HIM HIS MONEY THAT WAY WHEN SATURDAY MAY TWELFTH HE DISTRIBUTED THE MONEY TO THE REST OF THE BAND AND THEY WERE JUST LIKE DUDE,0,with Burning Image yeah they wanted a guarantee they gave me their price I said yes we met with the singer the day prior and took care of everything we gave him his money that way when Saturday May twelfth ... he distributed the money to the rest of the band and they were just like dude,20.192999999999998
/juice/scr/cpajot/data_processed_voc/wav/voc_10_part_29.wav,/juice/scr/cpajot/data_processed_voc/txt/voc_10_part_29.txt,THERE WAS PERIOD THERE WHERE WE LOST COMMUNICATION BUT WE GOT IT BACK AND YEAH BUT I DON'T KNOW THE KIDS WERE I THINK THEY WERE MORE WHEN YOU MADE A FRIEND LIKE I SAY YOU MADE A FRIEND YEAH,0,there was period there where we lost communication but we got it back and ... yeah ... but ... I don't know the kids were ... I think they were more ... when you made a friend like I say you made a friend yeah,20.317
/juice/scr/cpajot/data_processed_voc/wav/voc_20_part_55.wav,/juice/scr/cpajot/data_processed_voc/txt/voc_20_part_55.txt,NO HE ACTUALLY HAS BEEN TAKING CLASSES ON AND OFF AT FULSOM LAKE COMMUNITY COLLEGE BUT HE'S CURRENTLY WORKING UM FOR THE FULSOM CORDOVA UNIFIED SCHOOL DISTRICT AS A TECH IN THE I T DEPARTMENT,0,No he actually has been taking classes on and off at Fulsom Lake Community College but he's currently working um for the Fulsom Cordova Unified School District as a tech in the I T department.,11.888
/juice/scr/cpajot/data_processed_voc/wav/voc_0_part_275.wav,/juice/scr/cpajot/data_processed_voc/txt/voc_0_part_275.txt,IF THEY BUST A MARIJUANA RANCH OR A PLANTATION IT'S GOING TO BE WEST OF SHASTA COUNTY,0,if they bust a marijuana ranch or a plantation it's going to be west of Shasta County.,9.222999999999999
/juice/scr/cpajot/data_processed_voc/wav/voc_37_part_195.wav,/juice/scr/cpajot/data_processed_voc/txt/voc_37_part_195.txt,YEAH JUST UM GO I REALLY ENJOY SANTA CRUZ IT'S SUCH A FUNKY TOWN THEY GET IT'S,0,Yeah just um go- --I really enjoy Santa Cruz. It's such a funky town. They get it's,7.27
/juice/scr/cpajot/data_processed_voc/wav/voc_28_part_121.wav,/juice/scr/cpajot/data_processed_voc/txt/voc_28_part_121.txt,I JUST HAD IT KEPT IN THE BASEMENT IN THE GARAGE DOWN THERE AND ANYWAY WE'RE ANYTHING ELSE YOU'D LIKE TO TALK ABOUT THERE,0,I just had it kept in the basement in the garage down there and anyway we're anything else you'd like to talk about there,11.942
/juice/scr/cpajot/data_processed_voc/wav/voc_10_part_338.wav,/juice/scr/cpajot/data_processed_voc/txt/voc_10_part_338.txt,SO HE WAS A GREAT GUY HE REALLY WAS YEAH KIDS WERE HIS INTEREST HE LOVED CHILDREN,0,... so ... he was a great guy he really was yeah kids were his interest he loved children ...,12.163
/juice/scr/cpajot/data_processed_voc/wav/voc_32_part_28.wav,/juice/scr/cpajot/data_processed_voc/txt/voc_32_part_28.txt,OLD MARKY TEXTBOOKS AND EVERYTHING LIKE THAT BUT YEAH I'D SAY SO I'D SAY RIO HAD A BETTER OPPORTUNITY FOR THAT KIND OF THING UM WE DIDN'T HAVE A THEATER EL CAMINO STILL DOESN'T HAVE A THEATER SO WE HAD A MAKESHIFT STAGE,0,"old *marky textbooks and everything like that but Yeah, I'd say so, I'd say Rio had a better opportunity for that kind of thing um we didn't have a theater El Camino still doesn't have a theater so we had a makeshift stage",15.84
/juice/scr/cpajot/data_processed_voc/wav/voc_38_part_70.wav,/juice/scr/cpajot/data_processed_voc/txt/voc_38_part_70.txt,I THINK IT'S JUST OFFICE IT'S JUST KINDA YOU KNOW THE WAY WE TALK TO EACH OTHER AND IT'S LIKE OKAY WELL,0,"I think it's just -- office, it's just, kinda -- you know, the way we talk to each other and it's like, ""Okay, well.""",5.02
/juice/scr/cpajot/data_processed_voc/wav/voc_32_part_10.wav,/juice/scr/cpajot/data_processed_voc/txt/voc_32_part_10.txt,WELL THEY ENDED UP CLOSING DOWN WHEN I W WAS GOT INTO HIGH SCHOOL SO THEY DON'T EXIST ANYMORE BUT IT WAS YEAH AND THEY USE IT FOR I THINK THEY STILL USE IT FOR UM FOR A PRIVATE SCHOOL NOW BUT IT'S NOT A PUBLIC SCHOOL ANYMORE,0,"Well, they ended up closing down when I w+was got into high school, so they don't exist anymore, but it was -- yeah, and they use it for, I think they still use it for um for a private school now. but it's not a public school anymore.",12.81
/juice/scr/cpajot/data_processed_voc/wav/voc_28_part_425.wav,/juice/scr/cpajot/data_processed_voc/txt/voc_28_part_425.txt,THAT'S WHEN THEY HAD THE HAD THE W THE LIFE BOAT THERE AT THE AT BACK IN A BOAT HOUSE WHERE THEY AND UH TH THE COAST GUARD STATION WAS UP ON THE HILL UP UP UP UP ABOVE WHERE THE THERE'S BIG OLD BLUFFS YOU KNOW THE BIG ROCKS AND COVES DOWN THERE AND,0,that's when they had the had the w- the life boat there at the at back in a boat house where they [inaudible] and uh th- the Coast Guard Station was up on the hill up- up- up up above where the there's big old bluffs you know the big rocks and coves down there and,23.701999999999998
/juice/scr/cpajot/data_processed_voc/wav/voc_10_part_211.wav,/juice/scr/cpajot/data_processed_voc/txt/voc_10_part_211.txt,THERE MAY NOT BE A PROBLEM BUT THEN AGAIN YOU DON'T KNOW WHO'S THERE THERE'S SO MANY HOMELESS AND UH DRUG PEOPLE AND GU YOU GOT A LOT OF APARTMENTS AROUND THERE SO YOU DON'T KNOW WHO'S THERE,0,there may not be a problem ... but then again you don't know who's there there's so many homeless and uh ... drug people and gu- you got a lot of apartments around there so you don't know who's there,13.519
/juice/scr/cpajot/data_processed_voc/wav/voc_11_part_2.wav,/juice/scr/cpajot/data_processed_voc/txt/voc_11_part_2.txt,THAT'S NOT THAT'S DOESN'T MAKE SENSE I WOULD EXPECT SOMETHING DIFFERENT FROM STANFORD ANYWAY,0,"That's not that's {LG} ((doesn't make sense)). I would expect something different from Stanford, anyway.",6.934
/juice/scr/cpajot/data_processed_voc/wav/voc_1_part_96.wav,/juice/scr/cpajot/data_processed_voc/txt/voc_1_part_96.txt,THIS TYPE OF LIFESTYLE THIS TYPE OF SELF EXPRESSION THEY COME THERE FOR THE EXPERIENCE THEY DON'T WANT TO JUST GO TO GET DRUNK AT HERESY THEY WANT TO GO THERE FOR THE EXPERIENCE SO SEE YOU CAN SEE A CLEAR DIFFERENCE IN THE ATTITUDE BETWEEN THOSE PEOPLE AND THE PEOPLE WHO JUST GO TO GET DRUNK IN A BAR BECAUSE SOMETIMES DRAMA STARTS,0,this type of lifestyle this type of self-expression they come there for the experience they don't want to just go to get drunk at Heresy they want to go there for the experience so see you can see a clear difference in the attitude ... between those people and the people who just go to get drunk in a bar because sometimes drama starts,20.144000000000002
/juice/scr/cpajot/data_processed_voc/wav/voc_9_part_53.wav,/juice/scr/cpajot/data_processed_voc/txt/voc_9_part_53.txt,THEY LOVED IT THEY THEY WERE THE ONLY W OTHER ASIDE FROM MY TWO SINGLE AUNTS WHO LEFT THE RANCH IN FRESNO COUNTRY TO WORK IN SAN FRANSISCO MY PARENTS WERE TH EONLY ONES TO HAVE COME NORTH UM,0,They loved it. They -- they were the only w- +(()) -- other -- aside from my two single aunts who left the ranch in Fresno country to work in San Fransisco my parents were th eonly ones to have come North um,20.125
/juice/scr/cpajot/data_processed_voc/wav/voc_8_part_245.wav,/juice/scr/cpajot/data_processed_voc/txt/voc_8_part_245.txt,BECAUSE THE KIDS PLAY TOGETHER IT BRINGS THE PARENTS TOGETHER OR EVEN IF IT DOESN'T BRING THE PARENTS TOGETHER IT EXPOSES THE KIDS TO FAMILY LIFE IN MORE THAN JUST THEIR OWN,0,"Because the kids play together, it brings the parents together or even if it doesn't bring the parents together, it exposes the kids to family life in more than just their own.",9.648
/juice/scr/cpajot/data_processed_voc/wav/voc_18_part_289.wav,/juice/scr/cpajot/data_processed_voc/txt/voc_18_part_289.txt,YOU KNOW CAUSE HE LIVED IN MICHIGAN PRIOR TO HERE AND HE LIVED IN L A AND I SAID HOW DO YOU FIND REDDING OUT OF YOU KNOW SUCH A PRODUCTIVE PLACE LIKE MICHIGAN OR AND HE SAID HEALTHCARE HE SAID THE DEMAND FOR HEALTHCARE HERE HE SAID BUT THAT WASN'T ACTUALLY HE SAID MY PARENTS MOVED HERE,0,"you know cuz he lived in Michigan prior to here and he lived in L.A. and I said ""how do you find Redding out of"" ""you know such a productive place like Michigan or"" and he said ""healthcare"" he said ""the demand for healthcare here"" he said but that wasn't actually he said ""my parents moved here""",22.500999999999998
/juice/scr/cpajot/data_processed_voc/wav/voc_15_part_43.wav,/juice/scr/cpajot/data_processed_voc/txt/voc_15_part_43.txt,SAN ANTONIO U WHERE WHERE IN THE AIR FORCE ACTUALLY I WAS AT CAL POLY FIRST AND THEN THE KOREAN WAR WAS GOING ON AND UH IT WAS HEATING UP PRETTY GOOD AND I COULD SEE THE DRAFT BOARD JUST STARING DOWN MY NECK AND I WA I WAS A PRETTY GOOD STUDENT BUT I WASN'T THE BEST YOU KNOW I WAS PROBABLY A B STUDENT,0,San Antonio u- where where in the Air Force actually I was at Cal Poly first and then the Korean war was going on and uh it was heating up pretty good and I could see the draft board just staring down my neck and I wa- I was a pretty good student but I wasn't the best you know I was probably a B. student,23.171
/juice/scr/cpajot/data_processed_voc/wav/voc_32_part_134.wav,/juice/scr/cpajot/data_processed_voc/txt/voc_32_part_134.txt,I WAS LIKE I KNOW I WAS LIKE YOU DID THAT TO M MY I KNOW YOU DIDN'T DO IT BUT THAT WAS MY CAR D I LOVED THAT CAR,0,"I was like, I know I was like, you did that to m- +my -- I know you didn't do it but that was my car d- -- I loved that car!",5.18
/juice/scr/cpajot/data_processed_voc/wav/voc_20_part_50.wav,/juice/scr/cpajot/data_processed_voc/txt/voc_20_part_50.txt,AND THEN IF I CHOOSE TO MOVE ONTO A P H D SO I COULD JUST DO MY MASTERS MY CERTIFICATIONS AND ALL OF THAT AND STILL WORK WITH KIDS AND TECHNICALLY IT'S GOING TO BE CHILD AND FAMILY NOT STRICTLY CHILD WHICH IS FINE CAUSE EVEN AS A CHILD COUNSELOR YOU'RE GONNA HAVE TO DEAL WITH THE SCHOOLS AND THE FAMILIES AND ALL OF THAT SO IT DOESN'T IT'S NOT MUCH OF A DIFFERENCE SO YEAH,0,and then if I choose to move onto a P H D so I could just do my Masters my certifications and all of that and still work with kids and technically it's going to be child and family not strictly child which is fine cuz even as a child counselor you're gonna have to deal with the schools and the families and all of that so it doesn't it's not much of a difference so yeah.,20.354
/juice/scr/cpajot/data_processed_voc/wav/voc_19_part_5.wav,/juice/scr/cpajot/data_processed_voc/txt/voc_19_part_5.txt,I HAVE I HAVE TOO MUCH STUFF I ACTUALLY NEED TO GET RID OF STUFF BECAUSE I WOULD LIKE TO BE ABLE TO FIT INTO A ONE BEDROOM APARTMENT BUT I SWEAR MY BEDROOM IS HALF STORAGE AT THIS POINT CAUSE I'VE JUST I'VE GOT BINS AND BINS OF CRAP GOT HALLOWEEN COSTUMES AND CHRISTMAS STUFF 'N JUST,0,"I have -- I have too much stuff. I actually need to get rid of stuff, because I would like to be able to fit into a one-bedroom apartment, but I swear my bedroom is half storage at this point, cause I've just, I've got bins and bins of crap. Got Halloween costumes, and Christmas stuff, 'n just",13.937000000000001
/juice/scr/cpajot/data_processed_voc/wav/voc_7_part_361.wav,/juice/scr/cpajot/data_processed_voc/txt/voc_7_part_361.txt,YOU KNOW JUST THE ONES THAT WERE KIDS WHEN I WAS THERE ARE OLD TIMERS GETTING READY TO RETIRE EVEN MY MY STUDENT UH TEACHER HE SAID ONE MORE YEAR AND HE'S OUTTA THERE HIS SON PLAYED THE COWARDLY LION FOR ME WHEN WE DID THE WIZARD OF OZ,0, you know just -- the ones that were kids when I was there are old timers getting ready to retire. {LG} Even my -- my student uh teacher he said one more year  and he's outta there  his son played the cowardly lion for me when we did the Wizard of Oz.,22.445
/juice/scr/cpajot/data_processed_voc/wav/voc_0_part_47.wav,/juice/scr/cpajot/data_processed_voc/txt/voc_0_part_47.txt,UH BUT WALNUT STREET WAS THE LAST S STREET AND UP ON A HILL WAS TWO RESERVOIRS AND THAT WAS WHERE WE GOT OUR WATER FROM THE RIVER,0,Uh but Walnut Street was the last s- street. and up on a hill was two reservoirs and that was where we got our water from the river,11.856
/juice/scr/cpajot/data_processed_voc/wav/voc_18_part_170.wav,/juice/scr/cpajot/data_processed_voc/txt/voc_18_part_170.txt,AND UM UH HE HIS HOUSE IS ONE OF THE MOST SPECTACULAR PLACE ONE OF THE SPECTACULAR PLACES TO GO AND LOOK AT AT CHRISTMAS,0,and um uh he his house is one of the most spectacular place- one of the spectacular places to go and look at at Christmas,9.927
/juice/scr/cpajot/data_processed_voc/wav/voc_17_part_88.wav,/juice/scr/cpajot/data_processed_voc/txt/voc_17_part_88.txt,MORE WHITE AFFLUENT AREA YOUR BAY AREA YUPPY ISH KIND OF,0,"{LS} more white affluent area. Your Bay Area, ((yuppy-ish)), kind of",6.492000000000001
/juice/scr/cpajot/data_processed_voc/wav/voc_2_part_26.wav,/juice/scr/cpajot/data_processed_voc/txt/voc_2_part_26.txt,I DON'T THINK I WOULD WANT TO LIKE SET UP MY LIFE THERE FOR A WHILE LIKE SAN DIEGO STATE IS A GOOD PLACE BECAUSE I LOVE SAN DIEGO AND I COULD SEE MYSELF S YOU KNOW GETTING A JOB THERE FINISHING SCHOOL AND LIKE YOU KNOW SETTING UP MY LIFE MEETING MY FRIENDS AND STUFF THERE,0,I don't think I would want to like set up my life there for a while. Like San Diego state is a good place because I love San Diego and I could see myself s- +(()) you know getting a job there finishing school and like you know setting up my life -- meeting my friends and stuff there,20.6
/juice/scr/cpajot/data_processed_voc/wav/voc_13_part_127.wav,/juice/scr/cpajot/data_processed_voc/txt/voc_13_part_127.txt,I LIKED I LOVED THE GRAPHIC DESIGN PORTION DID NOT LIKE THE INDUSTRY IT WAS JUST SO COLD AND STERILE AND COMPETITIVE AND WHICH IT DIDN'T REALLY COME AS A SHOCK IT JUST I GUESS WHAT WAS SURPRISING TO ME WAS HOW I FELT IN THAT ENVIRONMENT UM,0,I liked I loved the graphic design portion did not like the industry it was just so cold and sterile and competitive and which it didn't really come as a shock it just I guess what was surprising to me was how I felt in that environment um,21.085
/juice/scr/cpajot/data_processed_voc/wav/voc_33_part_119.wav,/juice/scr/cpajot/data_processed_voc/txt/voc_33_part_119.txt,FORM OR ANOTHER UM BUT MOST OF MY FRIENDS DON'T UM ATTEND ANY SORT OF ORGANIZED RELIGION THERE'S UM MY FAMILY'S LIKE TOO WEIRD TO EXPLAIN BESIDES MY,0,form or another. Um  but most of my friends don't um attend any sort of organized religion.  There's um my family's like too weird to explain besides my --,25.988000000000003
/juice/scr/cpajot/data_processed_voc/wav/voc_28_part_365.wav,/juice/scr/cpajot/data_processed_voc/txt/voc_28_part_365.txt,UNTIL DARK AND THEN I'D GO HOME AND EAT AND GO TO BED AND G GET UP AND GO TO WORK AND AND THEN ON THE WEEKENDS I WORKED ALL WEEKEND SAWING AND STUFF AND THE THE GUYS WERE WERE FRAMING IT UP THEN AND UH I'D HAVE T G I'D HAVE TO GET STUFF CUT THAT THAT THEY WERE GONNA NEED S FOR THE NEXT,0,until dark and then I'd go home and eat and go to bed and g- get up and go to work and and then on the weekends I worked all weekend sawing and stuff and the- the guys were were framing it up then and uh I'd have t- g- I'd have to get stuff cut that that they were gonna need s- for the next,21.209
/juice/scr/cpajot/data_processed_voc/wav/voc_17_part_7.wav,/juice/scr/cpajot/data_processed_voc/txt/voc_17_part_7.txt,UM PROBABLY MY UH PATERNAL SIDE SO I HAD LOTS OF YOUNGER COUSINS AND STUFF SO WE'D GO OUT THERE AND VISIT A LOT AND THEY'D COME DOWN HERE AND VISIT WE HAD A POOL SO,0,"Um, probably my uh paternal side. So, I had lots of younger cousins and stuff, so we'd go out there and visit a lot, and they'd come down here and visit. We had a pool. So.",9.898
/juice/scr/cpajot/data_processed_voc/wav/voc_18_part_403.wav,/juice/scr/cpajot/data_processed_voc/txt/voc_18_part_403.txt,AND I A ASSURE YOU I DID NOT FEEL GOOD THEY GAVE ME A PAIN SHOT AND WHEN I FIRST YOU KNOW I'D BEEN THERE AND HE SAYS WELL HE SAYS YOUR JAW IS BROKEN THREE PLACES HE SAYS IT'S BROKE BOTH SIDES OF YOUR CHIN AND HE SAYS YOU'RE BROKE CLEAN THROUGH YOUR UPPER LOWER MANDIBLE AND SO ANYWAY YOU C AT THIS POINT YOU COULDN'T DEFINE,0,"and I a- assure you I did not feel good they gave me a pain shot and when I first you know I'd been there and he says ""well"" he says ""your jaw is broken three places"" he says ""it's broke both sides of your chin"" and he says ""you're broke clean through your upper lower mandible"" and so anyway you c- at this point you couldn't define",24.504
/juice/scr/cpajot/data_processed_voc/wav/voc_13_part_135.wav,/juice/scr/cpajot/data_processed_voc/txt/voc_13_part_135.txt,THE I SAW THAT THE COUNTY WAS PUTTING TOGETHER THIS HEALTH PLAN PUTTING THIS TOGETHER AND UM I'VE BEEN FOLLOWING HEALTH REFORM REALLY CLOSELY AND IT JUST SORT OF PIQUED MY INTEREST UH AND THEY HAPPENED TO HAVE A JOB OPENING FOR A DATA ANALYST SO I SAID WELL I WANNA GIVE THIS A SHOT UM NOT SO MUCH FOR THE DATA,0, [click] the I saw that the county was putting together this health plan putting this together and um I've been following health reform really closely and it just sort of piqued my interest uh and they happened to have a job opening for a data analyst so I said well I wanna give this a shot um not so much for the data,20.361
/juice/scr/cpajot/data_processed_voc/wav/voc_0_part_326.wav,/juice/scr/cpajot/data_processed_voc/txt/voc_0_part_326.txt,NOW WHAT NOW IS THAT THERE PEOPLE START SAY DIFFERENT THINGS LIKE THAT,0,Now what? Now Is that there people start- say different things like that?,5.13
/juice/scr/cpajot/data_processed_voc/wav/voc_6_part_88.wav,/juice/scr/cpajot/data_processed_voc/txt/voc_6_part_88.txt,UH ABOVE COLFAX UH WAS GOING UP A VERY STEEP GRADE AND TO PUT ANOTHER ROAD IN UP ABOVE YOU KNOW UH YOU JUST COULDN'T CHANGE THIS ONE AND AND YOU HAD TO HAVE A A SIX PERCENT GRADE RATHER THAN FIVE PERCENT GRADE AND PROBABLY THE MOST SPECTACULAR DIFFERENCE,0,uh above Colfax uh was going up a very steep grade and to put another road in up above you know uh you just couldn't change this one and -- and you had to have a a six percent grade rather than five percent grade and probably the most spectacular difference,24.088
/juice/scr/cpajot/data_processed_voc/wav/voc_10_part_157.wav,/juice/scr/cpajot/data_processed_voc/txt/voc_10_part_157.txt,IF YOU RUN ACROSS SOMEBODY YEAH UHUH FRENCH UH I DON'T KNOW HOW MANY PEOPLE TAKE FRENCH BUT WE'VE NEVER BEEN HAD TO INTERPRET IN FRENCH,0,if you run across somebody yeah ... uhuh [yes] French uh I don't know how many people take French but we've never been had to interpret in French,10.992
/juice/scr/cpajot/data_processed_voc/wav/voc_34_part_161.wav,/juice/scr/cpajot/data_processed_voc/txt/voc_34_part_161.txt,YEAH I DON'T KNOW THI THIS THIS IS NOT A GOOD UH MAP OF OUR AREA,0,"Yeah, I don't know. Thi- +This -- {BR} This is not a good {BR} uh map of our area.",6.471
/juice/scr/cpajot/data_processed_voc/wav/voc_16_part_122.wav,/juice/scr/cpajot/data_processed_voc/txt/voc_16_part_122.txt,THE A LOT OF 'EM MOVED OUT AND NEW ONES CAME IN YOU KNOW AS THEY PROGRESSED THEY WENT OUT AND UH THE FAMILIES GREW AND UM BUT UH IT PRETTY MUCH STAYED YOU KNOW L LIKE THAT AND UH BUT UH THIS WAS AN APARTMENT HOUSE AND UH THINGS HAPPENED,0,"the a lot of 'em moved out and new ones came in, you know, as they progressed, they went out and uh the families grew and um, but uh it pretty much stayed you know, l- like that, and uh, {LS} but uh, this was an apartment house, and uh things happened.",20.61
/juice/scr/cpajot/data_processed_voc/wav/voc_10_part_134.wav,/juice/scr/cpajot/data_processed_voc/txt/voc_10_part_134.txt,WELL I DON'T KNOW ABOUT THAT THEY KEEP BUSY MY SON IN LAW PLAYS GOLF EVERY DAY THEY BELONG TO SEVEN OAKS COUNTRY CLUB,0,well I don't know about that ... they keep busy my son in law plays golf every day they belong to Seven Oaks Country Club,8.591000000000001
/juice/scr/cpajot/data_processed_voc/wav/voc_11_part_24.wav,/juice/scr/cpajot/data_processed_voc/txt/voc_11_part_24.txt,UM VERY MIDDLE UPPER MIDDLE CLASS UM UH VERY SAFE,0,"Um, {LS} very middle upper middle class, um, uh, very safe.",6.193
/juice/scr/cpajot/data_processed_voc/wav/voc_18_part_385.wav,/juice/scr/cpajot/data_processed_voc/txt/voc_18_part_385.txt,AND THEY GO HEY WE WANTING TO KNOW IF WE'RE GONNA GO OVER TO THE LOUNGE THE ANDERSON LOUNGE AND HAVE A BEER YOU WANT TO GO OVER THERE WITH US AND I WAS REAL HESITANT BECAUSE WE DIDN'T EVER GO TO THE I DIDN'T GO TO THE LOUNGE BECAUSE IT HAD AN A REPUTATION OF WHEN THINGS HAPPEN YOU GET A YOUR LOVE WILL GET HURT OVER THERE,0,"and they go ""hey we wanting to know if we're gonna go over to the lounge"" the Anderson Lounge ""and have a beer you want to go over there with us"" and I was real hesitant because we didn't ever go to the I didn't go to the lounge because it had an- a reputation of when things happen you get a- your love will get hurt over there",21.480999999999998
/juice/scr/cpajot/data_processed_voc/wav/voc_28_part_304.wav,/juice/scr/cpajot/data_processed_voc/txt/voc_28_part_304.txt,AND HE SAID YOU KNOW HE KEPT US IN VEGETABLES AND FRUIT AND EVERYTHING WHEN WHEN I WAS HAULING HAULING LOGS BY THE PLACE HE'D GO OUT THERE AND HE'D HAVE A B HE'D HAVE A BUNCH OF BUNCH OF VEGETABLES FOR HIM TO T TAKE TAKE HOME TO FEED THE KIDS WITH,0,"and he said ""you know"" ""he kept us in vegetables and fruit and everything when- when I was hauling"" ""hauling logs by the place"" he'd go out there and he'd have a b- he'd have a bunch of bunch of vegetables for him to t- take- take home to feed the kids with",18.065
/juice/scr/cpajot/data_processed_voc/wav/voc_34_part_154.wav,/juice/scr/cpajot/data_processed_voc/txt/voc_34_part_154.txt,NO NO SO I ME MEAN IT'S UNDERSTANDABLE AND I'M BUT I JUST YOU KNOW FOR MY SAKE I IT'S NOT WHAT I LIKE TO SEE,0,"No No, so, I me- +mean -- it's understandable. {BR} And I'm -- {BR} But I just you know, for my sake, i- -- it's not what I like to see.",8.939
/juice/scr/cpajot/data_processed_voc/wav/voc_13_part_274.wav,/juice/scr/cpajot/data_processed_voc/txt/voc_13_part_274.txt,IT IS IT'S CRAZY UM THERE ARE JUST SO MANY LITTLE CITIES LIKE RIGHT HERE THERE'S JUST A TON OF THEM THIS WHOLE AREA IS INTERESTING TO ME BECAUSE I FEEL LIKE IT'S A LITTLE MAYBE MAYBE A LITTLE SIMILAR TO THE BAY AREA BUT I MEAN,0,it is it's crazy  um  there are just so many little cities like right here  there's  just a ton of them this whole area is interesting to me because I feel like it's a little maybe maybe a little similar to the Bay Area but I mean,22.912
/juice/scr/cpajot/data_processed_voc/wav/voc_16_part_94.wav,/juice/scr/cpajot/data_processed_voc/txt/voc_16_part_94.txt,MY HUSBAND OF COURSE DID GO TO SAINT MARY'S HE GOT HIS DEGREE BUT WE THAT WAS ONE OF OUR GOALS THAT MAKE SURE THAT ENCOURAGE THEM ALL TO GO TO SCHOOL AND THEY DID AND B BECAUSE I ALWAYS FELT THAT I REALLY WANTED TO GO TO SCHOOL BUT LIKE I SAID WHEN I WAS IN FRESHMAN MY MOTHER WENT TO SCHOOL AND SAID TOLD THE TEACHERS I SHOULD TAKE THIS AND THIS COURSES I SHOULD NOT TAKE ANY,0,"my husband of course did go to Saint Mary's, he got his degree. But we that was one of our goals, that make sure that encourage them all to go to school. And they did. {LS} And b- because I always felt that I really wanted to go to school but like I said, when I was in freshman, my mother went to school and said, told the teachers, I should take this and this courses. I should not take any",23.331999999999997
/juice/scr/cpajot/data_processed_voc/wav/voc_28_part_246.wav,/juice/scr/cpajot/data_processed_voc/txt/voc_28_part_246.txt,THEN HE WENT TO WORK FOR SOUTHERN CALIFORNIA EDISON AS AS A STRING GUAGER UP IN THE SIERRAS RIGHT BACK BACK BY UH OH YOSEMITE AND THAT HE REALLY KNEW THAT COUNTRY UH AND HE'D HE'D BEEN ALL OVER IT,0,then he went to work for Southern California Edison as as a string guager up in the Sierras right back back by uh oh Yosemite and that he really knew that country uh and he'd he'd been all over it,20.355
/juice/scr/cpajot/data_processed_voc/wav/voc_20_part_93.wav,/juice/scr/cpajot/data_processed_voc/txt/voc_20_part_93.txt,OKAY I CAN TELL YOU'RE FROM MORE NORTHERN THEY'RE MORE USED TO A DIFFERENT TYPE OF WEATHER FOR ONE THING IT'S A LITTLE BIT COLDER OUT UP THERE IT GETS MORE HUMID TOO UM IT SEEMS LIKE MORE OF A RELAXED KIND OF AREA AS WELL,0,okay I can tell you're from more northern. They're more used to a different type of weather for one thing. It's a little bit colder out -- up there. It gets more humid too. Um it seems like more of a relaxed kind of area as well.,15.517000000000001
/juice/scr/cpajot/data_processed_voc/wav/voc_18_part_357.wav,/juice/scr/cpajot/data_processed_voc/txt/voc_18_part_357.txt,AND HE F ROAMED IN HE WAS GONNA GO HIKING HE WENT UP AND HE STUMBLED INTO THESE GUYS'S MARIJUANA GARDEN AND THEY SHOT AND KILLED HIM,0,and he f- roamed in he was gonna go hiking he went up and he stumbled into these guys's marijuana garden and they shot and killed him,9.177
