/juice/scr/cpajot/data_processed_voc/wav/voc_26_part_269.wav,/juice/scr/cpajot/data_processed_voc/txt/voc_26_part_269.txt,RIGHT SO WHAT DID YOU THINK WHEN UH WHAT'S HIS NAME WAS YOUR GOVERNOR THE WRESTLER,0,right  so what did you think when uh what's his name was your governor the wrestler,6.875
/juice/scr/cpajot/data_processed_voc/wav/voc_30_part_41.wav,/juice/scr/cpajot/data_processed_voc/txt/voc_30_part_41.txt,SHOPPING YEAH AND MY SON'S PRESCHOOL IS ACTUALLY IN NORTH SALINAS SO WE DO GO THERE LIKE THREE TIMES A WEEK BUT WE ACTUALLY AVOID IT,0,shopping yeah and my son's preschool is actually in North Salinas so we do go there like three times a week but we actually avoid it {LG},7.8420000000000005
/juice/scr/cpajot/data_processed_voc/wav/voc_6_part_73.wav,/juice/scr/cpajot/data_processed_voc/txt/voc_6_part_73.txt,AND AS SOON AS I GOT BACK I APPLIED WITH UH THEN DIVISION HIGHWAYS NOW CALTRANS AND THEY HAD AN OPENING IN MARYSVILLE UH THEY HAD OPENINGS IN IN IN UH,0,And as soon as I got back I applied with uh then Division Highways now Caltrans and they had an opening in Marysville. Uh they had openings in -- in -- in uh ,20.6
/juice/scr/cpajot/data_processed_voc/wav/voc_18_part_433.wav,/juice/scr/cpajot/data_processed_voc/txt/voc_18_part_433.txt,THEN IT'S NOT WORTH DOING CAUSE I SAID I DON'T WANT NOBODY TO FIG HT MY BATTLES FOR ME IN MY LIFE I SAID I KNOW YOU'RE A GOOD FRIEND AND I KNOW THAT YOU ARE QUITE CAPABLE OF GOING BACK THERE AND PULVERIZING THIS GUY I KNOW YOU ARE BUT BUT I S BUT IT WAS SO FUNNY BECAUSE I MEAN HE GO MAN RICK I'LL GO BACK THERE AND I'LL BE AND I COULD TALK JUST LIKE HE'S GONE NOW DOUG IS BUT,0,"""then it's not worth doing"" cuz I said ""I don't want nobody to fig""ht my battles for me in my life"" I said ""I know you're a good friend and I know that you are quite capable of going back there and pulverizing this guy"" ""I know you are"" but but I s- but it was so funny because I mean he go- ""man Rick I'll go back there and I'll be"" and I could talk just like he's gone now Doug is but",21.395
/juice/scr/cpajot/data_processed_voc/wav/voc_28_part_91.wav,/juice/scr/cpajot/data_processed_voc/txt/voc_28_part_91.txt,AND THEN I WENT TO W IN IN THE OFF SEASON I'D I WORKED WITH THE THE GUYS THAT WERE THAT WERE THE F THEY WERE FORESTERS AND THEY WE'D UH WORK UP TIMBER SALES WE HAD TO WE RAN ALL OF OUR OWN LINES THEN OUR PROPERTY LINES,0,and then I went to w- in- in the off season I'd I worked with the the guys that were that were the f- they were foresters and they we'd uh work up timber sales we had to we ran all of our own lines then our property lines,20.281
/juice/scr/cpajot/data_processed_voc/wav/voc_24_part_245.wav,/juice/scr/cpajot/data_processed_voc/txt/voc_24_part_245.txt,OH OKAY UM IT'S VERY UH TO ME COMMERCIALIZED UM YOU KNOW YOU YOU'VE YOU'VE GOT THE HOTELS THE RESTAURANTS IT'S ALL CHAIN STUFF THAT YOU CAN SEE ANYWHERE EXACTLY AND A LOT OF EMPTY STRIP MALLS YEAH,0,oh okay um it's very uh to me commercialized um you know you you've you've got the hotels the restaurants. It's all chain stuff that you can see anywhere exactly and a lot of empty strip malls. Yeah.,20.304000000000002
/juice/scr/cpajot/data_processed_voc/wav/voc_34_part_84.wav,/juice/scr/cpajot/data_processed_voc/txt/voc_34_part_84.txt,I I YEAH IT IT HAS AND BUT THE IT STOPPED AT DAVIS ROAD IF YOU'VE BEEN THERE IT'S K KINDA U THAT IS STILL SOME FIEL FIELDS E FIELDS THERE AND OVER ONTO BLANKEL AND U UH THEY'RE NOT D GOING INTO THAT TYPE OF THINGS NOWADAYS W TAKING OVER THE YEAH,0,"i- -- i- Yeah, it -- it has, and -- {BR} but the -- it stopped at Davis Road if you've been there {BR} it's k- -- kinda -- u- -- that -- {BR} is still some fiel- +fields -- e- -- fields there and over onto Blankel and u- -- {BR} uh they're not d- -- {BR} going into that type of things nowadays {BR} w- -- taking over the {BR} Yeah",20.69
/juice/scr/cpajot/data_processed_voc/wav/voc_7_part_88.wav,/juice/scr/cpajot/data_processed_voc/txt/voc_7_part_88.txt,AND WAS NEVER THE SAME AFTER VIETNAM HE WENT TO AND LIKED IT NOW THAT'S SCARY,0,and  was never the same after Vietnam. He went to (())  and liked it. Now that's scary,11.873
/juice/scr/cpajot/data_processed_voc/wav/voc_33_part_133.wav,/juice/scr/cpajot/data_processed_voc/txt/voc_33_part_133.txt,TIN FELL ALMOND COOP SOMEONE MIGHT HESITATE IT CAUSE I COULD SAY TWO WAYS CREAK TOE PAL BANG CAUGHT BAG FILL BEN DO BATH PULL,0,tin fell almond coop someone might hesitate it cuz I could say two ways creak toe pal bang caught bag fill ben do bath pull,20.298
/juice/scr/cpajot/data_processed_voc/wav/voc_24_part_127.wav,/juice/scr/cpajot/data_processed_voc/txt/voc_24_part_127.txt,UM I'M NOT CURRENTLY INVOLVED IN A CHURCH UM I BELIEVE IN GOD I'M NOT RELIGIOUS AT ALL UM I FEEL I'M MORE SPIRITUAL,0,Um I'm not currently involved in a church Um I believe in God. I'm not religious at all um I feel I'm more spiritual,12.554
/juice/scr/cpajot/data_processed_voc/wav/voc_10_part_106.wav,/juice/scr/cpajot/data_processed_voc/txt/voc_10_part_106.txt,RACE IS RACE UH WE HAD CHINESE ASIAN UM BUT THEY HAD AN ASIAN COMMUNITY YEARS AGO,0,race is race ... uh we had Chinese ... Asian um ... but they had an Asian community years ago,12.054
/juice/scr/cpajot/data_processed_voc/wav/voc_14_part_57.wav,/juice/scr/cpajot/data_processed_voc/txt/voc_14_part_57.txt,CAUSE LIKE MY ENTIRE FAMILY'S VERY ACCEPTING AND THE WAY I ACT IN FRONT OF ANYONE AT THE BAR OR IN FRONT OF MY FRIENDS I'LL ACT EXACTLY THE SAME WAY IN FRONT OF MY FAMILY AND I YEAH I PROBABLY GET ANNOYING SOMETIMES BUT THEY ACCEPT ME AND I LOVE THEM SO,0,cuz like my entire family's very accepting and the way I act in front of anyone at the bar or in front of my friends I'll act exactly the same way in front of my family and I yeah I probably get annoying sometimes but they accept me and I love them so,14.912
/juice/scr/cpajot/data_processed_voc/wav/voc_35_part_80.wav,/juice/scr/cpajot/data_processed_voc/txt/voc_35_part_80.txt,HE NO HE WAS ACTUALLY BORN IN SOUTHERN CALIFORNIA SOMEWHERE LAGUNA SOMETHING OR OTHER UH AND THEN WENT HE LIVED IN FRESNO HE LIVED IN SAN DIEGO UM HE LIVED IN QUITE A FEW FRESNO AND SAN DIEGO FOR SURE PORTERVILLE HE LIVED IN PORTERVILLE FOR A WHILE UH FRESNO AREA MADERO THAT'S KINDA WHERE HE GREW UP AND THEN HE MOVED TO SACRAMENTO I THINK PROBABLY WHEN HIS MOM DID,0,He -- no he was actually born in southern California somewhere. Laguna something or other uh and then went -- he lived in Fresno. He lived in San Diego um he lived in quite a few -- Fresno and San Diego for sure. Porterville -- he lived in Porterville for a while uh Fresno area. Madero that's kinda where he grew up and then he moved to Sacramento I think probably when his mom did,28.244
/juice/scr/cpajot/data_processed_voc/wav/voc_23_part_71.wav,/juice/scr/cpajot/data_processed_voc/txt/voc_23_part_71.txt,TO DA DAVIS YOU KNOW WE WISH WE COULD LIVE IN DAVIS AND WE'D BE EQUAL DISTANCE BUT BECAUSE WE COULDN'T THERE SHE GOT WE JUST PICKED THIS AREA,0,to Da- +Davis you know we wish we could live in Davis and we'd be equal distance but because we couldn't there she got -- we just picked this area.,6.867999999999999
/juice/scr/cpajot/data_processed_voc/wav/voc_6_part_255.wav,/juice/scr/cpajot/data_processed_voc/txt/voc_6_part_255.txt,YEAH UM TO A CERTAIN EXTENT UH STOCKTON CAN BE CO COOLER COOLER THAN SACRAMENTO CAUSE IT'S CLOSER TO THE THE DELTA UH THERE'S A TOWN JUST BELOW US LODI,0,Yeah um to a certain extent uh Stockton can be co- +cooler cooler than Sacramento cuz it's closer to the -- the delta. Uh there's a town just below us -- Lodi,19.817999999999998
/juice/scr/cpajot/data_processed_voc/wav/voc_30_part_59.wav,/juice/scr/cpajot/data_processed_voc/txt/voc_30_part_59.txt,IF YOU GO ONE WAY THERE'S SOME REALLY POOR AND IF YOU GO ACROSS THE STREET AND OVER THERE'S SOME REALLY REALLY NICE HOUSES SO IT'S VERY CLOSE UM BUT,0,"if you go one way, there's some really poor and if you go across the street and over there's some really really nice houses so it's very close um but",9.808
/juice/scr/cpajot/data_processed_voc/wav/voc_0_part_294.wav,/juice/scr/cpajot/data_processed_voc/txt/voc_0_part_294.txt,YES I USED TO RIDE IN THE BAREBACK AND UH MY UH FIRST HORSE THAT I RODE WAS IN HAYFORK HAYFORK UH RODEO AND THE HORSE WAS NAMED PDQ PRETTY DAMNED QUICK AND HE WAS HE TIPPED US LIKE THAT AND PUT ME IN THERE,0,Yes I used to ride in the bareback and uh my uh first horse that I rode was in Hayfork Hayfork uh Rodeo and the horse was named PDQ Pretty Damned Quick and he was He tipped us like that and put me in there,20.785999999999998
/juice/scr/cpajot/data_processed_voc/wav/voc_10_part_73.wav,/juice/scr/cpajot/data_processed_voc/txt/voc_10_part_73.txt,FURTHER THIS WAY YOU HAVE GOSFORD CROSSES STOCKDALE,0,further this way you have Gosford ... crosses Stockdale,7.042000000000001
/juice/scr/cpajot/data_processed_voc/wav/voc_15_part_13.wav,/juice/scr/cpajot/data_processed_voc/txt/voc_15_part_13.txt,WAS HANDED OUT THROUGH THE WINDOW YOU SEE BUT AFTER THAT IN TRINITY CENTER NOT IN CARVILLE BUT IN TRINITY CENTER UH PETER MCDONALD GOT SOME BOXES THAT WERE WHERE YOU EVEN HAD A COMBINATION AND UH YOU COULD GET YOUR OWN MAIL THEY SAY BUT UH,0,was handed out through the window you see but after that in Trinity center not in Carville but in Trinity center uh Peter McDonald got some boxes that were where you even had a combination and uh you could get your own mail they say but uh,17.96
/juice/scr/cpajot/data_processed_voc/wav/voc_34_part_342.wav,/juice/scr/cpajot/data_processed_voc/txt/voc_34_part_342.txt,THEY'VE PLAY IT ALL THE TIME AND I TH THEY'RE THE KIND OF PEOPLE THAT WHEN THEY AND IT'S NOT A BAD THING BUT WHEN THEY START SOMETHING THEY,0,"they've (( )) play it all the time, and {LS} {BR} i- -- th- -- they're the kind of people {LS} {BR} that when, they and it's not a bad thing {BR} but when they start something they",9.811
/juice/scr/cpajot/data_processed_voc/wav/voc_8_part_252.wav,/juice/scr/cpajot/data_processed_voc/txt/voc_8_part_252.txt,LOT OF BUILT IN OBSOLESCENCE THAT'S WHY WE H THAT'S WHY APPLE ANNOUNCED THE SIX YESTERDAY AS OPPOSED TO THE FIVE WHICH I'M NOT EVEN MOVING BEYOND THE THREE,0,"lot of built-in obsolescence. That's why we h -- that's why Apple announced the Six yesterday as opposed to the Five, which I'm not even moving beyond the Three! {NG}",11.245
/juice/scr/cpajot/data_processed_voc/wav/voc_24_part_236.wav,/juice/scr/cpajot/data_processed_voc/txt/voc_24_part_236.txt,WAS RUNNING LATE COMING INTO OUR LITTLE MORNING MEETING THING WE HAD BYE AND UM ONE OF THE PRISONERS HAD HUNG HIMSELF,0,was running late coming into our little morning meeting thing we had [laughter] Bye. and um one of the prisoners had hung himself,12.022
/juice/scr/cpajot/data_processed_voc/wav/voc_23_part_27.wav,/juice/scr/cpajot/data_processed_voc/txt/voc_23_part_27.txt,MY MOM HAD A SIGN WE HAD A SIGN ON OUR WALL THAT SAID THERE'S TWO THINGS TWO LIFELONG BEQUESTS A PARENT CAN GIVE THEIR KIDS ONE IS ROOTS AND THE OTHER IS WINGS SO IT WAS LIKE YOU ALWAYS HAVE A HOME HERE BUT WE WANT YOU TO EXPLORE SO I MEAN WE KINDA LEARNED THAT SO YEAH EVERYONE WANTED TO GET OUT OF SACRAMENTO,0,My mom had a sign -- we had a sign on our wall that said there's two things two lifelong bequests a parent can give their kids. One is roots and the other is wings so it was like you always have a home here but we want you to explore so I mean we kinda learned that so yeah everyone wanted to get out of Sacramento.,16.245
/juice/scr/cpajot/data_processed_voc/wav/voc_10_part_269.wav,/juice/scr/cpajot/data_processed_voc/txt/voc_10_part_269.txt,YEAH THEY TELL YOU IF YOU'RE GONNA GO IN THERE TO WEAR A LIFE JACKET BUT WE HAVE A LOT OF PEOPLE COME UP FROM L A,0,yeah ... they tell you if you're gonna go in there to wear a life jacket but we have a lot of people come up from l-a,7.544
/juice/scr/cpajot/data_processed_voc/wav/voc_32_part_81.wav,/juice/scr/cpajot/data_processed_voc/txt/voc_32_part_81.txt,I JUST REMEMBER IT BEING FENTANYL BECAUSE THE GUY WAS SAYING OKAY I'M GOING TO TELL YOU WHAT I'M PUTTING INTO YOUR I V AS YOU'RE DOING IT AND HE SAID FENTANYL AND THEN I DON'T REMEMBER ANYTHING,0,"I just remember it being Fentanyl because the guy was saying ""OK I'm going to tell you what I'm putting into your I V as you're doing it"" and he said Fentanyl and then I don't remember anything.",7.83
/juice/scr/cpajot/data_processed_voc/wav/voc_18_part_266.wav,/juice/scr/cpajot/data_processed_voc/txt/voc_18_part_266.txt,OKAY FORTY FOUR AND UH HERE'S SHINGLETOWN,0,okay forty four and uh here's Shingletown,5.686
/juice/scr/cpajot/data_processed_voc/wav/voc_16_part_146.wav,/juice/scr/cpajot/data_processed_voc/txt/voc_16_part_146.txt,THA U TH I I DON'T THINK YEAH I I YES IT HAS TO BE I'M PRETTY SURE THAT HASN'T CHANGED YEAH BUT UH YOU COULD BE A COMMUNITY SERVICE OFFICER YEAH SO SHE UM SHE DID OKAY YEAH SHE MADE IT THROUGH YEAH JUST IF MY HUSBAND HEARS ANY W WOULD HEAR ANYTHING ON THE RADIO,0,"Tha- u- th- i- I don't think, yeah, I I yes, it has to be, I'm pretty sure that hasn't changed, yeah. But uh, you could be a community service officer. Yeah, so she um she did okay, yeah, she made it through. Yeah. {LG} Just if my husband hears any w- would hear anything on the radio,",20.398
/juice/scr/cpajot/data_processed_voc/wav/voc_35_part_84.wav,/juice/scr/cpajot/data_processed_voc/txt/voc_35_part_84.txt,WHEN YOU DO EVERYTHING YOUR ENTIRE LIFE IN THE SAME CITY YOU'RE GONNA RUN INTO YOU KNOW THAT AND SO HE'S USED TO IT NOW,0,when you do everything your entire life in the same city you're gonna run into you know that and so he's used to it now,9.472999999999999
/juice/scr/cpajot/data_processed_voc/wav/voc_13_part_239.wav,/juice/scr/cpajot/data_processed_voc/txt/voc_13_part_239.txt,I DON'T KNOW ABOUT ANY OTHERS CREEK YOU HEAR CREEK MY AUNT MY AUNT WILL SAY CREEK UM YEAH THAT'S PROBABLY IT,0,I don't know about any others  creek you hear creek my aunt my aunt will say creek  um  yeah that's probably it  ,17.938
/juice/scr/cpajot/data_processed_voc/wav/voc_9_part_51.wav,/juice/scr/cpajot/data_processed_voc/txt/voc_9_part_51.txt,IT JUST WASN'T DISCUSSED OTHER THAN THEY DIDN'T LIKE THE TURKS BUT YOU KNOW THAT WAS THAT WAS IT I WANTED TO INVITE A TURKISH FOREIGN EXCHANGE STUDENT TO OUR HOUSE FOR DINNER I WAS A SOPHOMORE OR JUNIOR IN HIGH SCHOOL,0,It just wasn't discussed other than they didn't like the Turks but you know that was -- that was it. I wanted to invite a Turkish foreign exchange student to our house for dinner. I was a sophomore or junior in high school,20.049
/juice/scr/cpajot/data_processed_voc/wav/voc_27_part_107.wav,/juice/scr/cpajot/data_processed_voc/txt/voc_27_part_107.txt,JUST LIKE WE'RE JUST FAMILY WE'RE JUST YOU KNOW JUST THIS BIG FAMILY AND UH THAT FEELS REALLY GOOD SO I'M HAPPY SO,0,just like we're just family we're just you know just this big family and uh that feels really good so I'm happy so,15.185
/juice/scr/cpajot/data_processed_voc/wav/voc_32_part_24.wav,/juice/scr/cpajot/data_processed_voc/txt/voc_32_part_24.txt,BUT NO YEAH SO WE LOST I THINK THEY SAID THEY LOST ALMOST A HUNDRED STUDENTS BUT THEN ONE OF THE OTHER LOCAL PRIVATE SCHOOLS CLOSED AND WE GOT A LOT OF THE STUDENTS,0,"But no Yeah, so We lost, I think they said they lost almost a hundred students, but then one of the other local private schools closed and we got a lot of the students",9.681000000000001
/juice/scr/cpajot/data_processed_voc/wav/voc_37_part_1.wav,/juice/scr/cpajot/data_processed_voc/txt/voc_37_part_1.txt,MY MOM'S SIDE OF THE FAMILY HAS BEEN HERE FOR LIKE MANY MANY GENERATIONS AND IN FACT UM,0,my mom's side of the family has been here for like many many generations and in fact um,5.48
/juice/scr/cpajot/data_processed_voc/wav/voc_8_part_5.wav,/juice/scr/cpajot/data_processed_voc/txt/voc_8_part_5.txt,IS A PRACTICING ATTORNEY DOWN IN THE BAY AREA HE HAD JUST ACQUIRED A LOT MY OTHER MAIN INTERESTS WHEN I WAS IN SCHOOL WAS MATH ENGINEERING I WOULD'VE HAD I NOT GONE LIFE SCIENCES I PROBABLY WOULD'VE BEEN AN ENGINEERING MAJOR AND HE BASICALLY HAD BOUGHT A LOT UP IN THE OAKLAND HILLS I CHOSE TO,0,"is a practicing attorney down in the Bay Area, he had just acquired a lot. My other main interests when I was in school was math, engineering, I would've -- had I not gone life sciences, I probably would've been an engineering major. And he basically had bought a lot up in the Oakland hills. I chose to",20.025
/juice/scr/cpajot/data_processed_voc/wav/voc_24_part_220.wav,/juice/scr/cpajot/data_processed_voc/txt/voc_24_part_220.txt,IF IT NEEDS TO I DON'T KNOW I TIME WILL TELL I MEAN A LOT OF STUFF HAS HAPPENED OVER THE YEARS THAT YOU KNOW LIKE MY GREAT GRANDMOTHER THAT LIVED TO HUNDRED AND FOUR SHE SHE WAS ALIVE FROM EIGHTEEN EIGHTY SIX TO NINETEEN NINTY THAT TIME RANGE,0,if it needs to. I don't know. I time will tell I mean a lot of stuff has happened over the years that you know like my great grandmother that lived to hundred and four she she was alive from eighteen eighty six to nineteen ninty that time range,21.471999999999998
/juice/scr/cpajot/data_processed_voc/wav/voc_28_part_160.wav,/juice/scr/cpajot/data_processed_voc/txt/voc_28_part_160.txt,AND I WHEN WE WERE GONNA TAKE THE BOAT OUT AND LOAD IT YOU KNOW GET IT ON THE TRAILER AND IT WAS PRETTY PRETTY STEEP HILL AND YOU KNOW PITCH TO GO UP AND I'D HAVE HER GET IN THE BOAT THERE AND AND AND I I'D SIGNALING HERE TO TO TO,0,and I- when we were gonna take the boat out and load it you know get it on the trailer and it was pretty pretty steep hill [inaudible] and you know pitch to go up and I'd have her get in the boat there and and and I- I'd signaling here to to to,20.901999999999997
/juice/scr/cpajot/data_processed_voc/wav/voc_20_part_71.wav,/juice/scr/cpajot/data_processed_voc/txt/voc_20_part_71.txt,UM WE ARE IN SOMEWHAT OF A CENTRAL LOCATION SO WE DO HAVE LIKE BIG EVENTS COME THIS WAY LIKE A LOT OF CONCERTS AND STUFF LIKE THAT SO THERE IS STUFF TO DO AND IF NOT WE'RE IN MORE OF A CENTRAL LOCATION SO WE CAN GO OTHER PLACES LIKE WE'RE NOT TOO FAR FROM THE BAY AREA SO WE CAN GO THERE IF WE WANT TO UM WE OF COURSE HAVE THE STATE FAIR HERE SO THAT'S ALWAYS FUN SURPRISINGLY I ACTUALLY DIDN'T GET TO GO TO THAT UNTIL ABOUT TWO YEARS AGO,0,Um we are in somewhat of a central location so we do have like big events come this way like a lot of concerts and stuff like that so there is stuff to do and if not we're in more of a central location so we can go other places like we're not too far from the bay area so we can go there if we want to. Um we of course have the state fair here so that's always fun. Surprisingly I actually didn't get to go to that until about two years ago,25.784000000000002
/juice/scr/cpajot/data_processed_voc/wav/voc_7_part_262.wav,/juice/scr/cpajot/data_processed_voc/txt/voc_7_part_262.txt,THAT CAME OUT IT'S A STEINBECK STAMP FOR THE POST OFFICE SO THEY HAD THE BIG DEAL HERE AT THE LIBRARY I GOT SOME KIDS AND WE DID SOME READINGS AND THEN WE WENT OUT TO SHERWOOD THAT NIGHT AND UH PER PERFORMED THE ORCHESTRA PERFORMED AND THEN WE DID SOME MORE READINGS OUT THERE IT WAS FUN,0,that came out it's a Steinbeck stamp for the post office so they had the big deal here at the library. I got some kids and we did some readings and then we went out to Sherwood that night and uh per- +performed the orchestra performed and then we did some more readings out there. It was fun,21.63
/juice/scr/cpajot/data_processed_voc/wav/voc_18_part_111.wav,/juice/scr/cpajot/data_processed_voc/txt/voc_18_part_111.txt,NOT MOTEL BUT HOTEL WHICH WAS ON FIRST AND CARS CARSON AND RIGHT OFF OF FREEMONT STREET THERE WALKED TO THIS OLD HOTEL LIKE A THREE STORY HOTEL AND I GIVE THEM A M I PAID FOR A WEEK'S RENT AND I GIVE THEM THE KEY DEPOSIT I WALKED BACK AND THE THE ROOM JUST,0,not motel but hotel which was on first and Cars- Carson and right off of Freemont street there walked to this old hotel like a three story hotel and I give them a m- I paid for a week's rent and I give them the key deposit I walked back and the- the room just,21.164
/juice/scr/cpajot/data_processed_voc/wav/voc_32_part_124.wav,/juice/scr/cpajot/data_processed_voc/txt/voc_32_part_124.txt,AND UM IT'S NOW KITCHEN ACADEMY IS UM NO HE GRADUATED FROM THE KITCHEN ACADEMY IT'S NOW LE CORDON BLEU AND UM,0,"And, um, it's now Kitchen Academy, is um no he graduated from the Kitchen Academy. It's now Le Cordon Bleu. And, um",8.91
/juice/scr/cpajot/data_processed_voc/wav/voc_35_part_109.wav,/juice/scr/cpajot/data_processed_voc/txt/voc_35_part_109.txt,SO YOU KNOW THE FOCUS NOW IS TRYING JUST TO KEEP 'EM ENGAGED IN CLASS AND HE UM ENDED UP WITH AN EXTRA CLASS AND NOW HE'S GOT A HUNDRED TWENTY PERCENT HE HAS AN EXTRA CLASS OF FRESHMEN AND HE SAID I DON'T KNOW IF I'LL BE ABLE TO EVER DO IT AGAIN BUT WE'LL TRY IT THIS THIS YEAR,0,so you know the focus now is trying just to keep 'em engaged in class and he um ended up with an extra class and now he's got a hundred twenty percent He has an extra class of freshmen and he said I don't know if I'll be able to ever do it again but we'll try it this -- this year,21.296
/juice/scr/cpajot/data_processed_voc/wav/voc_15_part_125.wav,/juice/scr/cpajot/data_processed_voc/txt/voc_15_part_125.txt,AND AND SO YOU'RE UM DOING A AH A PAPER HUH,0,[sigh] and and so you're um doing a ah- a paper huh,6.696000000000001
/juice/scr/cpajot/data_processed_voc/wav/voc_24_part_64.wav,/juice/scr/cpajot/data_processed_voc/txt/voc_24_part_64.txt,HE PROBABLY WILL UM BECAUSE OF THE DISTRICT HE'S IN HE PROBABLY WILL GO TO ENTERPRSIE OKAY SO BUT BETWEEN MY MOM'S PHILANTHROPIC GROUP AND MY DAD BEING A TEACHER I ALWAYS FELT LIKE I WAS MORE COMFORTABLE AROUND ADULTS,0,He probably will um because of the district he's in he probably will go to Enterprsie. Okay. So but between my mom's philanthropic group and my dad being a teacher I always felt like I was more comfortable around adults,17.256
/juice/scr/cpajot/data_processed_voc/wav/voc_25_part_71.wav,/juice/scr/cpajot/data_processed_voc/txt/voc_25_part_71.txt,I MEAN IT'S IT'S A IT'S A RAT RACE SO I KNOW MY PARENTS WERE RIGHT IN THAT RECORD THEY REALIZED THAT MY CHANCES OF REALLY MAKING IT MAKING A LIVING AT THAT WERE PRETTY SLIM AND THEY WERE RIGHT UM BUT THE REASON I'M A LITTLE SORRY ABOUT NOT GOING INTO IT SOONER IS NOT NECESSARILY THAT I WOULD'VE BEEN A FAMOUS HOLLYWOOD STAR,0,I mean it's -- it's a -- it's a rat race so I know my parents were right in that record. They realized that my chances of really making it -- making a living at that were pretty slim and they were right um but the reason I'm a little  sorry about not going into it sooner is not necessarily that I would've been a famous Hollywood star,22.969
/juice/scr/cpajot/data_processed_voc/wav/voc_32_part_186.wav,/juice/scr/cpajot/data_processed_voc/txt/voc_32_part_186.txt,NO NOT REALLY THAT HAD BEEN THE FIRST TIME IN TWO YEARS I HAD BEEN OUT OF CALIFORNIA UM,0,"No, not really. That had been the first time in two years I had been out of California Um",6.5360000000000005
/juice/scr/cpajot/data_processed_voc/wav/voc_8_part_12.wav,/juice/scr/cpajot/data_processed_voc/txt/voc_8_part_12.txt,BASICALLY I WORKED FOR TWELVE YEARS IN VETERINARY MEDICINE IN THE LOCAL AREA UH IN SACRAMENTO UM ONE OF THE EARLY VETERINARIANS OF THIS AREA DOCTOR RONALD T HAUGE I STARTED WITH HIM AS THEY WERE PERSONAL FRIENDS OF OUR FAMILY UM THEIR FAMILY AND OUR FAMILY AN' 'MEMBER SEVERAL OF HIS SONS AND I WERE REALLY CLOSE UM,0,"Basically, I worked for twelve years in veterinary medicine in the local area uh, in Sacramento um. One of the early veterinarians of this area, Dr. Ronald T Hauge -- I started with him as -- they were personal friends of our family, um. Their family and our family an' -- 'member several of his sons and I were really close, um.",24.145
/juice/scr/cpajot/data_processed_voc/wav/voc_7_part_246.wav,/juice/scr/cpajot/data_processed_voc/txt/voc_7_part_246.txt,YEAH BUT I WAS UH TWO MAYBE MAYBE THREE I TOOK IT HOME AND UH TORE IT UP MHM AND SHE GAVE ME BROTHER ONE I USED IT FOR A DART BOARD LATER HUNG IT ON MY WALL AND STARTED CHUCKING THINGS AT IT,0,Yeah {LG} but I was uh  two maybe  maybe three.  I took it home and uh tore it up mhm and she gave me brother one. I used it for a dart board later.  Hung it on my wall and (()) started chucking things at it.,23.551
/juice/scr/cpajot/data_processed_voc/wav/voc_13_part_216.wav,/juice/scr/cpajot/data_processed_voc/txt/voc_13_part_216.txt,JUST GOINGS ON AND UM MORE OF A IT'S LACK OF A BETTER WORD UH SORT OF AN ENTERTAINMENT UH INDUSTRY ALMOST UM THIS CENTRALIZED UP HERE I FEEL IS MORE OF,0,just goings on and um [click] more of a  it's lack of a better word uh sort of an entertainment  uh industry almost um this centralized up here I feel is more of,20.479
/juice/scr/cpajot/data_processed_voc/wav/voc_24_part_3.wav,/juice/scr/cpajot/data_processed_voc/txt/voc_24_part_3.txt,NO IT'S JUST SEEMS LIKE EVERYBODY'S KIND OF BUSY AND THE TRAVELING HE HAS A FAMILY DOWN THERE AND SO IT IS A LONG WAYS AND IT IS EXPENSIVE ESPECIALLY IF YOU'RE TAKING YOU KNOW LIKE FOUR PEOPLE OR SO SO,0,No it's just seems like everybody's kind of busy and the traveling. He has a family down there and so it is a long ways and it is expensive especially if you're taking you know like four people or so. So,14.821
