/juice/scr/cpajot/data_processed_voc/wav/voc_35_part_115.wav,/juice/scr/cpajot/data_processed_voc/txt/voc_35_part_115.txt,LIKED IT BUT WASN'T UH ALL THAT INTO IT AND THEN WE DECIDED YOU KNOW WHAT WHY DON'T YOU WORK ON GETTING YOUR DEGREE CAUSE HE HADN'T GOTTEN A DEGREE HE'D BEEN TO COLLEGE LIKE FOR THE LAST FIFTEEN YEARS BUT HE HE HADN'T GOTTEN A DEGREE AND SO SO I'LL JUST GET A DEGREE STAY HOME WITH THE THE KID GET A DEGREE I'LL WORK THAT WAS WHY I NEEDED A JOB THAT COULD SUPPORT THE WHOLE FAMILY,0,Liked it but wasn't uh all that into it and then we decided you know what? Why don't you work on getting your degree cuz he hadn't gotten a degree. He'd been to college like for the last fifteen years but he {LG} - he hadn't gotten a degree and so -- so I'll just get a degree stay home with the -- the kid get a degree I'll work -- that was why I needed a job that could support the whole family,22.758000000000003
/juice/scr/cpajot/data_processed_voc/wav/voc_6_part_50.wav,/juice/scr/cpajot/data_processed_voc/txt/voc_6_part_50.txt,SHE DECIDED NOT TO COME BACK OTHERS CAME BACK AND SOME OF 'EM RE RETURNED RETURNED TO RANCHING AND OTHERS BY THAT TIME THEIR KIDS WERE MY AGE AND THEY TOOK JOBS IN IN FOR THE STATE OR ALL ALL KINDS OF DIFFERENT JOBS,0,she decided not to come back. Others came back and some of 'em re- +returned returned to ranching and others by that time their kids were my age and they took jobs in -- in -- for the state or all - all kinds of different jobs.,21.149
/juice/scr/cpajot/data_processed_voc/wav/voc_32_part_49.wav,/juice/scr/cpajot/data_processed_voc/txt/voc_32_part_49.txt,EVERY YEAR IT'S GOT A LITTLE LESS EXCITING AND I'VE DONE A LITTLE LESS TO CELEBRATE BUT YEAH IT WAS ALWAYS FUN AS A KID,0,"every year it's got a little less exciting, and I've done a little less to celebrate but yeah, it was always fun as a kid",5.92
/juice/scr/cpajot/data_processed_voc/wav/voc_29_part_131.wav,/juice/scr/cpajot/data_processed_voc/txt/voc_29_part_131.txt,YEAH THERE'S I HAVE FRIEND WHO LIKE SOME OF MY GOOD FRIEND ARE THEY KNOW WHAT I WANNA DO FOR A LIVING THINGS LIKE THAT AND UH THEY'RE I DON'T HAVE A LOT OF FRIENDS THAT ARE OTHER PHOTOGRAPHERS I HAVE A FEW FRIENDS THAT ARE WRITERS BUT UH NOT LIKE THE SAME TYPE OF WRITING,0,Yeah there's -- I have friend who like some of my good friend are -- they know what I wanna do for a living -- things like that and uh they're -- I don't have a lot of friends that are other photographers. I have a few friends that are writers but uh not like the same type of writing,15.388
/juice/scr/cpajot/data_processed_voc/wav/voc_0_part_59.wav,/juice/scr/cpajot/data_processed_voc/txt/voc_0_part_59.txt,UH IT WAS JUST I COULDN'T BELIEVE HOW FAST IT WAS IT WAS GROWING AND IT'S I IT'S STILL GROWING TO THIS DAY BUT TO ME I'M GONNA LET IT GROW AND I'LL JUST GO ALONG WITH THE WITH THE TRADE AND UH AND HAVE THAT BUT THERE'S ANOTHER OLD PLACE THAT UH THAT WE USED GO AND THEN,0,uh it was just I couldn't believe how fast it was it was growing. And it's i- it's still growing to this day but to me I'm gonna let it grow and I'll just go along with the with the trade and uh and have that but there's another old place that uh that we used go and then,20.169
/juice/scr/cpajot/data_processed_voc/wav/voc_16_part_130.wav,/juice/scr/cpajot/data_processed_voc/txt/voc_16_part_130.txt,I DON'T KNOW I I I'VE REA I'VE NEVER EVER THOUGHT ABOUT THAT THAT WOULD BE HARD IT WOULD BE BECAUSE EVERYTHING'S HERE I MEAN PRETTY MUCH YOU KNOW I GREW UP UM,0,"I don't know. I I I've rea- I've never ever thought about that. That would be hard. It would be. Because everything's here. I mean, pretty much, you know, I grew up um",10.033999999999999
/juice/scr/cpajot/data_processed_voc/wav/voc_34_part_261.wav,/juice/scr/cpajot/data_processed_voc/txt/voc_34_part_261.txt,BUT UH TH P THE FACT IS THAT THEY'RE OVER I THEY'RE ONE NATIONALITY IS OVERWHELMINGLY THE POPULATION HE HERE HERE'S AN EXAMPLE MY GRANDDAUGHTER,0,"But, uh th- -- p- -- the fact is that {BR} (( )) they're over (( )) -- i- -- they're one nationality is overwhelmingly {BR} the population. {BR} (( )) He- +Here -- Here's an example. {BR} My granddaughter",13.637
/juice/scr/cpajot/data_processed_voc/wav/voc_1_part_164.wav,/juice/scr/cpajot/data_processed_voc/txt/voc_1_part_164.txt,YES I BELIEVE VERY I BELIEVE BAKERSFIELD IS A VERY RELIGIOUS AND MIDDLE OF THE ROAD TO CONSERVATIVE CITY FOR THE MOST PART YOU'RE GOING TO GET MIDDLE OF THE ROAD TO CONSERVATIVE THERE'S NOT A LOT OF LIBERAL THINKING,0,yes I believe very I believe Bakersfield is a very religious and ... middle of the road to conservative ... city ... for the most part you're going to get middle of the road ... to conservative ... there's not a lot of liberal thinking ...,20.053
/juice/scr/cpajot/data_processed_voc/wav/voc_24_part_61.wav,/juice/scr/cpajot/data_processed_voc/txt/voc_24_part_61.txt,YES YEAH WHICH WAS KINDA NEAT BECAUSE YOU KINDA GOT GREAT I ACTUALLY KNEW A LOT OF THE KIDS IN THE CLASS AHEAD OF ME AND THE CLASS BEHIND ME AND BUT AT THE SAME TIME IT WAS KINDA NEAT FRESHMAN TO JUST GO OFF BY YOURSELF AND YOU'RE MEETING ALL THESE KIDS FROM ALL THE OTHER AREAS,0,Yes. Yeah which was kinda neat because you kinda got great I actually knew a lot of the kids in the class ahead of me and the class behind me. and but at the same time it was kinda neat freshman to just go off by yourself and you're meeting all these kids from all the other areas,17.029
/juice/scr/cpajot/data_processed_voc/wav/voc_1_part_57.wav,/juice/scr/cpajot/data_processed_voc/txt/voc_1_part_57.txt,YOU KNOW WHAT WE SO FAR IT'S BEEN A MATTER OF FINDING THE NEEDLE IN A HAYSTACK WE STARTED WITH A HANDFUL OF FRIENDS THAT I KNEW THROUGH REMEMBER THE REGGAE BAND THAT I TOLD YOU ABOUT EARLIER MENTO BURU OKAY WHEN I WANTED TO BE A PUNK ROCK DRUMMER I WENT TO SCHOOL,0,you know what? we so far it's been a matter of finding the needle in a haystack we started with a handful of friends that I knew through remember the reggae band that I told you about earlier Mento Buru okay when I wanted to be a punk rock drummer ... I went to school,20.736
/juice/scr/cpajot/data_processed_voc/wav/voc_18_part_22.wav,/juice/scr/cpajot/data_processed_voc/txt/voc_18_part_22.txt,I WISH I HAD A PICTURE OF JUST MY DAD SO WHAT WE WAS ABLE TO DO IS THIS WOMAN,0,I wish I had a picture of just my dad so what we was able to do is this woman,8.044
/juice/scr/cpajot/data_processed_voc/wav/voc_30_part_15.wav,/juice/scr/cpajot/data_processed_voc/txt/voc_30_part_15.txt,TRAILERS TRAILERS MANSIONS TRAILERS TRAILERS MANSIONS SO,0,"trailers, trailers, mansions, trailers, trailers, mansions so",5.263
/juice/scr/cpajot/data_processed_voc/wav/voc_36_part_115.wav,/juice/scr/cpajot/data_processed_voc/txt/voc_36_part_115.txt,UM BEING FAIR TO PEOPLE AND YOU KNOW CALIFORNIA WAS THE LEADER OF THE SEATBELT LAW ALL CARS MUST HAVE SEATBELTS AND PEOPLE MUST WEAR SEATBELTS AND STUFF LIKE THAT SO YEAH I REMEMBER THAT VIVIDLY YEAH IS IT YEAH W 'CAUSE YOU'RE FROM TEXAS SO YOU HAVE YOU HAVE A,0,"um, being fair to people and you know. California was the leader of the seatbelt law. {LG} (( )) All cars must have seatbelts and people must wear seatbelts and stuff like that, so. Yeah, I remember that vividly. {LG} Yeah. Is it? Yeah, w -- 'cause you're from Texas, so you have -- you have a",18.113
/juice/scr/cpajot/data_processed_voc/wav/voc_30_part_88.wav,/juice/scr/cpajot/data_processed_voc/txt/voc_30_part_88.txt,AS FAR AS THE SCHOOLS UM THE AREAS THAT WE WERE LOOKING THERE THE SCHOOLS LOOK GOOD VERSUS THE COST OF LIVING WHERE MAYBE I COULD ACTUALLY STAY HOME OR MY EVEN MY HUSBAND COULD STAY HOME ONE OF US OR WORK LESS UM SO WE'VE LOOKED AROUND THERE WE LOOKED MAYBE,0,"as far as the schools um-- the areas that we were looking there the schools look good versus the cost of living where maybe I could actually stay home or my-- even my husband could stay home-- one of us, or work less. um so we've looked around there. We looked maybe",15.272
/juice/scr/cpajot/data_processed_voc/wav/voc_36_part_31.wav,/juice/scr/cpajot/data_processed_voc/txt/voc_36_part_31.txt,HE WAS THE FIRST PERSON TO TELL ME THAT I WAS I REALLY HAD POTENTIAL TO BE A PROFESSIONAL WRITER AND INDEED THAT'S WHAT I WENT ON TO DO UM HE ALSO FOR SOME REASON THAT'S COMPLETELY FOREIGN TO ME INSISTED THAT OUR EIGHTH GRADE GRADUATION I NEEDED TO PERFORM A SONG I NEEDED TO SING IN FRONT OF THE ENTIRE CLASS AND I SANG BLESS THE BEASTS AND THE CHILDREN WHICH WAS A POPULAR SONG AT THE TIME THAT UH THE CARPENTERS A BROTHER AND SISTER DUO HAD RECORDED SO I SANG BLESS THE BEASTS AND THE CHILDREN BADLY,0,"He was the first person to tell me that I was -- I really had potential to be a professional writer and indeed that's what I went on to do. Um, he also, for some reason that's completely foreign to me insisted that our eighth grade graduation I needed to perform a song. I needed to sing in front of the entire class. And I sang ""Bless the Beasts and the Children"" {LG} which was a popular song at the time that, uh, the Carpenters, a brother and sister duo, had recorded. So I sang ""Bless the Beasts and the Children"" badly",26.625999999999998
/juice/scr/cpajot/data_processed_voc/wav/voc_1_part_64.wav,/juice/scr/cpajot/data_processed_voc/txt/voc_1_part_64.txt,I WAS JUST TRYING TO FIND THE NEEDLE IN THE HAYSTACK TRYING TO FIND THESE PEOPLE AND STILL AM TRYING TO FIND THEM AND THEN IT SLOWLY HAS BEEN SPREADING FROM THERE THERE'S ONE GIRL IN PARTICULAR THAT WE GOT A HOLD OF WHO WAS VERY HEAVY INTO GOTH AND SHE JUST COULDN'T BELIEVE IT AND WHEN SHE SAW OUR FLYER,0,I was just trying to find the needle in the haystack trying to find these people ... and still am trying to find them ... and then it slowly has been spreading from there ... there's one girl in particular that we got a hold of ... who was very heavy into goth and she just couldn't believe it and when she saw our flyer,20.245
/juice/scr/cpajot/data_processed_voc/wav/voc_6_part_225.wav,/juice/scr/cpajot/data_processed_voc/txt/voc_6_part_225.txt,YEAH OKAY WE GOT A SPROUTS NOT TOO FAR FROM HERE AND I LIKE IT THEY THEY THEY HAVE SOME GOOD STUFF AND UH THEY'RE THEY'RE BEING UH BOTH RAELLY'S AND UH UH SAFEWAY ARE SORT OF IN A THEY THEY REALLY GOT A BUT RAELLY'S EVERY TIME YOU GO THERE YOU DON'T BUY ANYTHING THAT'S NOT ON SALE,0,Yeah Okay we got a Sprouts not too far from here and I like it. They -- they -- they have some good stuff and uh they're -- they're being uh both Raelly's and uh uh Safeway are sort of in a they -- they really got a but Raelly's every time you go there you don't buy anything that's not on sale.,23.358
/juice/scr/cpajot/data_processed_voc/wav/voc_11_part_65.wav,/juice/scr/cpajot/data_processed_voc/txt/voc_11_part_65.txt,I THINK THAT A LOT OF THE BIGGER CITIES OF CALIFORNIA KIND OF LU VIEW SACRAMENTO AS A BIT OF A BACKWATER AND MAYBE NOT AS SOPHISTICATED OR AS ACCOMPLISHED AS THEY MIGHT BE HOWEVER YOU KNOW THERE'S PARTS OF THE BAY AREA THAT ARE WORSE THAN SACRAMENTO LIKE THE EAST BAY AND SOUTH BAY A LOT OF THE UM PARTS OF LOS ANGELES THAT ARE WORSE THAN SACRAMENTO IN MANY REGARDS,0,"I think that a lot of the bigger {CG} cities of California kind of lu- view Sacramento as a bit of a backwater. And maybe not as sophisticated or as accomplished as they might be however you know, there's parts of the Bay Area that are worse than Sacramento. Like the East Bay, and South Bay, a lot of the um, parts of Los Angeles that are worse than Sacramento, in many regards.",25.093000000000004
/juice/scr/cpajot/data_processed_voc/wav/voc_7_part_111.wav,/juice/scr/cpajot/data_processed_voc/txt/voc_7_part_111.txt,SO YEAH YOU COULD SAY WE WERE CO DIRECTING BUT I WAS DOING THE DIRECTING AND UH THEN I GOT REALLY SICK IN TWENTY TEN ENDED UP IN A COMA FOR TWO WEEKS I GUESS AND IT'S A DIABETIC COMA,0,So yeah you could say we were co-directing but I was doing the directing and uh then I got really sick in two thousand ten. Ended up in a coma for two weeks I guess and it's a diabetic coma,17.976
/juice/scr/cpajot/data_processed_voc/wav/voc_6_part_228.wav,/juice/scr/cpajot/data_processed_voc/txt/voc_6_part_228.txt,YEAH BUT WHAT WHAT IT AMOUNTS TO THEY TRY AND AND EACH AREA THEY'RE IN YOU KNOW TO SPONSOR THINGS BUT THEY PUT THE THEIR MONEY IN IN INTO THINGS LIKE THE NEW MUSEUM A AND AND UH HE THE BALLET YOU SEE THAT THEY'RE AMONGST SOME MAJOR,0,{LG} Yeah but what -- what it amounts to they try and -- and each area they're in you know to sponsor things but they put the -- their money in -- in -- into things like the new museum a- +and and uh he -- the ballet you see that they're amongst some major,21.409000000000002
/juice/scr/cpajot/data_processed_voc/wav/voc_24_part_63.wav,/juice/scr/cpajot/data_processed_voc/txt/voc_24_part_63.txt,SO BUT I LIKED IT I I LIKED THE WAY IT WAS BROKEN UP IT KINDA IT GAVE YOU A NICE BREAK I MEAN LIKE MY SON NOW HIS SCHOOL HE STARTED AT KINDERGARTEN HE'LL BE THERE THROUGH EIGHTH GRADE AND THEN HE'LL GO TO HIGH SCHOOL,0,So but I liked it. I I liked the way it was broken up it kinda it gave you a nice break. I mean like my son now his school he started at Kindergarten he'll be there through eighth grade and then he'll go to high school,12.255999999999998
/juice/scr/cpajot/data_processed_voc/wav/voc_35_part_2.wav,/juice/scr/cpajot/data_processed_voc/txt/voc_35_part_2.txt,THAT'S KINDA FUNNY UH IT'S OBVIOUS THAT WE USE SLANG IN OUR HOUSEHOLD WELL I WAS A BANKER NOW I'M A HOMEMAKER,0,{LG} That's kinda funny. Uh it's obvious that we use slang in our household .  Well I was a banker.  Now I'm a homemaker ,20.609
/juice/scr/cpajot/data_processed_voc/wav/voc_38_part_107.wav,/juice/scr/cpajot/data_processed_voc/txt/voc_38_part_107.txt,I USED TO MAKE A LOT OF TRIPS MY GRANDMA USED TO LIVE IN A TOWN CALLED ALTURAS WHICH IS WAY NORTH OF CALIFORNIA AND IT'S NEAR THE OREGON BORDER AN' A LOT OF SMALL TOWNS UP THERE IT'S ALTURAS IT'S MODOC COUNTY,0,"I used to make a lot of trips -- my grandma used to live in a town called Alturas. Which is way north of California and it's near the Oregon border an' a lot of small towns up there -- it's Alturas, it's Modoc County.",13.202
/juice/scr/cpajot/data_processed_voc/wav/voc_32_part_199.wav,/juice/scr/cpajot/data_processed_voc/txt/voc_32_part_199.txt,I DON'T THINK SO BUT HE DOES WORK FOR HIM AND HE DOES MAKE HIMSELF A LOT OF MONEY SO UM A COUPLE OTHER FRIENDS HERE AND THERE UM I HAVE FRIENDS WHO ARE NOW DOCTORS WHICH MAKES ME FEEL HORRIBLE ABOUT WHAT I I KNOW CAUSE I'M I'M TWENTY FOUR AND I STILL HAVEN'T GRADUATED MY BACHELOR'S DEGREE AND LIKE SOME FRIENDS THAT GRADUATED A LITTLE BIT BEFORE ME UM ONE OF THEM ONE OF THEM'S MY AGE AND HE'S IN HIS INTERNSHIP,0,I don't think so but he does work for him and he does make himself a lot of money so Um a couple other friends here and there. Um I have friends who are now doctors which makes me feel horrible about what I -- I know cause I'm -- I'm twenty four and I still haven't graduated my bachelor's degree And like some friends that graduated a little bit before me um one of them -- one of them's my age and he's in his internship,22.05
/juice/scr/cpajot/data_processed_voc/wav/voc_24_part_140.wav,/juice/scr/cpajot/data_processed_voc/txt/voc_24_part_140.txt,IT WAS GOING DOWN THE CLIFFS AND IT WAS JUST LIKE WOW THAT'S THE HOUSE,0,it was going down the cliffs. And it was just like Wow that's the house. [laughter],7.075
/juice/scr/cpajot/data_processed_voc/wav/voc_18_part_233.wav,/juice/scr/cpajot/data_processed_voc/txt/voc_18_part_233.txt,WHEN I WAS AT UH WHEN I WAS IN PORT ANGELES WE WENT UP TO HURRICANE RIDGE AND AND THEN IT'S TWENTY SIX DOLLARS TO GO IN THERE FOR THE DAY AND THAT GOT ME IN THERE WHEN WE WERE COMING BACK THE OTHER DAY WE STOPPED AT UH CASTLE CRAG STATE PARK AND EVEN THE VISITOR'S CENTER WAS FULL SO WE COULDN'T GET IN BUT,0,when I was at uh when I was in Port Angeles we went up to hurricane ridge and and then it's twenty six dollars to go in there for the day and that got me in there when we were coming back the other day we stopped at uh Castle Crag State Park and even the visitor's center was full so we couldn't get in but,20.279
/juice/scr/cpajot/data_processed_voc/wav/voc_33_part_90.wav,/juice/scr/cpajot/data_processed_voc/txt/voc_33_part_90.txt,IT'S JUST STARTING I'VE JUST NOTICED IT A FEW TIMES ON THE NEWS OR A FEW PEOPLE WILL SAY IT AND IT USED TO BE STRICTLY A SOUTHERN CALIFORNIA THING BUT I THINK IT I'VE HEARD IT A FEW TIMES HERE,0,It's just starting I've just noticed it a few times on the news or a few people will say it and it used to be strictly a southern California thing but I think it I've heard it a few times here.,13.505
/juice/scr/cpajot/data_processed_voc/wav/voc_34_part_351.wav,/juice/scr/cpajot/data_processed_voc/txt/voc_34_part_351.txt,YEAH S INTERESTING ABOUT SALINAS HOW HOW YOU I THIS U UPSIDE DOWN RIVER IS SALINAS UPSIDE DOWN RIVER IS REALLY REALLY I BUT THE THING YOU YOU KNOW MY FRIEND WHO I'M STILL FRIENDS WITH FROM SACRED HEART SCHOOL CECILIA ELKINGTON LIVES IN,0,"Yeah, s- Interesting about Salinas how -- how you {BR} i- -- this u- -- upside down river is {LS} {BR} Salinas Upside Down River is really really {BR} i- {BR} But the thing you you know, my friend who I'm still *friends with from Sacred Heart School {LS} {BR} Cecilia Elkington {BR} lives in",20.18
/juice/scr/cpajot/data_processed_voc/wav/voc_28_part_266.wav,/juice/scr/cpajot/data_processed_voc/txt/voc_28_part_266.txt,THINGS WERE A LOT DIFFERENT THEY WERE A LOT SIMPLER WHEN WE WERE KIDS YOU KNOW IT I'D I'D HATE TO BE I'D HATE TO BE A YOUNG PERSON NOW REALLY CAUSE I YOU KNOW TO US YOU KNOW THEY YOU KNOW THAT WAS THE THE THAT W THOSE THOSE WERE REALLY THE GOOD TIMES YOU KNOW THEY'D,0,things were a lot different they were a lot simpler when we were kids you know it I'd I'd hate to be I'd hate to be a young person now really cuz I [inaudible] you know to us you know they you know that was the the- that w- those those were really the good times you know they'd,21.448
/juice/scr/cpajot/data_processed_voc/wav/voc_1_part_187.wav,/juice/scr/cpajot/data_processed_voc/txt/voc_1_part_187.txt,DESERT I REALLY HAVE NO IDEA AM I ANSWERING YOUR QUESTIONS,0,desert I really have no idea am I answering your questions,5.047
/juice/scr/cpajot/data_processed_voc/wav/voc_4_part_127.wav,/juice/scr/cpajot/data_processed_voc/txt/voc_4_part_127.txt,I DO I DO I MEAN AND I DON'T KNOW WHETHER OUR BEING THE STATE CAPITAL TOO HOW MUCH THAT AFFECTS IT AND ALL THE POLITICIANS WE HAVE HERE AND ALL THE PEOPLE WHO WORK FOR THE GOVERNMENT IN SACRAMENTO AND,0,I do I do. I mean and I don't know whether our being the state capital too how much that affects it and all the politicians we have here and all the people who work for the government in Sacramento and -- ,15.272
/juice/scr/cpajot/data_processed_voc/wav/voc_0_part_117.wav,/juice/scr/cpajot/data_processed_voc/txt/voc_0_part_117.txt,ALL OF THE TREES AND THE GRASS AND THE FIRES AND EVERYTHING I'D HAVE TO GO OUT AND TAKE THE TRACTOR AND MOW ALL THAT DOWN WELL IT GOT TO THE POINT WHERE IT WAS JUST TOO MUCH FOR ME AND THAT'S WHY WE SOLD IT UH IT'S BECAUSE I WAS GETTING UP IN AGE AND AND UH,0,All of the trees and the grass and the fires and everything I'd have to go out and take the tractor and mow all that down. Well it got to the point where it was just too much for me and that's why we sold it. Uh it's because I was getting up in age and and uh,20.28
/juice/scr/cpajot/data_processed_voc/wav/voc_24_part_149.wav,/juice/scr/cpajot/data_processed_voc/txt/voc_24_part_149.txt,BOTH YOU KNOW IN FRONT OF YOU AND BEHIND YOU GET INTO TRAFFIC WHEN YOU CAN SO BUT SO YEAH I HAVEN'T GONE ACTUALLY TOO MANY PLACE EVEN THOUGH I'VE LIVED HERE MY WHOLE LIFE I HAVEN'T REALLY GONE TOO MANY PLACES UM THIS YEAR,0,both you know in front of you and behind you. Get into traffic when you can so but so yeah I haven't gone actually too many place even though I've lived here my whole life I haven't really gone too many places um this year,20.016
/juice/scr/cpajot/data_processed_voc/wav/voc_32_part_89.wav,/juice/scr/cpajot/data_processed_voc/txt/voc_32_part_89.txt,SHE JUST TOOK IT SHE WAN WANTED SHE KNEW SHE WANTED TO TAKE IT FOR HER LANGUAGE IN COLLEGE UM SHE JUST DIDN'T REALIZE HOW MUCH SHE WOULD LIKE IT,0,She Just took it. She wan- +wanted she knew she wanted to take it for her language in college Um. She just didn't realize how much she would like it.,7.96
/juice/scr/cpajot/data_processed_voc/wav/voc_33_part_52.wav,/juice/scr/cpajot/data_processed_voc/txt/voc_33_part_52.txt,IN HIGH SCHOOL SHEESH GOSH I DON'T REMEMBER,0,In high school?  Sheesh  Gosh I don't remember. {LG},14.562000000000001
/juice/scr/cpajot/data_processed_voc/wav/voc_28_part_400.wav,/juice/scr/cpajot/data_processed_voc/txt/voc_28_part_400.txt,BUT IT'S UH IT IT IT'S CHANGED THINGS AROUND AND S IN SO SOME OF THE AREAS COURSE PEOPLE THERE'S A LOT OF PEOPLE RIGHT HERE IN TOWN THAT ARE GOT A PATCH IN THEIR YARD BUT THERE'S PEOPLE THAT ARE,0,but it's uh it- it it's changed things around and s- in so- some of the areas course people there's a lot of people right here in town that are got a patch in their yard [inaudible] but there's people that are,20.215999999999998
/juice/scr/cpajot/data_processed_voc/wav/voc_28_part_59.wav,/juice/scr/cpajot/data_processed_voc/txt/voc_28_part_59.txt,AND A RIGGER THAT RAN BE THEY'D USUALLY RIDE UP THE HILL WITH ME ON THE CAT AND AND UH UH THE THE RIGGER WOULD FIGURE OUT WHICH LOGS HE WANTED TO GET AND WHERE HE WANTED TO TO YOU KNOW I HAD TO BACK THE THE ARCH UP TO GET IT UP THERE WHERE THEY COULD HOOK HOOK THEM UP AND UH THEY DIDN'T LIKE TO PULL,0,and a rigger that ran be- they'd usually ride up the hill with me on the CAT and and uh uh the- the rigger would figure out which logs he wanted to get and where he wanted to to you know I had to back the the arch up to get it up there where they could hook hook them up and uh they didn't like to pull,21.537
/juice/scr/cpajot/data_processed_voc/wav/voc_34_part_186.wav,/juice/scr/cpajot/data_processed_voc/txt/voc_34_part_186.txt,PUT HER UH WENT AND AND GOT HER IN THIS PL PLACE SPECIAL PLACE BEAUTIFUL PL PLACE PLACE AND UH,0,"put her, uh, went (( )) and -- and (( )) got her in this pl- +place -- special place, beautiful pl- +place -- place {BR} And, uh {BR}",8.047
/juice/scr/cpajot/data_processed_voc/wav/voc_10_part_435.wav,/juice/scr/cpajot/data_processed_voc/txt/voc_10_part_435.txt,UH ABOUT SPEECH IN KERN COUNTY AND I WONDERED SHE'S DOING SHE'S FROM STANFORD UNIVERSITY AND SHE'S DOING UH RESEARCH ON UH CENTRAL VALLEY S UH PEOPLE IN SPEECH AND AND WHAT YOU THINK OF THE COMMUNITY,0,uh about speech in Kern county ... and I wondered she's doing she's from Stanford University and she's doing uh research on uh Central Valley s- uh ... people in speech and and what you think of the community,20.08
/juice/scr/cpajot/data_processed_voc/wav/voc_0_part_282.wav,/juice/scr/cpajot/data_processed_voc/txt/voc_0_part_282.txt,THAT THIS HAPPENED NOW IF SOMEBODY DOWN IN LOS ANGELES UH WOULD COME UP HERE AND BUY THE PROPERTY AND SAY THAT THAT THEY OWN IT AND THEY GOT CUAGHT YEAH I'D BELIEVE THAT,0,that this happened. Now if somebody down in Los Angeles uh would come up here and buy the property and say that that they own it and they got cuaght yeah I'd believe that.,11.748
/juice/scr/cpajot/data_processed_voc/wav/voc_28_part_181.wav,/juice/scr/cpajot/data_processed_voc/txt/voc_28_part_181.txt,I DID A LOT OF HUNTING A LOT OF FISHING AND ON THE W WEEKENDS THERE WAS A BUT UH,0,I did a lot of hunting a lot of fishing and on the w- weekends there was a- but uh,8.068999999999999
/juice/scr/cpajot/data_processed_voc/wav/voc_10_part_129.wav,/juice/scr/cpajot/data_processed_voc/txt/voc_10_part_129.txt,UH THEY'VE GROWN UP IN THE FAMILY BUSINESS THAT TYPE THING UHUH BUT UM WE STILL A LOT OF PEOPLE WHO HAVE COME IN FROM OUT OF TOWN THAT THAT UH I DON'T KNOW WHEN YOU CALL THEM WEALTHY IT DEPENDS ON WHAT YOU THINK OF AS WEALTHY,0,uh they've grown up in the family business that type thing uhuh [yes] ... but um we still a lot of people who have come in from out of town that that uh ... I don't know when you call them wealthy ... it depends on what you think of as wealthy,19.117
/juice/scr/cpajot/data_processed_voc/wav/voc_4_part_6.wav,/juice/scr/cpajot/data_processed_voc/txt/voc_4_part_6.txt,OH GOD NO YEAH IT'S JUST TOO MANY PEOPLE I MEAN AND THERE'S YOU KNOW SACRAMENTO HAS JUST GROWN OUT BECOME YOU KNOW ALL THE SUB COMMUNITIES THAT IT'S JUST IT'S ONE BIG CITY NOW AND SO NO I DON'T KNOW AND I'M SURE I DIDN'T KNOW EVERYBODY THEN IT JUST YOU KNOW I JUST DON'T SEE PEOPLE LIKE I USED TO,0,Oh God no yeah it's just too many people. I mean and there's you know Sacramento has just grown out become you know all the sub communities that it's just -- it's one big city now and so no I don't know {LG} and I'm sure I didn't know everybody then. It just you know I just don't see people like I used to.,21.459
/juice/scr/cpajot/data_processed_voc/wav/voc_10_part_344.wav,/juice/scr/cpajot/data_processed_voc/txt/voc_10_part_344.txt,UM AND UH JOEY PORTER AND HIS WIFE BOUGHT IT AND TURNED IT INTO A UH DAY CARE CENTER I THINK FOR HANDICAPPED CHILDREN AND I THINK THEY OUTGREW IT BECAUSE NOW THEY HAVE A BIGGER PLACE,0,um ... and uh Joey Porter ... and his wife bought it ... and turned it into a ... uh day care center I think for handicapped children ... and I think they outgrew it because now they have a bigger place,21.261999999999997
/juice/scr/cpajot/data_processed_voc/wav/voc_18_part_140.wav,/juice/scr/cpajot/data_processed_voc/txt/voc_18_part_140.txt,HE WAS LOOKING HE WAS F F POINTING THIS WAY BUT HE T COCKED HIS HEAD ALL THE WAY AROUND AND MY CAMERA I CAN ZOOM ON MY CAMERA SO,0,he was looking he was f- f- pointing this way but he t- cocked his head all the way around and my camera I can zoom on my camera so,8.197000000000001
